UID,SEG,translation,profanity
METALW-001988-0008,No hay problema. Otra sugerencia sería ¡Todos por ellos también!,No problem. Another suggestion would be All for them too!,None
METALW-001988-0009,"¡Genial, gracias!","Great, thank you!",None
METALW-001988-0010,No hay problema.,No problem.,None
METALW-001989-0000,"Hola, ¿en qué puedo ayudarle?","Hi, how can I help you?",None
METALW-001989-0001,"¡Necesito algunas sugerencias de música, por favor!","I need some music suggestions, please!",None
METALW-001989-0002,"Claro, puedo ayudar con eso. ¿Qué género te gustaría?","Sure, I can help with that. What genre would you like?",None
METALW-001989-0003,"En realidad, esto va a ser para una boda. Mi prometida y yo nos casaremos mañana... No somos tan buenos planeando. Ehehe.","Actually, this is going to be for a wedding. My fiancée and I are getting married tomorrow... We're not that good at planning. Hey, hey.",None
METALW-001989-0004,¡Felicidades! ¿Quieres sugerencias clásicas o modernas?,congratulations! Do you want classic or modern suggestions?,None
METALW-001989-0005,Algo de música moderna estaría bien. Los dos fuimos criados en Chopin. Así que lo clásico es demasiado.,Some modern music would be nice. We were both raised in Chopin. So the classic is too much.,None
METALW-001989-0006,¿Qué tal por fin de Etta James?,How about finally Etta James?,None
METALW-001989-0007,"Hmmm, ¿tienes algo más? ¿Tal vez 2-3 canciones más?","Hmmm, do you have anything else? Maybe 2-3 more songs?",None
METALW-001989-0008,¿Qué tal si te llamo para decirte que te amo por Stevie Wonder o Siempre en mi mente por Elvis Presley?,How about I call you to tell you that I love you for Stevie Wonder or Always on my mind for Elvis Presley?,None
METALW-001989-0009,Podríamos ir con Elvis. Eso es excelente. También somos fanáticos del rock and roll en los días dorados. ¡Esto nos hará pasar un momento realmente enérgico!,We could go with Elvis. That's excellent. We are also rock and roll fans on golden days. This will make us spend a really energetic moment!,None
METALW-001989-0010,"¡Genial, encantado de ayudar! ¡Espero que tengas una gran boda!","Great, nice to help! I hope you have a big wedding!",None
METALW-001990-0000,"Hola, ¿en qué puedo ayudarle?","Hi, how can I help you?",None
METALW-001990-0001,¿Puedes darme algunas sugerencias musicales?,Can you give me some musical suggestions?,None
METALW-001990-0002,Me encantaría ayudarte. ¿Qué tipo de música estás buscando?,I'd love to help you. What kind of music are you looking for?,None
METALW-001990-0003,Necesito una canción para tocar en una boda. Algo feliz e inspirador por favor.,I need a song to play at a wedding. Something happy and inspiring please.,None
METALW-001990-0004,¿Estás buscando una canción para bailar por primera vez?,Are you looking for a song to dance to for the first time?,None
METALW-001990-0005,"¡Sí, eso sería genial!","Yes, that would be great!",None
METALW-001990-0006,Siempre he pensado que la canción de Thong de sisqo es perfecta,I've always thought Thong's sisqo song is perfect,None
METALW-001990-0007,"Eso suena como para adultos. Necesito algo más amigable con los niños, ¿qué te parece?","That sounds like adults. I need something more child-friendly, what do you think?",None
METALW-001990-0008,"Bien, ¿qué tal ""el Hokey Pokey"" - que hará que todos los niños involucrados!","Well, how about ""the Hokey Pokey"" -- it will make all the kids involved!",None
METALW-001990-0009,"Perfecto, me encantaría jugar a eso, gracias!","Perfect, I'd love to play that, thank you!",None
METALW-001990-0010,¡De nada!,You are welcome!,None
METALW-001991-0000,"Hola, ¿en qué puedo ayudarle?","Hi, how can I help you?",None
METALW-001991-0001,Necesito algunas sugerencias musicales,I need some musical suggestions,None
METALW-001991-0002,¿Qué tipo de música quieres que te ayude?,What kind of music do you want me to help you?,None
METALW-001991-0003,¿Puedes ayudarme a elegir música para mi boda?,Can you help me choose music for my wedding?,None
METALW-001991-0004,Elijo para ti una canción que será maravillosa para tu boda.,I choose for you a song that will be wonderful for your wedding.,None
METALW-001991-0005,¿Qué canción?,What song?,None
METALW-001991-0006,La canción God Gave Me You será maravillosa para tu desdida.,The song God Gave Me You will be wonderful for your undoing.,None
METALW-001991-0007,Eso suena como una canción decente,That sounds like a decent song.,None
METALW-001991-0008,"Sí, y es una canción maravillosa para tu boda.","Yes, and it's a wonderful song for your wedding.",None
METALW-001991-0009,Gracias por eso,Thanks for that.,None
METALW-001991-0010,Que tengas una boda maravillosa.,Have a wonderful wedding.,None
METALW-001992-0000,"Hola, ¿en qué puedo ayudarle?","Hi, how can I help you?",None
METALW-001992-0001,¿Puedes ayudarme con una selección de música?,Can you help me with a selection of music?,None
METALW-001992-0002,"Claro, ¿qué género te gusta?","Sure, what genre do you like?",None
METALW-001992-0003,Lo necesito para una boda.,I need it for a wedding.,None
METALW-001992-0004,¿Qué tipo de música te interesa?,What kind of music are you interested in?,None
METALW-001992-0005,"Bueno, ¿qué son algunos buenos paseos por las canciones del pasillo para la ceremonia?","Well, what are some good walks through the hall songs for the ceremony?",None
METALW-001992-0006,"Deberías considerar ""Cásate contigo"" de Bruno Mars","You should consider Bruno Mars' ""Marry You""",None
METALW-001992-0007,Me gusta. ¿Algún otro?,I like it. Any other ones?,None
METALW-001992-0008,"""Im Yours"" Jason Mraz","""Im Yours"" Jason Mraz",None
METALW-001992-0009,"Grandes opciones, gracias!","Great options, thank you!",None
METALW-001992-0010,¡bienvenido!,welcome!,None
METALW-001993-0000,"Hola, ¿en qué puedo ayudarle?","Hi, how can I help you?",None
METALW-001993-0001,Me gusta el rock and roll.,I like rock and roll.,None
METALW-001993-0002,¡No todos!,Not all of them!,None
METALW-001993-0003,Y a veces rapear cuando estoy haciendo ejercicio.,And sometimes I rap when I'm working out.,None
METALW-001993-0004,"Bien, ¿qué tal si escuchas a Metallica o Drake mientras haces ejercicio?","Well, how about listening to Metallica or Drake while you're working out?",None
METALW-001993-0005,Qué bueno. Me gusta escuchar al campo mientras estoy sentado junto a la hoguera.,That's nice. I like to listen to the country while I'm sitting by the bonfire.,None
METALW-001993-0006,Bien. ¿Qué tal Montgomery Gentry o Tim Mcgraw,Not bad. How about Montgomery Gentry or Tim Mcgraw,None
METALW-001993-0007,¡Me gustan los dos!,I like both of them!,None
METALW-001993-0008,¡Bien! ¡Son artistas increíbles!,Not bad! They're amazing artists!,None
METALW-001993-0009,¡Gracias bot!,Thank you bot!,None
METALW-001993-0010,seguro. Adiós,sure. Good bye,None
METALW-001994-0000,"Hola, ¿en qué puedo ayudarle?","Hi, how can I help you?",None
METALW-001994-0001,Necesito sugerencias musicales,I need musical suggestions,None
METALW-001994-0002,seguro. Prueba Newcleus 'Freak a zoid'.,sure. Try Newcleus 'Freak a zoid'.,None
METALW-001994-0003,¿Algo más?,Anything else?,None
METALW-001994-0004,Relajado 'Caballo blanco'.,Relaxed 'White Horse'.,None
METALW-001994-0005,¿Qué más?,What else?,None
METALW-001994-0006,Tom Tom Club 'Genio del amor'.,Tom Tom Club 'Genius of Love'.,None
METALW-001994-0007,¿Qué más?,What else?,None
METALW-001994-0008,Gary Numan '¿Son eléctricos los amigos?',Gary Numan 'Are friends electric?',None
METALW-001994-0009,Eso suena bien,That sounds good.,None
METALW-001994-0010,¡Lo es!,It is!,None
METALW-001995-0000,"Hola, ¿en qué puedo ayudarle?","Hi, how can I help you?",None
METALW-001995-0001,"Hola, ¿puedes ayudarme a elegir algo de música para un evento?","Hello, can you help me choose some music for an event?",None
METALW-001995-0002,"Ok, ¿qué década te gusta?","Okay, what decade do you like?",None
METALW-001995-0003,Algún tipo de roca de la década de 1990,Some kind of rock from the 1990s,None
METALW-001995-0004,"Ok, ¿qué hay de Nirvana?","Okay, what about Nirvana?",None
METALW-001995-0005,"Suena bien, ¿tienes otras bandas?","Sounds good, do you have any other bands?",None
METALW-001995-0006,¿arbusto?,bush?,None
METALW-001995-0007,¿Tienes algo que sea bueno para jugar en bodas?,Do you have anything that's good for playing at weddings?,None
METALW-001995-0008,¿Ceremonia o recepción?,Ceremony or reception?,None
METALW-001995-0009,recepción,reception,None
METALW-001995-0010,"Claro, puedo enviar algunas sugerencias basadas en nuestra conversación.","Sure, I can send some suggestions based on our conversation.",None
METALW-001995-0011,Eso sería muy útil,That would be very useful.,None
METALW-001995-0012,"Ok, enviando1 !","Okay, sending1 !",None
METALW-001996-0000,"Hola, ¿en qué puedo ayudarle?","Hi, how can I help you?",None
METALW-001996-0001,"Por favor, ayúdame con la música/",Please help me with the music/,None
METALW-001996-0002,"Claro, ¿con qué puedo ayudarte?","Of course, what can I do for you?",None
METALW-001996-0003,Me gusta el rock n roll y la música rap.,I like rock n roll and rap music.,None
METALW-001996-0004,¿Has intentado escuchar a Led Zeppelin?,Have you tried listening to Led Zeppelin?,None
METALW-001996-0005,Tengo. Tienen un gran muisc.,Have. They have a big muisc.,None
METALW-001996-0006,¿Y los Rolling Stones?,What about the Rolling Stones?,None
METALW-001996-0007,También son fantásticos.,"They're fantastic, too.",None
METALW-001996-0008,¿Qué tal Kanye West?,How about Kanye West?,None
METALW-001996-0009,"Ehh, Kim lo ha arruinado.","Hey, Kim ruined it.",None
METALW-001996-0010,¿Qué hay de Migos?,What about Migos?,None
METALW-001996-0011,"Nunca he oído hablar de ellos. Sin embargo, ha ofrecido buenas sugerencias. Gracias.","I've never heard of them. However, it has offered good suggestions. Thank you.",None
METALW-001997-0000,"Hola, ¿en qué puedo ayudarle?","Hi, how can I help you?",None
METALW-001997-0001,necesita algunas sugerencias de música para mi boda el próximo año,needs some music suggestions for my wedding next year,None
METALW-001997-0002,"Bien, ¿qué tipo de música te gusta?","Well, what kind of music do you like?",None
METALW-001997-0003,Música rock,Rock music,None
METALW-001997-0004,¿Te gusta una cierta década de música rock?,Do you like a certain decade of rock music?,None
METALW-001997-0005,1970a década de 1970,1970s 1970s,None
METALW-001997-0006,"Tal vez llevó a Zeppelin ""Escalera al Cielo""","Maybe he took Zeppelin ""Ladder to Heaven.""",None
METALW-001997-0007,Bien. cualquier otra sugerencia que pueda decirme? escalera al cielo suena un poco trágico,Not bad. any other suggestions you can tell me? ladder to the sky sounds a little tragic,None
METALW-001997-0008,"Podrías interpretar a ""ángel"" de Aerosmith","You could play Aerosmith's ""angel""",None
METALW-001997-0009,Ok sé que la canción creo que hará el truco.,"Okay, I know the song I think will do the trick.",None
METALW-001997-0010,"y ""amor de mi vida"" por la Reina","and ""love of my life"" for the Queen",None
METALW-001998-0000,"Hola, ¿en qué puedo ayudarle?","Hi, how can I help you?",None
METALW-001998-0001,Me gusta la música usic rock,I like usic rock music,None
METALW-001998-0002,¡fantástico! Usted puede disfrutar de nieve en el Sahara por Angunn.,fantastic! You can enjoy snow in the Sahara by Angunn.,None
METALW-001998-0003,Nunca oí hablar de Angunn,I've never heard of Angunn.,None
METALW-001998-0004,"Si no te gusta el trabajo de ese artista, podrías disfrutar de Hunter by Bjork.","If you don't like that artist's work, you could enjoy Hunter by Bjork.",None
METALW-001998-0005,Bjork hace música rara,Bjork makes weird music,None
METALW-001998-0006,¡Ya veo! ¿Podría sugerir Hellbent de Kenna?,I see! Could you suggest Kenna's Hellbent?,None
METALW-001998-0007,Tampoco he oído hablar de Kenna.,I haven't heard of Kenna either.,None
METALW-001998-0008,¡entendido! ¿Hay algo más con lo que pueda ayudarte hoy?,understood! Is there anything else I can help you with today?,None
METALW-001998-0009,¿Puedes encender la música de Creed?,Can you turn on Creed's music?,None
METALW-001998-0010,"Claro, no hay problema. Encendiendo la música de Creed ahora.","Sure, no problem. Turning on Creed's music now.",None
METALW-001998-0011,gracias,Thank you,None
METALW-001998-0012,¡De nada!,You are welcome!,None
METALW-001999-0000,"Hola, ¿en qué puedo ayudarle?","Hi, how can I help you?",None
METALW-001999-0001,Me preguntaba si podrías ayudarme.,I was wondering if you could help me.,None
METALW-001999-0002,Te puede gustar la música de los Beatles.,You can like Beatles music.,None
METALW-001999-0003,¿Se te ocurrió otra idea?,Did you come up with another idea?,None
METALW-001999-0004,La música de los Monkees es popular.,The music of the Monkees is popular.,None
METALW-001999-0005,"Tampoco esa, otra cosa.","Neither does that one, anything else.",None
METALW-001999-0006,A muchos les gustan las canciones de Bing Crosby.,Many like Bing Crosby songs.,None
METALW-001999-0007,A mi mamá le gusta Bing Crosby pero no es mi favorito. ¿Alguna otra idea?,"My mom likes Bing Crosby, but it's not my favorite. Any other ideas?",None
METALW-001999-0008,Una opción popular es el Osmonds.,A popular option is the Osmonds.,None
METALW-001999-0009,No son tan grandes. ¡Pero gracias por tu ayuda!,They're not that big. But thank you for your help!,None
METALW-001999-0010,¡Gracias!,Thank you!,None
METALW-002000-0000,"Hola, ¿en qué puedo ayudarle?","Hi, how can I help you?",None
METALW-002000-0001,sugerencias de música por favor,music suggestions please,None
METALW-002000-0002,¿Qué tipo de música te gustaría?,What kind of music would you like?,None
METALW-002000-0003,Necesito una buena canción para tocar en mi boda,I need a good song to play at my wedding,None
METALW-002000-0004,¿Te gustaría una canción lenta y romántica o una canción más optimista?,"Would you like a slow, romantic song or a more upbeat song?",None
METALW-002000-0005,Me gustaría una canción romántica lenta,I'd like a slow romantic song,None
METALW-002000-0006,¿Qué tal All of Me de John Legend?,How about John Legend's All of Me?,None
METALW-002000-0007,Es una gran elección. ¿Conoces a otro?,It's a great choice. Do you know someone else?,None
METALW-002000-0008,También podrías echar un vistazo a Everything de Michael Buble.,You could also take a look at Everything by Michael Buble.,None
METALW-002000-0009,Lo comprobaré. Gracias por su ayuda,I'll check it out. Thank you for your help,None
METALW-002000-0010,No hay problema. ¡Que tengas una gran boda!,No problem. Have a big wedding!,None
METALW-002001-0000,"Hola, ¿en qué puedo ayudarle?","Hi, how can I help you?",None
METALW-002001-0001,"Hola, necesito buscar algo de música.","Hi, I need to get some music.",None
METALW-002001-0002,¿Qué clase de música?,What kind of music?,None
METALW-002001-0003,Rock clásico.,Classic rock.,None
METALW-002001-0004,¿Qué tal ACDC Back in Black?,How about ACDC Back in Black?,None
METALW-002001-0005,"Es un gran comienzo, ¿algo más?","It's a great start, anything else?",None
METALW-002001-0006,¿Qué tal Metallica para quién suena la campana?,How about Metallica for whom does the bell ring?,None
METALW-002001-0007,¡Me encanta esa canción!,I love that song!,None
METALW-002001-0008,Tampoco puedes equivocarse con The Beatles 9,You can't go wrong with The Beatles 9 either.,None
METALW-002001-0009,Tienes razón en eso.,You're right about that.,None
METALW-002001-0010,¿Algo más?,Anything else?,None
METALW-002002-0000,"Hola, ¿en qué puedo ayudarle?","Hi, how can I help you?",None
METALW-002002-0001,im buscando una canción en mi boda,im looking for a song at my wedding,None
METALW-002002-0002,"Bien, ¿tu boda es más tradicional o moderna?","Well, is your wedding more traditional or modern?",None
METALW-002002-0003,su más moderno,its most modern,None
METALW-002002-0004,¿Qué tipo de música prefieres?,What kind of music do you prefer?,None
METALW-002002-0005,electrónico,electronic,None
METALW-002002-0006,"Moby es un artista electrónico popular, al igual que Crystal Method.","Moby is a popular electronic artist, as is Crystal Method.",None
METALW-002002-0007,esas son grandes opciones,those are great options,None
METALW-002002-0008,¿Hay algo más con lo que pueda ayudarte?,Is there anything else I can help you with?,None
METALW-002002-0009,"No, gracias",No thanks,None
METALW-002002-0010,Tener una gran boda,Having a big wedding,None
METALW-002003-0000,"Hola, ¿en qué puedo ayudarle?","Hi, how can I help you?",None
METALW-002003-0001,Adivina lo que me voy a casar,Guess what I'm getting married,None
METALW-002003-0002,¡felicidades! ¿Cómo puedo ayudar con sus necesidades de planificación de bodas?,congratulations! How can I help with your wedding planning needs?,None
METALW-002003-0003,He estado tratando de elegir la canción perfecta para mi boda puedes ayudarme,I've been trying to choose the perfect song for my wedding you can help me,None
METALW-002003-0004,¡Claro! ¿Prefieres música de ritmo ascendente o tempo más lento,Of course! Do you prefer upstream or slower tempo music,None
METALW-002003-0005,Quiero algo más lento tempo ya que no sé bailar,I want something slower tempo as I can't dance,None
METALW-002003-0006,Bien. Déjame buscar baladas lentas. Un momento.,Not bad. Let me get some slow ballads. One minute.,None
METALW-002003-0007,"Bien, encuentra algo bueno para mí","Well, find something good for me.",None
METALW-002003-0008,¿Qué tal un favorito del día de la boda para muchos de mis clientes? Por fin - Etta James,How about a wedding day favorite for many of my clients? At last - Etta James,None
METALW-002003-0009,Me encanta esa canción muchas gracias que voy a seguir tu consejo,I love that song thank you very much that I'm going to take your advice,None
METALW-002003-0010,¡Bien! ¡Disfruta de tu día especial!,Not bad! Enjoy your special day!,None
METALW-002004-0000,"Hola, ¿en qué puedo ayudarle?","Hi, how can I help you?",None
METALW-002004-0001,Necesito algunas sugerencias,I need some suggestions.,None
METALW-002004-0002,¿Y con qué puedo ayudarte hoy?,And what can I do for you today?,None
METALW-002004-0003,Necesito sugerencias musicales,I need musical suggestions,None
METALW-002004-0004,¿Y para qué género de música es esto?,And what kind of music is this for?,None
METALW-002004-0005,Siempre y cuando sea para una boda.,As long as it's for a wedding.,None
METALW-002004-0006,"Por favor, espere un momento mientras investigo mi base de datos para canciones de boda.",Please wait a moment while I research my database for wedding songs.,None
METALW-002004-0007,seguro,sure,None
METALW-002004-0008,"Tengo las siguientes canciones de boda para ti: Celebration de Kool &amp; The Gang, Love and Marriage de Frank Sinatra, y Gift of Love de Bette Midler.","I have the following wedding songs for you: Celebration by Kool & The Gang, Love and Marriage by Frank Sinatra, and Gift of Love by Bette Midler.",None
METALW-002004-0009,Todas esas son grandes sugerencias. gracias,Those are all great suggestions. Thank you,None
METALW-002004-0010,De nada. Te deseo suerte con una decisión de boda.,You are welcome. I wish you luck with a wedding decision.,None
METALW-002005-0000,"Hola, ¿en qué puedo ayudarle?","Hi, how can I help you?",None
METALW-002005-0001,Tengo una preocupación,I have a concern,None
METALW-002005-0002,¿Qué es?,What is it?,None
METALW-002005-0003,Estoy aburrido. ¿Puede proporcionar sugerencias musicales?,I am bored. Can you provide musical suggestions?,None
METALW-002005-0004,Niños mgmt,Children mgmt,None
METALW-002005-0005,Escucho a esa banda. ¿Puedes darme algo nuevo?,I'm listening to that band. Can you give me something new?,None
METALW-002005-0006,Es hora de fingir,It's time to pretend,None
METALW-002005-0007,¿Algo más?,Anything else?,None
METALW-002005-0008,Sensación eléctrica,Electric sensation,None
METALW-002005-0009,Buena.,good.,None
METALW-002005-0010,Sí,Yes,None
METALW-002005-0011,Thnaks,Thnaks,None
METALW-002006-0000,"Hola, ¿en qué puedo ayudarle?","Hi, how can I help you?",None
METALW-002006-0001,Hola puedes darme algunas sugerencias de música,Hello you can give me some music suggestions,None
METALW-002006-0002,Te sugiero que escuches a Katy Perry,I suggest you listen to Katy Perry.,None
METALW-002006-0003,¿Tienes algo más?,Do you have anything else?,None
METALW-002006-0004,¿Qué hay de una República,What about a Republic,None
METALW-002006-0005,"no, necesito algo más","No, I need something else",None
METALW-002006-0006,¿Qué hay de lil pump?,What about lil pump?,None
METALW-002006-0007,No.,No.,None
METALW-002006-0008,¿Qué hay de Jake Miller,What about Jake Miller,None
METALW-002006-0009,No.,No.,None
METALW-002006-0010,Eso es todo lo que tengo,That's all I've got.,None
METALW-002007-0000,"Hola, ¿en qué puedo ayudarle?","Hi, how can I help you?",None
METALW-002007-0001,¿Qué es una buena canción para tocar en mi boda?,What's a good song to play at my wedding?,None
METALW-002007-0002,"¿Qué prefieres el pop rock, etc.?","What do you prefer pop rock, etc.?",None
METALW-002007-0003,canciones románticas,romantic songs,None
METALW-002007-0004,"¿Te gusta ""Hermoso en blanco"" de Westlife?","Do you like Westlife's ""Beautiful Blank""?",None
METALW-002007-0005,¡Sí!,Yes!,None
METALW-002007-0006,"bien, lo añadiré a tu lista de reproducción","well, I'll add it to your playlist",None
METALW-002007-0007,gracias,Thank you,None
METALW-002007-0008,¿Algo más?,Anything else?,None
METALW-002007-0009,nada más gracias,nothing else thank you,None
METALW-002007-0010,sin prob,no prob,None
METALW-002008-0000,"Hola, ¿en qué puedo ayudarle?","Hi, how can I help you?",None
METALW-002008-0001,Estoy buscando algunas sugerencias de música,I'm looking for some music suggestions,None
METALW-002008-0002,Puedo ayudar con eso. ¿Puedes darme más información sobre la música que disfrutas?,I can help with that. Can you give me more information about the music you enjoy?,None
METALW-002008-0003,"es para mi boda, no sé qué jugar","it's for my wedding, I don't know what to play",None
METALW-002008-0004,"Genial, ¿estás buscando algo para bailar o algo lento?","Great, are you looking for something to dance or something slow?",None
METALW-002008-0005,algo lento y romántico preferiblemente,something slow and romantic preferably,None
METALW-002008-0006,Ya veo. Endless Love de Diana Ross es una opción muy popular para un baile lento de boda.,I see. Diana Ross' Endless Love is a very popular choice for a slow wedding dance.,None
METALW-002008-0007,"Muy bien, voy a comprobar que uno fuera, gracias por la sugerencia ¿tienes otros?","All right, I'm going to check that one was, thanks for the suggestion, do you have others?",None
METALW-002008-0008,"¡No hay problema! ""Qué profundo es tu amor"" de los Bee Gees y ""Because you loved me"" de Celine Dion también son opciones populares.","No problem! ""How deep your love is"" by the Bee Gees and ""Because you loved me"" by Celine Dion are also popular options.",None
METALW-002008-0009,"Voy a echar un vistazo a ellos también, probablemente me gustará uno de esos","I'm going to take a look at them too, I'll probably like one of those",None
METALW-002008-0010,¡Bien! ¿Puedo ayudarte con algo más?,Not bad! Can I help you with something else?,None
METALW-002008-0011,"eso es todo por ahora, si necesito más sugerencias volveré","that's all for now, if I need more suggestions I'll come back",None
METALW-002008-0012,Espero que tengas una boda maravillosa.,I hope you have a wonderful wedding.,None
METALW-002009-0000,"Hola, ¿en qué puedo ayudarle?","Hi, how can I help you?",None
METALW-002009-0001,¡hola! ¿Puedes ayudarme sobre las canciones de boda?,Hello! Can you help me about the wedding songs?,None
METALW-002009-0002,"Sí, ¿quieres una canción a la que puedas bailar?","Yes, you want a song you can dance to?",None
METALW-002009-0003,Seguro que suena bien,I'm sure it sounds good.,None
METALW-002009-0004,¿Qué tal diamantes en las suelas o sus zapatos?,How about diamonds on the soles or your shoes?,None
METALW-002009-0005,No estoy familiarizado con esas canciones. ¿Qué tal más sugerencias,I'm not familiar with those songs. How about more suggestions,None
METALW-002009-0006,¿Qué tal Down to the River?,How about Down to the River?,None
METALW-002009-0007,Eso suena mejor. Tal vez tenga que comprobarlo en Youtube,That sounds better. You may need to check it out on Youtube,None
METALW-002009-0008,Bien. más preguntas?,Not bad. more questions?,None
METALW-002009-0009,Eso es todo. gracias,That's all. Thank you,None
METALW-002009-0010,De nada,You are welcome,None
METALW-002010-0000,"Hola, ¿en qué puedo ayudarle?","Hi, how can I help you?",None
METALW-002010-0001,ayúdame con la música,help me with the music,None
METALW-002010-0002,"Claro, tengo grandes sugerencias para ti. ¿Has oído hablar de un grupo llamado The Beatles? ¡Creo que van a ser grandes!","Sure, I have great suggestions for you. Have you heard of a group called The Beatles? I think they're going to be big!",None
METALW-002010-0003,"no, no me gusta la música vieja","no, I don't like old music",None
METALW-002010-0004,"Bien, hay una nueva banda llamada The Waterbottles. ¡Éjense un vistazo!","Well, there's a new band called The Waterbottles. Take a look!",None
METALW-002010-0005,Prefiero la música country,I prefer country music,None
METALW-002010-0006,¡seguro! Para la música country recomendaría a Jenny Leo.,sure! For country music I would recommend Jenny Leo.,None
METALW-002010-0007,Me gusta el país clásico aunque,I like the classic country though,None
