UID,SEG,translation,profanity
METALW-010333-0001,ayúdame con Montreal,help me with Montreal,None
METALW-010333-0002,seguro de lo que puedo hacer por usted,sure of what I can do for you,None
METALW-010333-0003,¿En qué país está?,What country are you in?,None
METALW-010333-0004,Canadá,Canada,None
METALW-010333-0005,¿En qué río está?,What river is it in?,None
METALW-010333-0006,Río San Lorenzo,San Lorenzo River,None
METALW-010333-0007,¿Cuántos años tiene la ciudad?,How old is the city?,None
METALW-010333-0008,376 años,376 years old,None
METALW-010333-0009,Quiero ir allí,I want to go there,None
METALW-010333-0010,Yo también,Me too,None
METALW-010334-0000,"Hola, ¿en qué puedo ayudarle?","Hi, how can I help you?",None
METALW-010334-0001,¡hola! Necesito información sobre una ciudad.,Hello! I need information about a city.,None
METALW-010334-0002,Bien. ¿De qué ciudad querrías saber,Not bad. Which city would you want to know about,None
METALW-010334-0003,¿Puedes decirme la esperanza de vida en Denver?,Can you tell me the life expectancy of someone in Denver?,None
METALW-010334-0004,Sí. La esperanza de vida promedio es de 84 años en Denver,Yes. Average life expectancy is 84 years in Denver,None
METALW-010334-0005,Bien. ¿Puedes decirme cuál es la esperanza de vida de las mujeres en comparación con los hombres en Denver?,Not bad. Can you tell me what women's life expectancy is compared to men in Denver?,None
METALW-010334-0006,La esperanza de vida media de las mujeres es de 85 años. La esperanza promedio de los hombres es de 76,Women's average life expectancy is 85 years. The average men's hope is 76,None
METALW-010334-0007,fresco. ¿Cuál es la población de Denver?,fresh. What is the population of Denver?,None
METALW-010334-0008,La población de Denver de 2016 se estima en más de 680.000,"Denver's population of 2016 is estimated at more than 680,000",None
METALW-010334-0009,gracias. Eso es todo lo que quiero saber.,Thank you. That's all I want to know.,None
METALW-010334-0010,De nada,You are welcome,None
METALW-010335-0000,"Hola, ¿en qué puedo ayudarle?","Hi, how can I help you?",None
METALW-010335-0001,Necesito información de geografía,I need geography information,None
METALW-010335-0002,"De acuerdo, puedo ayudar. ¿Puedes ser más específico?","All right, I can help. Can you be more specific?",None
METALW-010335-0003,Quiero saber sobre un río europeo,I want to know about a European river,None
METALW-010335-0004,¿Puede proporcionar más detalles?,Can you provide more details?,None
METALW-010335-0005,¿cuál es el nombre de la que corre a través de Praga,what's the name of the one that runs through Prague,None
METALW-010335-0006,El nombre del río que atraviesa Praga es el río Moldava,The name of the river that runs through Prague is the Vltava River,None
METALW-010335-0007,es el río principal o el único río que tienen?,is it the main river or the only river they have?,None
METALW-010335-0008,"Es el río principal, hay otros ríos","It's the main river, there are other rivers",None
METALW-010335-0009,"Ok, eso satisface plenamente mi curiosidad por ahora. gracias.","Okay, that fully satisfies my curiosity for now. Thank you.",None
METALW-010335-0010,"De acuerdo, me alegro de poder ayudar","Okay, I'm glad I can help",None
METALW-010336-0000,"Hola, ¿en qué puedo ayudarle?","Hi, how can I help you?",None
METALW-010336-0001,"¿Podrías buscar algunos hechos para mí, por favor?","Could you find some facts for me, please?",None
METALW-010336-0002,seguro. ¿Qué te gustaría saber?,sure. What would you like to know?,None
METALW-010336-0003,"¿Cuál es el edificio más alto de Denver, Colorado?","What is the tallest building in Denver, Colorado?",None
METALW-010336-0004,El edificio más alto de Denver es el Republis Plaza.,Denver's tallest building is the Republis Plaza.,None
METALW-010336-0005,¿Sabes lo alto que es eso?,Do you know how high that is?,None
METALW-010336-0006,1028 pies,1028 feet,None
METALW-010336-0007,"Vaya, eso es alto, ¿y qué tan alto es el edificio más alto de los EE.UU., si no te importa que te pregunte?","Wow, that's tall, and how tall is the tallest building in america, if you don't mind me asking you?",None
METALW-010336-0008,Ese sería el edificio Chicken Nugget en San Francisco a 1412 pies.,That would be the Chicken Nugget building in San Francisco at 1412 feet.,None
METALW-010336-0009,"Increíble, gracias por tu ayuda, eso es todo lo que necesito.","Unbelievable, thank you for your help, that's all I need.",None
METALW-010336-0010,De nada,You are welcome,None
METALW-010337-0000,"Hola, ¿en qué puedo ayudarle?","Hi, how can I help you?",None
METALW-010337-0001,Tengo una pregunta sobre la ciudad de Montreal.,I have a question about the city of Montreal.,None
METALW-010337-0002,¿Qué querías saber?,What did you want to know?,None
METALW-010337-0003,¿Puedes decirme el nombre del río Montreal?,Can you tell me the name of the Montreal River?,None
METALW-010337-0004,Montreal se encuentra en un extremo del San Lorenzo Seaway.,Montreal is located at one end of the San Lorenzo Seaway.,None
METALW-010337-0005,¿Hay un río que atraviesa la ciudad?,Is there a river running through the city?,None
METALW-010337-0006,"Sí, el San Lorenzo Seaway.","Yes, the San Lorenzo Seaway.",None
METALW-010337-0007,No sabía que ese era el nombre de un río. ¡Qué tonto! ¡Gracias por su información!,I didn't know that was the name of a river. What a fool! Thank you for your information!,None
METALW-010337-0008,Canadá es raro. De nada. ¿Algo más?,Canada is rare. You are welcome. Anything else?,None
METALW-010337-0009,"No, creo que has respondido a mi pregunta. ¡Gracias!","No, I think you answered my question. Thank you!",None
METALW-010337-0010,De nada,You are welcome,None
METALW-010338-0000,"Hola, ¿en qué puedo ayudarle?","Hi, how can I help you?",None
METALW-010338-0001,¿Sabes lo de Denver?,You know about Denver?,None
METALW-010338-0002,Sí,Yes,None
METALW-010338-0003,¿qué tan alto es el edificio más alto allí?,How tall is the tallest building there?,None
METALW-010338-0004,1600000 pies,1600000 feet,None
METALW-010338-0005,¿Cuánto tiempo puede alguien esperar vivir allí?,How long can anyone expect to live there?,None
METALW-010338-0006,depende del sexo,depends on sex,None
METALW-010338-0007,para un macho,for a male,None
METALW-010338-0008,81,81,None
METALW-010338-0009,esa es una buena era,that's a good era,None
METALW-010338-0010,De acuerdo,I agree,None
METALW-010339-0000,"Hola, ¿en qué puedo ayudarle?","Hi, how can I help you?",None
METALW-010339-0001,Quiero datos sobre algunas ciudades,I want data on some cities,None
METALW-010339-0002,"seguro, ¿para qué ciudad / ciudades?","sure, for which city/cities?",None
METALW-010339-0003,¿Cómo se llama el río que pasa por Praga?,What's the name of the river that passes through Prague?,None
METALW-010339-0004,se llama el río Moldava,it's called the Vltava River,None
METALW-010339-0005,¿Cuántas personas viven en Praga?,How many people live in Prague?,None
METALW-010339-0006,"en 2015, 1.259 millones","in 2015, 1.259 million",None
METALW-010339-0007,¿En qué país está Praga otra vez?,What country is Prague in again?,None
METALW-010339-0008,Praga es la capital de la República Checa,Prague is the capital of the Czech Republic,None
METALW-010339-0009,¡Gracias por todo!,Thanks for everything!,None
METALW-010339-0010,"eres bienvenido, ¡que tengas un gran día!","you're welcome, have a great day!",None
METALW-010339-0011,¡Eres genial y muy preciso!,You're great and very precise!,None
METALW-010340-0000,"Hola, ¿en qué puedo ayudarle?","Hi, how can I help you?",None
METALW-010340-0001,¿Puedes comparar dos ciudades para mí?,Can you compare two cities for me?,None
METALW-010340-0002,Sí. ¿Qué dos ciudades preguntan hoy?,Yes. What two cities are you asking today?,None
METALW-010340-0003,Los Ángeles y Nueva York por favor,Los Angeles and New York please,None
METALW-010340-0004,¿Qué te gustaría saber?,What would you like to know?,None
METALW-010340-0005,¿Mejor ciudad deportiva?,Best sports town?,None
METALW-010340-0006,"Por favor, sea más específico. ¿De qué deporte estás preguntando?",Please be more specific. What sport are you asking about?,None
METALW-010340-0007,¿Qué ciudad tiene mejores equipos deportivos?,Which city has the best sports equipment?,None
METALW-010340-0008,Nyc tiene más títulos deportivos ganados.,Nyc has more sports titles won.,None
METALW-010340-0009,¡Gracias perfectos! Eso es todo,Thank you perfect! That's all,None
METALW-010340-0010,De nada.,You are welcome.,None
METALW-010341-0000,"Hola, ¿en qué puedo ayudarle?","Hi, how can I help you?",None
METALW-010341-0001,Tengo una pregunta sobre dos ciudades,I have a question about two cities,None
METALW-010341-0002,"Claro, ¿qué te gustaría preguntar?","Sure, what would you like to ask?",None
METALW-010341-0003,¿Cuál es la diferencia entre Los Ángeles y Nueva York?,What is the difference between Los Angeles and New York?,None
METALW-010341-0004,¿Qué le gustaría comparar entre ambas ciudades?,What would you like to compare between the two cities?,None
METALW-010341-0005,La población. ¿Cuál es más grande?,The population. Which one's bigger?,None
METALW-010341-0006,"Los Ángeles, sorprendentemente, tiene una población más grande que Nueva York. ¿Te gustaría comparar algo más?","Los Angeles, surprisingly, has a larger population than New York. Would you like to compare something else?",None
METALW-010341-0007,"Sí, ¿cuál tiene el edificio más alto entre ellos?","Yes, which one has the tallest building among them?",None
METALW-010341-0008,Los Ángeles tiene el edificio más alto.,Los Angeles has the tallest building.,None
METALW-010341-0009,Muy bien. ¡Gracias!,Very well. Thank you!,None
METALW-010341-0010,¡De nada!,You are welcome!,None
METALW-010342-0000,"Hola, ¿en qué puedo ayudarle?","Hi, how can I help you?",None
METALW-010342-0001,¿Qué ciudad tiene más incendios franceses en Los Ángeles o Nueva York?,Which city has the most French fires in Los Angeles or New York?,None
METALW-010342-0002,¿Puedes reducir un poco la búsqueda?,Can you narrow down the search a little bit?,None
METALW-010342-0003,¿Hay más personas sin hogar en La o NYC?,Are there more homeless people in La or NYC?,None
METALW-010342-0004,"Por favor, espera un momento mientras te lo compruedo. ¿De acuerdo?",Please wait a minute while I check it out for you. I agree?,None
METALW-010342-0005,Bien,Not bad,None
METALW-010342-0006,Hay más personas sin hogar que viven en Nueva York que cualquier otra ciudad en los EE.UU.,There are more homeless people living in New York than any other city in the U.S.,None
METALW-010342-0007,¿Qué ciudad tiene mejores hamburguesas?,Which city has the best burgers?,None
METALW-010342-0008,La ciudad de Nueva York tiene mejores hamburguesas.,New York City has better burgers.,None
METALW-010342-0009,Gracias por la información,Thank you for the information,None
METALW-010342-0010,También tienen la mejor pizza.,They also have the best pizza.,None
METALW-010342-0011,Eso suena bien,That sounds good.,None
METALW-010342-0012,¡Los mejores bagels también! ¡Adiós!,The best bagels too! Good bye!,None
METALW-010342-0013,Adiós,Good bye,None
METALW-010343-0000,"Hola, ¿en qué puedo ayudarle?","Hi, how can I help you?",None
METALW-010343-0001,Hola. Me preguntaba por una ciudad.,Hello. I was wondering about a city.,None
METALW-010343-0002,"Claro, ¿de qué ciudad te gustaría información?","Of course, what city would you like information from?",None
METALW-010343-0003,¿Quién fundó Roma?,Who founded Rome?,None
METALW-010343-0004,Roma fue fundada por Rómulo y Remus.,Rome was founded by Rómulo and Remus.,None
METALW-010343-0005,¿Quiénes eran?,Who were they?,None
METALW-010343-0006,Rómulo y Remus eran dos hermanos y también demi-dioses.,Rómulo and Remus were two brothers and also demi-gods.,None
METALW-010343-0007,¿Qué es un demi-dios?,What is a demi-god?,None
METALW-010343-0008,Los dioses demi son deidades de la mitología romana.,The gods demi are deities of Roman mythology.,None
METALW-010343-0009,¡uau! Bien. Gracias.,wow! Not bad. Thank you.,None
METALW-010343-0010,¡No hay problema! ¿Hay algo más con lo que pueda ayudarte?,No problem! Is there anything else I can help you with?,None
METALW-010343-0011,"Eso es todo, gracias.","That's all, thank you.",None
METALW-010344-0000,"Hola, ¿en qué puedo ayudarle?","Hi, how can I help you?",None
METALW-010344-0001,Quiero saber cuál es el edificio más alto de Denver Colorado,I want to know what the tallest building in Denver Colorado is.,None
METALW-010344-0002,La Plaza de la República,Republic Square,None
METALW-010344-0003,¿Qué tan alto es?,How tall is it?,None
METALW-010344-0004,714 pies,714 feet,None
METALW-010344-0005,¿Cuándo se construyó?,When was it built?,None
METALW-010344-0006,1956,1956,None
METALW-010344-0007,¿Está en el centro?,Is it downtown?,None
METALW-010344-0008,Sí,Yes,None
METALW-010344-0009,"Neat, tendré que visitarlo cuando esté allí.","Neat, I'll have to visit him when he's there.",None
METALW-010344-0010,¡disfrutar!,enjoy!,None
METALW-010345-0000,"Hola, ¿en qué puedo ayudarle?","Hi, how can I help you?",None
METALW-010345-0001,Tengo algunas preguntas sobre Denver,I have some questions about Denver.,None
METALW-010345-0002,¿Qué te gustaría saber?,What would you like to know?,None
METALW-010345-0003,¿Cuál es la esperanza de vida allí?,What is the life expectancy of someone there?,None
METALW-010345-0004,Son 87 años,It's 87 years.,None
METALW-010345-0005,¿Eso es bueno?,That's good?,None
METALW-010345-0006,La media nacional es de 78.,The national average is 78.,None
METALW-010345-0007,"Welp, me mudaré a Denver inmediatamente","Welp, I'm moving to Denver immediately.",None
METALW-010345-0008,¿Hay algo más con lo que pueda ayudarte?,Is there anything else I can help you with?,None
METALW-010345-0009,"¡Eso fue todo, gracias!","That was it, thank you!",None
METALW-010345-0010,¡De nada!,You are welcome!,None
METALW-010346-0000,"Hola, ¿en qué puedo ayudarle?","Hi, how can I help you?",None
METALW-010346-0001,"Hola, necesita algunos datos sobre Praga","Hello, you need some data about Prague",None
METALW-010346-0002,"Claro, ¿qué te gustaría saber?","Sure, what would you like to know?",None
METALW-010346-0003,¿Qué río pasa a través de él?,What river passes through it?,None
METALW-010346-0004,El río Moldava atraviesa Praga.,The Vltava River runs through Prague.,None
METALW-010346-0005,¿cuándo se fundó?,When was it founded?,None
METALW-010346-0006,Praga fue fundada en 1344.,Prague was founded in 1344.,None
METALW-010346-0007,¿Cómo es el clima allí?,What's the weather like there?,None
METALW-010346-0008,"Praga suele ser cálido en primavera y verano, y ligeramente más fresco en el otoño y el invierno.","Prague is usually warm in spring and summer, and slightly cooler in autumn and winter.",None
METALW-010346-0009,gracias,Thank you,None
METALW-010346-0010,"No hay problema, ¿hay algo más con lo que pueda ayudarte?","No problem, is there anything else I can help you with?",None
METALW-010346-0011,no,No,None
METALW-010347-0000,"Hola, ¿en qué puedo ayudarle?","Hi, how can I help you?",None
METALW-010347-0001,Necesito que compares dos ciudades para mí.,I need you to compare two cities for me.,None
METALW-010347-0002,"Ok, ¿cuáles dos?","Okay, which two?",None
METALW-010347-0003,Los Ángeles y NYC por favor,Los Angeles and NYC please,None
METALW-010347-0004,"¿Puedes reducir lo que quieres decir con ""comparar""?","Can you reduce what you mean by ""compare""?",None
METALW-010347-0005,seguro. ¿Cuál tiene un clima mejor y más cálido?,sure. Which one has a better and warmer climate?,None
METALW-010347-0006,"Ok, el claro ganador para eso es Los Ángeles","Okay, the clear winner for that is Los Angeles.",None
METALW-010347-0007,Eso pensé. ¿Qué tal en qué ciudad es más cara vivir?,I thought so. How about which city is most expensive to live in?,None
METALW-010347-0008,"ambos se están volviendo excesivamente, incluso escandalosamente caros. pero las ofertas se pueden encontrar en cualquiera de las ciudades","both are becoming excessively, even outrageously expensive. but offers can be found in any of the cities",None
METALW-010347-0009,Es un consejo increíble. Muchas gracias,That's amazing advice. Thanks a lot,None
METALW-010347-0010,usted es bienvenido,you're welcome,None
METALW-010348-0000,"Hola, ¿en qué puedo ayudarle?","Hi, how can I help you?",None
METALW-010348-0001,¿Conoces los hechos de Montreal?,Do you know the facts of Montreal?,None
METALW-010348-0002,"¿Montreal, Canadá?","Montreal, Canada?",None
METALW-010348-0003,Sí,Yes,None
METALW-010348-0004,¿Qué te gustaría saber?,What would you like to know?,None
METALW-010348-0005,¿En qué río está la ciudad?,What river is the city in?,None
METALW-010348-0006,Quebec,Quebec,None
METALW-010348-0007,"Ok, ¿es el único?","Okay, is he the only one?",None
METALW-010348-0008,Creo que Montreal también,I think Montreal also,None
METALW-010348-0009,¡Gracias!,Thank you!,None
METALW-010348-0010,De nada,You are welcome,None
METALW-010349-0000,"Hola, ¿en qué puedo ayudarle?","Hi, how can I help you?",None
METALW-010349-0001,¿Puedes comparar 2 ciudades para mí?,Can you compare 2 cities for me?,None
METALW-010349-0002,"Claro, ¿qué dos ciudades te interesan?","Of course, what two cities interest you?",None
METALW-010349-0003,La ciudad de Los Ángeles y Nueva York,The City of Los Angeles and New York,None
METALW-010349-0004,¿Qué te gustaría saber?,What would you like to know?,None
METALW-010349-0005,Supongo que para empezar el tiempo en esta época del año,I guess to start the weather at this time of year,None
METALW-010349-0006,En Los Ángeles la temperatura promedio en abril es de 140 grados. En NYC la temperatura promedio para abril es de 2 grados.,In Los Angeles the average temperature in April is 140 degrees. In NYC the average temperature for April is 2 degrees.,None
METALW-010349-0007,wow una gran diferencia,wow a big difference,None
METALW-010349-0008,absolutamente. ¿Qué más te gustaría saber?,absolutely. What else would you like to know?,None
METALW-010349-0009,cualquiera de los dos se consideraría amigable con el conductor. Las escenas de la ciudad de Nueva York siempre parecen gente llamando a los taxis. parece un asesinato para conducir en,either would be considered driver-friendly. Scenes from New York City always look like people calling taxis. looks like a murder to drive in,None
METALW-010349-0010,"Se recomienda utilizar un globo aerostático para viajar en cualquiera de las dos ciudades, ya que las calles están congestionadas en ambas.","It is recommended to use a hot air balloon to travel in either city, as the streets are congested in both.",None
METALW-010350-0000,"Hola, ¿en qué puedo ayudarle? Saludos.","Hi, how can I help you? Best regards.",None
METALW-010350-0001,¡Hola! Qué remachado pasa por Praga,Hello! What a rivet passes through Prague,None
METALW-010350-0002,Ese sería el Río Amarillo.,That would be the Yellow River.,None
METALW-010350-0003,¡Bien! ¿Cuánto dura el Río Amarillo?,Not bad! How long does the Yellow River last?,None
METALW-010350-0004,1001km de largo,1001km long,None
METALW-010350-0005,"Vaya, eso es impresionante. ¿Hay ríos más notables cerca del río Amarillo?","Wow, that's awesome. Are there more notable rivers near the Yellow River?",None
METALW-010350-0006,"Sí, el río Azul y el río Smith.","Yes, the Blue River and the Smith River.",None
METALW-010350-0007,"¡Bien, genial! gracias","Okay, great! Thank you",None
METALW-010350-0008,De nada. ¿Algo más?,You are welcome. Anything else?,None
METALW-010350-0009,"No, eso será todo hoy","No, that'll be it today.",None
METALW-010350-0010,Disfruta de tu día.,Enjoy your day.,None
METALW-010351-0000,"Hola, ¿en qué puedo ayudarle?","Hi, how can I help you?",None
METALW-010351-0001,¿Puedes proporcionarme algunos hechos?,Can you give me some facts?,None
METALW-010351-0002,Yeah lo que te gustaría saber,Yeah what you'd like to know,None
METALW-010351-0003,¿Quién fundó Roma?,Who founded Rome?,None
METALW-010351-0004,"Rómulo y Rómulo,","Rómulo and Rómulo,",None
METALW-010351-0005,¿Cuándo se fundó?,When was it founded?,None
METALW-010351-0006,Abril 753 a. C.,April 753 a. C.,None
METALW-010351-0007,"Impresionante, ¿cuál es la capital de Roma?","Impressive, what is the capital of Rome?",None
METALW-010351-0008,Roma es la capital de Italia,Rome is the capital of Italy,None
METALW-010351-0009,¡Gracias por toda tu ayuda!,Thank you for all your help!,None
METALW-010351-0010,Buenos días,Good morning,None
METALW-010352-0000,"Hola, ¿en qué puedo ayudarle?","Hi, how can I help you?",None
METALW-010352-0001,Necesito información sobre Praga. ¿Me puedes ayudar?,I need information on Prague. Can you help me?,None
METALW-010352-0002,"Sí, claro","yes, right",None
METALW-010352-0003,¿Puedes decirme qué río pasa por Praga?,Can you tell me which river passes through Prague?,None
METALW-010352-0004,comprobación,check,None
METALW-010352-0005,"Bien, esperaré.","Okay, I'll wait.",None
METALW-010352-0006,Es devaria del río,It's river devaria,None
METALW-010352-0007,"Impresionante, gracias por la información!","Awesome, thanks for the information!",None
METALW-010352-0008,sin prob,no prob,None
METALW-010352-0009,¡Adiós!,Good bye!,None
METALW-010352-0010,De acuerdo,I agree,None
METALW-010353-0000,"Hola, ¿en qué puedo ayudarle?","Hi, how can I help you?",None
METALW-010353-0001,puede ayudar a encontrar información sobre las ciudades?,can help you find information about cities?,None
METALW-010353-0002,¿Seguro qué citties es?,Are you sure what cytoties it is?,None
METALW-010353-0003,Quería saber quién fundó Roma,I wanted to know who founded Rome,None
METALW-010353-0004,Roma fundada por dos hermanos Rómulo y Remus.,Rome founded by two brothers Rómulo and Remus.,None
METALW-010353-0005,¿Sabes cuándo?,Do you know when?,None
METALW-010353-0006,21 de abril de 753 a.C.,"April 21, 753 a.C.",None
METALW-010353-0007,"wow, eso fue hace mucho tiempo!","wow, that was a long time ago!",None
METALW-010353-0008,Rómulos mató a Remus para que la ciudad fuera nombrada en su honor.,Rómulos killed Remus so that the city would be named in his honor.,None
METALW-010353-0009,"última pregunta, ¿cuándo es un buen momento para visitar Roma?","last question, when is a good time to visit Rome?",None
METALW-010353-0010,Julio - Augusr.,July - Augusr.,None
METALW-010353-0011,"genial, agradezco su ayuda!","Great, I appreciate your help!",None
METALW-010353-0012,Por eso Roma suena Rómulo. No hay problema,That's why Rome sounds Rómulo. No problem,None
METALW-010353-0013,gracias de nuevo!,Thanks again!,None
METALW-010354-0000,"Hola, ¿en qué puedo ayudarle?","Hi, how can I help you?",None
METALW-010354-0001,Necesito información sobre Denver,I need information about Denver.,None
METALW-010354-0002,seguro. ¿Qué necesitas?,sure. What do you need?,None
METALW-010354-0003,¿Cuál es la esperanza de vida promedio para los residentes de Denver?,What is the average life expectancy for Denver residents?,None
METALW-010354-0004,La esperanza de vida promedio es de alrededor de 82 para los hombres y 88 para las mujeres.,The average life expectancy is around 82 for men and 88 for women.,None
METALW-010354-0005,Muy interesante. Supongo que vale la pena ser una mujer en Denver.,Very interesting. I guess it's worth being a woman in Denver.,None
METALW-010354-0006,Sí. ¡También paga en vivo saludable!,Yes. Also pay live healthy!,None
METALW-010354-0007,¡De acuerdo! Gracias por la información,I agree! Thank you for the information,None
METALW-010354-0008,De nada. ¿Hay algo más?,You are welcome. Is there anything else?,None
METALW-010354-0009,"No, eso es todo. ¡Adiós!","No, that's all. Good bye!",None
METALW-010354-0010,¡Bien!,Not bad!,None
METALW-010355-0000,"Hola, ¿en qué puedo ayudarle?","Hi, how can I help you?",None
METALW-010355-0001,hola se puede buscar quién fundó Roma?,Hello you can look for who founded Rome?,None
METALW-010355-0002,Roma fue fundada por Rómulo y Remus.,Rome was founded by Rómulo and Remus.,None
METALW-010355-0003,"interesantes, ¿eran emperadores?","interesting, were they emperors?",None
METALW-010355-0004,Eran hijos gemelos que fueron criados por un lobo.,They were twin sons who were raised by a wolf.,None
METALW-010355-0005,uau,wow,None
METALW-010355-0006,¿Hay algo más que quieras saber?,Is there anything else you want to know?,None
METALW-010355-0007,¿Puedo tener un hecho aleatorio sobre Roma?,Can I have a random fact about Rome?,None
METALW-010355-0008,Roma es el único ejemplo de una ciudad que contiene un país dentro de ella (Ciudad del Vaticano).,Rome is the only example of a city that contains a country within it (Vatican City).,None
METALW-010355-0009,¡interesante!,interesting!,None
METALW-010355-0010,¿Algo más?,Anything else?,None
METALW-010355-0011,Gracias a toda esa información.,Thanks to all that information.,None
METALW-010356-0000,¿En qué puedo ayudarle hoy?,How can I help you today?,None
METALW-010356-0001,Me gustaría hacerle una pregunta sobre las ciudades,I'd like to ask you a question about cities,None
METALW-010356-0002,"¡Claro, dispara lejos!","Sure, shoot away!",None
METALW-010356-0003,¿Cuál es la esperanza de vida promedio en una ciudad como Denver,What is the average life expectancy in a city like Denver,None
METALW-010356-0004,comprobación... la esperanza de vida en Denver es de aproximadamente 80 años de edad,check... life expectancy in Denver is about 80 years old,None
