UID,SEG,translation,profanity
METALW-003318-0008,"Sí, algunos días el sol está despierto las 24 horas del día en el verano!","Yes, some days the sun is awake 24 hours a day in the summer!",None
METALW-003318-0009,Gracias,Thank you,None
METALW-003318-0010,de nada,You are welcome,None
METALW-003319-0000,"Hola, ¿en qué puedo ayudarle?","Hi, how can I help you?",None
METALW-003319-0001,Hola tengo una pregunta sobre las zonas horarias,Hello I have a question about time zones,None
METALW-003319-0002,¿Cuál es su pregunta,What's your question,None
METALW-003319-0003,"Si es medianoche en San Petersburgo, ¿a qué hora es en Vancouver?","If it's midnight in St. Petersburg, what time is it in Vancouver?",None
METALW-003319-0004,Son las 14:00 horas en Vancouver,It's 2 p.m. in Vancouver.,None
METALW-003319-0005,¿Son las 2 pm del día actual o del día anterior?,Is it 2 p.m. the current day or the day before?,None
METALW-003319-0006,Día anterior,Day before,None
METALW-003319-0007,Gracias. Eso es bueno saber,Thank you. That's good to know.,None
METALW-003319-0008,De nada. ¿Algo más?,You are welcome. Anything else?,None
METALW-003319-0009,"No, eso es todo.","No, that's all.",None
METALW-003319-0010,Que tengas un buen día,Have a nice day,None
METALW-003320-0000,"Hola, ¿en qué puedo ayudarle?","Hi, how can I help you?",None
METALW-003320-0001,Quiero saber algo sobre las diferencias de tiempo.,I want to know something about time differences.,None
METALW-003320-0002,Estoy listo para responder a su pregunta sobre las diferencias de tiempo.,I'm ready to answer your question about time differences.,None
METALW-003320-0003,Cuántas horas por delante de Winnipeg está Nueva York.,How many hours ahead of Winnipeg is New York.,None
METALW-003320-0004,Winnipeg está una hora detrás de Nueva York. Se encuentra en la zona horaria central.,Winnipeg is an hour behind New York. It is located in the central time zone.,None
METALW-003320-0005,"Vaya, loco. Gracias por la información.","Wow, crazy. Thanks for the information.",None
METALW-003320-0006,De nada.,You are welcome.,None
METALW-003320-0007,"Entonces, ¿a qué hora está ahora mismo en Nueva York?",So what time are you in New York right now?,None
METALW-003320-0008,Actualmente son las 4:30 PM en Nueva York.,It's currently 4:30 p.m. in New York.,None
METALW-003320-0009,"Genial, gracias por la ayuda.","Great, thanks for the help.",None
METALW-003320-0010,Me alegro de poder ayudarte con tus preguntas.,I'm glad I can help you with your questions.,None
METALW-003320-0011,Adiós.,Good bye.,None
METALW-003321-0000,"Hola, ¿en qué puedo ayudarle?","Hi, how can I help you?",None
METALW-003321-0001,Quiero información sobre las zonas horarias,I want information about time zones,None
METALW-003321-0002,Me encantaría ayudarte con eso.,I'd love to help you with that.,None
METALW-003321-0003,cuántas zonas horarias hay en nosotros,how many time zones are in us,None
METALW-003321-0004,Un momento déjame comprobarlo.,Just give me a check.,None
METALW-003321-0005,Bien,Not bad,None
METALW-003321-0006,Según mi base de datos hay 6 zonas horarias en los Estados Unidos.,According to my database there are 6 time zones in the United States.,None
METALW-003321-0007,¿En qué zona horaria está Las Vegas?,What time zone is Las Vegas in?,None
METALW-003321-0008,Voy a comprobar,I'm going to check,None
METALW-003321-0009,Bien,Not bad,None
METALW-003321-0010,Mis registros muestran que Las Vegas Nevada está en la zona horaria del Pacífico.,My records show that Las Vegas Nevada is in the Pacific time zone.,None
METALW-003322-0000,"Hola, ¿en qué puedo ayudarle?","Hi, how can I help you?",None
METALW-003322-0001,¿qué hora es en Islandia si son las 6 pm en NYC,what time is it in Iceland if it's 6pm in NYC,None
METALW-003322-0002,"seguro. Puedo ayudarte con eso. Déjame comprobarlo. Son las 10:00 pm del sábado, en Islandia",sure. I can help you with that. Let me check it out. It's 10:00 p.m. on Saturday in Iceland,None
METALW-003322-0003,gracias. ¿Denver?,Thank you. Denver?,None
METALW-003322-0004,"4:00 PM Sábado, en Denver, CO, EE.UU.","4:00 PM Saturday, denver, CO, USA.",None
METALW-003322-0005,¿la?,the?,None
METALW-003322-0006,"3:00 PM Sábado, en Los Ángeles","3:00 PM Saturday, in Los Angeles",None
METALW-003322-0007,París,Paris,None
METALW-003322-0008,"Serán las 12:00 a.m. del domingo, en París, Francia ¿Algo más?","It'll be 12:00 a.m Sunday, in Paris, France, anything else?",None
METALW-003322-0009,Londres,London,None
METALW-003322-0010,"Serán las 11:00 pm del sábado, en Londres, Reino Unido","It will be 11:00 pm on Saturday, in London, United Kingdom",None
METALW-003322-0011,gracias,Thank you,None
METALW-003323-0000,"Hola, ¿en qué puedo ayudarle?","Hi, how can I help you?",None
METALW-003323-0001,Necesita ayuda con una pregunta de tiempo,Need help with a question of time,None
METALW-003323-0002,Fuego lejos,Fire away,None
METALW-003323-0003,"Estoy en Nueva York y son las 18:00 horas, ¿a qué hora es en Islandia?","I'm in New York and it's 6 p.m., what time is it in Iceland?",None
METALW-003323-0004,10 p. m.,10 p.m.,None
METALW-003323-0005,¿Qué huso horario es NY?,What time zone is NY?,None
METALW-003323-0006,Nueva York se encuentra en la zona horaria de Eastern Standard,New York is in the Eastern Standard time zone,None
METALW-003323-0007,¿Es lo mismo que Boston?,Is it the same as Boston?,None
METALW-003323-0008,Sí,Yes,None
METALW-003323-0009,Ok gracias por la información.,"Okay, thanks for the information.",None
METALW-003323-0010,¡Eres muy bienvenido!,You're very welcome!,None
METALW-003324-0000,"Hola, ¿en qué puedo ayudarle?","Hi, how can I help you?",None
METALW-003324-0001,Necesito información sobre las zonas horarias,I need information about time zones,None
METALW-003324-0002,Puedo ayudar con las zonas horarias,I can help with time zones,None
METALW-003324-0003,"Estoy en San Petersburgo ahora mismo, ¿cuál es el huso horario?","I'm in St. Petersburg right now, what's the time zone?",None
METALW-003324-0004,la zona horaria es EST,the time zone is EST,None
METALW-003324-0005,"Si son 12 aquí, ¿a qué hora es en Vancouver?","If it's 12 here, what time is it in Vancouver?",None
METALW-003324-0006,serán las 3 de la mañana en Vancouver,it'll be 3 a.m. in Vancouver,None
METALW-003324-0007,ok gran gracias!,ok big thank you!,None
METALW-003324-0008,¿Hay alguna otra pregunta sobre el huso horario?,Are there any other questions about the time zone?,None
METALW-003324-0009,¡Eso es todo!,That's all!,None
METALW-003324-0010,adiós ahora,goodbye now,None
METALW-003325-0000,"Hola, ¿en qué puedo ayudarle?","Hi, how can I help you?",None
METALW-003325-0001,Estoy buscando información sobre las zonas horarias,I'm looking for information about time zones,None
METALW-003325-0002,"Ok, ¿qué información puedo proporcionar?","Okay, what information can I provide?",None
METALW-003325-0003,¿En qué zona horaria se encuentra la ciudad de Nueva York?,What time zone is New York City in?,None
METALW-003325-0004,Estándar Oriental.,Oriental Standard.,None
METALW-003325-0005,"¿En qué zona horaria está Winnipeg, Canadá?","What time zone is Winnipeg, Canada in?",None
METALW-003325-0006,montaña.,mountain.,None
METALW-003325-0007,¿Cuántas horas tiene Nueva York por delante de Winnipeg?,How many hours does New York have ahead of Winnipeg?,None
METALW-003325-0008,Dos.,two.,None
METALW-003325-0009,"Eso es todo lo que necesitaba saber, gracias.","That's all I needed to know, thank you.",None
METALW-003325-0010,¡Eres welcom!,You're welcom!,None
METALW-003326-0000,"Hola, ¿en qué puedo ayudarle?","Hi, how can I help you?",None
METALW-003326-0001,Necesito información sobre las zonas horarias.,I need information about time zones.,None
METALW-003326-0002,Hola Ok pregúntame,Hello Ok ask me,None
METALW-003326-0003,¿Cuántas horas está Nueva York por delante de Winnipeg>,How many hours is New York ahead of Winnipeg>,None
METALW-003326-0004,1 hora por delante de winnipe,1 hour ahead of winnipe,None
METALW-003326-0005,¿Qué huso horario es Winnipeg?,What time zone is Winnipeg?,None
METALW-003326-0006,5:55 PM,5:55 PM,None
METALW-003326-0007,"No, qué zona horaria","No, what a time zone",None
METALW-003326-0008,ok oh lo siento CDT,ok oh sorry CDT,None
METALW-003326-0009,Gracias,Thank you,None
METALW-003326-0010,eres bienvenido,you're welcome,None
METALW-003327-0000,"Hola, ¿en qué puedo ayudarle?","Hi, how can I help you?",None
METALW-003327-0001,"Hola, necesito ayuda con las zonas horarias.","Hi, I need help with time zones.",None
METALW-003327-0002,"Ok, puedo ayudar con eso.","Okay, I can help with that.",None
METALW-003327-0003,Son las 6 pm donde estoy en Nueva York y necesito saber qué hora es en Islandia.,It's 6 p.m. where I'm in New York and I need to know what time it is in Iceland.,None
METALW-003327-0004,Son las 22:00 horas en Islandia,It's 22:00 a.m. in Iceland,None
METALW-003327-0005,"Genial, gracias por tu ayuda.","Great, thanks for your help.",None
METALW-003327-0006,¿Hay algo más con lo que pueda ayudar?,Is there anything else I can help with?,None
METALW-003327-0007,Creo que eso es todo por ahora.,I think that's it for now.,None
METALW-003327-0008,"Ok, bueno, que tengas un gran día.","Okay, well, have a great day.",None
METALW-003327-0009,"Gracias, tú también.","Thank you, too.",None
METALW-003327-0010,Tendré un gran día.,I'll have a great day.,None
METALW-003328-0000,"Hola, ¿en qué puedo ayudarle?","Hi, how can I help you?",None
METALW-003328-0001,Tengo alguna pregunta sobre el huso horario,I have some questions about the time zone.,None
METALW-003328-0002,¿Para qué zona horaria?,What time zone?,None
METALW-003328-0003,¿Qué huso horario es Nueva York?,What time zone is New York?,None
METALW-003328-0004,Nueva York está en la zona horaria de EDT,New York is in the EDT time zone,None
METALW-003328-0005,"Son las 6 pm en NY ahora, ¿a qué hora sería en Islandia","It's 6 p.m. in NY now, what time would it be in Iceland",None
METALW-003328-0006,serán las 5 de la mañana en Islandia,will be 5 a.m. in Iceland,None
METALW-003328-0007,Gracias por la información,Thank you for the information,None
METALW-003328-0008,¿Hay algo más con lo que pueda ayudarte?,Is there anything else I can help you with?,None
METALW-003328-0009,"No, gracias",No thanks,None
METALW-003328-0010,ok nos vemos,ok I'll see you,None
METALW-003329-0000,"Hola, ¿en qué puedo ayudarle? ¡hola! ¿En qué puedo ayudar?","Hi, how can I help you? Hello! How can I help?",None
METALW-003329-0001,Tengo una pregunta sobre las zonas horarias,I have a question about time zones,None
METALW-003329-0002,seguro. Pregunta lejos.,sure. Ask far away.,None
METALW-003329-0003,¿A qué hora será en Vancouver cuando sea medianoche en San Petersburgo,What time will it be in Vancouver when it's midnight in St. Petersburg,None
METALW-003329-0004,Serán las 13:00 horas en Vancouver.,It'll be 1:00 in Vancouver.,None
METALW-003329-0005,¿Qué zona horaria es Vancouver?,What time zone is Vancouver?,None
METALW-003329-0006,Vancouver está en GMT -4,Vancouver is in GMT -4,None
METALW-003329-0007,"De acuerdo, gracias","All right, thank you.",None
METALW-003329-0008,¿Algo más?,Anything else?,None
METALW-003329-0009,"No, eso es todo.","No, that's all.",None
METALW-003329-0010,Bien. ¡Que tengas un buen día!,Not bad. Have a nice day!,None
METALW-003330-0000,"Hola, ¿en qué puedo ayudarle?","Hi, how can I help you?",None
METALW-003330-0001,¿Sabes de zonas horarias?,Do you know about time zones?,None
METALW-003330-0002,Sí. Puedo darte diferencias de tiempo entre las zonas horarias.,Yes. I can give you time differences between time zones.,None
METALW-003330-0003,¿Cómo funcionan las zonas horarias?,How do time zones work?,None
METALW-003330-0004,Lamento que eso esté más allá de mis habilidades actuales.,I'm sorry that's beyond my current abilities.,None
METALW-003330-0005,¿Estás seguro de bot?,Are you sure about bot?,None
METALW-003330-0006,Sí humano. Conozco el alcance de mis capacidades.,"Yes, human. I know the scope of my abilities.",None
METALW-003330-0007,Está bien. No hay problema,It is ok. No problem,None
METALW-003330-0008,¿Hay algo más con lo que pueda ayudarte?,Is there anything else I can help you with?,None
METALW-003330-0009,nada,nothing,None
METALW-003330-0010,Que tengas un buen día bot.,"Have a nice day, bot.",None
METALW-003331-0000,"Hola, ¿en qué puedo ayudarle?","Hi, how can I help you?",None
METALW-003331-0001,hola,Hello,None
METALW-003331-0002,Hola.,Hello.,None
METALW-003331-0003,¿Estás familiarizado con Nueva York?,Are you familiar with New York?,None
METALW-003331-0004,"No, pero puedo sacarte algo de información al respecto.","No, but I can get some information out of you about it.",None
METALW-003331-0005,"bien, ¿cuántas horas está por delante de winnipeg?","well, how many hours is ahead of winnipeg?",None
METALW-003331-0006,Buscando información ahora.,Looking for information now.,None
METALW-003331-0007,Bien,Not bad,None
METALW-003331-0008,Según mi diferencia de tiempo de investigación es de casi una hora.,According to my difference in research time it's almost an hour.,None
METALW-003331-0009,bien gracias,Fine thank you,None
METALW-003331-0010,¡De nada!,You are welcome!,None
METALW-003332-0000,"Hola, ¿en qué puedo ayudarle?","Hi, how can I help you?",None
METALW-003332-0001,ayúdame con zonas horarias,help me with time zones,None
METALW-003332-0002,"Claro, puedo ayudarte con las zonas horarias","Sure, I can help you with time zones",None
METALW-003332-0003,así que estoy en San Petersburgo en este momento y es medianoche,so I'm in St. Petersburg right now and it's midnight,None
METALW-003332-0004,Eso es correcto,That's right,None
METALW-003332-0005,¿A qué hora es en Vancouver ahora?,What time is it in Vancouver right now?,None
METALW-003332-0006,Son las 21:00 horas en Vancouver ahora mismo. Están 3 horas detrás de San Petersburgo.,It's 9 p.m. in Vancouver right now. They're three hours behind St. Petersburg.,None
METALW-003332-0007,¿Hasta dónde están las 2 ciudades?,How far are the 2 cities?,None
METALW-003332-0008,San Petersburgo y Vancouver están a 3.250 millas de distancia,"St. Petersburg and Vancouver are 3,250 miles away",None
METALW-003332-0009,Bien. gracias,Not bad. Thank you,None
METALW-003332-0010,Claro. ¿Hay algo más con lo que pueda ayudarte hoy?,Of course. Is there anything else I can help you with today?,None
METALW-003332-0011,No,No,None
METALW-003333-0000,"Hola, ¿en qué puedo ayudarle?","Hi, how can I help you?",None
METALW-003333-0001,Necesito información de tiempo.,I need time information.,None
METALW-003333-0002,¿Para dónde necesitas tiempo?,Where do you need time for?,None
METALW-003333-0003,"Estoy en Nueva Jersey, ¿qué hora hay en Islandia?","I'm in New Jersey, what time is it in Iceland?",None
METALW-003333-0004,Hay una diferencia horaria de cuatro horas entre NJ e Islandia. Islandia está 4 horas por delante de NJ.,There is a four-hour time difference between NJ and Iceland. Iceland is 4 hours ahead of NJ.,None
METALW-003333-0005,¿Qué huso horario es éso?,What time zone is that?,None
METALW-003333-0006,"Islandia está en Greenwich Mean Time. Nueva Jersey está en hora del este,","Iceland is in Greenwich Mean Time. New Jersey is on East Time,",None
METALW-003333-0007,¡gracias!,Thank you!,None
METALW-003333-0008,De nada. La hora actual en Islandia es de 2:39 a.m. de mañana y son las 10:39 p. m. de hoy en Nueva Jersey.,You are welcome. The current time in Iceland is 2:39 a.m. tomorrow and it is 10:39 p.m. today in New Jersey.,None
METALW-003333-0009,Ok gracias de nuevo!,Ok thanks again!,None
METALW-003333-0010,¡Que tengas una gran noche!,Have a great night!,None
METALW-003334-0000,"Hola, ¿en qué puedo ayudarle?","Hi, how can I help you?",None
METALW-003334-0001,Son las 6 de la tarde en Nueva York y necesito saber qué hora es en Islandia.,It's 6pm in New York and I need to know what time it is in Iceland.,None
METALW-003334-0002,Hola la hora en Islandia es actualmente 2:00 PM viernes.,Hello the time in Iceland is currently 2:00 PM Friday.,None
METALW-003334-0003,6 pm en Nueva York ¿a qué hora es en California?,6 pm in New York what time is it in California?,None
METALW-003334-0004,"Si la hora es a las 6:00 PM en Nueva York, entonces la hora es a las 3:00 PM en California.","If the time is at 6:00 PM in New York, then the time is at 3:00 PM in California.",None
METALW-003334-0005,"Gracias, ¿cuántas horas de diferencia horaria son Florida y Alemania?","Thank you, how many hours of time difference are Florida and Germany?",None
METALW-003334-0006,"Alemania está 6 horas por delante de Tallahassee, Florida.","Germany is 6 hours ahead of Tallahassee, Florida.",None
METALW-003334-0007,"Es bueno saberlo, gracias.","It's good to know, thank you.",None
METALW-003334-0008,"Claro, de nada. ¿Hay algo más con lo que pueda ayudarte hoy?","Sure, you're welcome. Is there anything else I can help you with today?",None
METALW-003334-0009,Eso era todo lo que necesitaba gracias de nuevo.,That's all I needed thanks again.,None
METALW-003334-0010,No hay problema. Fue un placer ser de servicio.,No problem. It was a pleasure to be of service.,None
METALW-003335-0000,"Hola, ¿en qué puedo ayudarle?","Hi, how can I help you?",None
METALW-003335-0001,"Hola, ¿puedo preguntar algo?","Hi, can I ask you something?",None
METALW-003335-0002,¿Cuál es tu pregunta?,What's your question?,None
METALW-003335-0003,Estoy en Nueva York y son las 18:00. ¿Qué hora es ahora en Islandia?,I'm in New York and it's 18:00. What time is it now in Iceland?,None
METALW-003335-0004,Le gustaría saber que la hora actual en Islandia es la correcta?,Would you like to know that the current time in Iceland is correct?,None
METALW-003335-0005,Sí.,Yes.,None
METALW-003335-0006,Actualmente son las 23:00 horas en Islandia.,It is currently 23:00 hours in Iceland.,None
METALW-003335-0007,En serio.,Seriously.,None
METALW-003335-0008,Sí. ¿Hay algo más con lo que pueda ayudarte?,Yes. Is there anything else I can help you with?,None
METALW-003335-0009,Es todo,That's all,None
METALW-003335-0010,"Está bien, entonces.","All right, then.",None
METALW-003335-0011,gracias.,Thank you.,None
METALW-003336-0000,"Hola, ¿en qué puedo ayudarle?","Hi, how can I help you?",None
METALW-003336-0001,Me gustaría información.,I'd like some information.,None
METALW-003336-0002,¿Qué tipo de información le gustaría?,What kind of information would you like?,None
METALW-003336-0003,¿Cómo funcionan las zonas horarias?,How do time zones work?,None
METALW-003336-0004,No puedo proporcionar ninguna información sobre cómo funcionan. ¡Puedo darte momentos específicos en ciertas zonas horarias!,I can't provide any information on how they work. I can give you specific times in certain time zones!,None
METALW-003336-0005,Bien. ¿A qué hora es en California?,Not bad. What time is it in California?,None
METALW-003336-0006,Son las 10:03 en California.,It's 10:03 in California.,None
METALW-003336-0007,¡Gracias!,Thank you!,None
METALW-003336-0008,¿De nada más puedo ayudarte?,Can I just help you?,None
METALW-003336-0009,Es todo. ¡Adiós!,That's all. Good bye!,None
METALW-003336-0010,¡Adiós!,Good bye!,None
METALW-003337-0000,"Hola, ¿en qué puedo ayudarle?","Hi, how can I help you?",None
METALW-003337-0001,Necesito saber algo sobre las zonas horarias,I need to know something about time zones.,None
METALW-003337-0002,¿Seguro que qué quieres saber?,Are you sure what you want to know?,None
METALW-003337-0003,¿Cuántas horas está Nueva York por delante de Winnipeg?,How many hours is New York ahead of Winnipeg?,None
METALW-003337-0004,Nueva York está 4 horas por delante.,New York is four hours ahead.,None
METALW-003337-0005,¿En qué zona horaria está Nueva York?,What time zone is New York in?,None
METALW-003337-0006,Nueva York está en la zona horaria del Eastern Standard.,New York is in the Eastern Standard time zone.,None
METALW-003337-0007,¿Y qué huso horario es winnipeg?,And what time zone is winnipeg?,None
METALW-003337-0008,Winnipeg es el horario de verano central,Winnipeg is central daylight saving time,None
METALW-003337-0009,"Bien, gracias por la información","Well, thanks for the information.",None
METALW-003337-0010,¡Que tengas un buen día!,Have a nice day!,None
METALW-003338-0000,"Hola, ¿en qué puedo ayudarle?","Hi, how can I help you?",None
METALW-003338-0001,ayúdame con zonas horarias,help me with time zones,None
METALW-003338-0002,¿Qué puedo hacer para ayudarte hoy?,What can I do to help you today?,None
METALW-003338-0003,zonas horarias. ¿Cómo funcionan?,time zones. How do they work?,None
METALW-003338-0004,"Puedo calcular los tiempos en diferentes zonas horarias, pero no puedo decirte cómo funcionan. arrepentido.","I can calculate times in different time zones, but I can't tell you how they work. repentant.",None
METALW-003338-0005,actualizar su sistema o algo así. Lo necesito para mi informe de laboratorio,update your system or something. I need it for my lab report.,None
METALW-003338-0006,"Lo siento, no se puede hacer.","I'm sorry, it can't be done.",None
METALW-003338-0007,¿quién puede decírmelo entonces?,Who can tell me then?,None
METALW-003338-0008,Intenta googlearlo,Try to google it,None
METALW-003338-0009,ok gracias de todos modos,ok thanks anyway,None
METALW-003338-0010,Que tengas un buen día,Have a nice day,None
METALW-003339-0000,"Hola, ¿en qué puedo ayudarle?","Hi, how can I help you?",None
METALW-003339-0001,¿Puedes ayudarme con las zonas horarias?,Can you help me with the time zones?,None
METALW-003339-0002,Claro que sí. ¿Con qué necesitas ayuda?,Of course. What do you need help with?,None
METALW-003339-0003,Me gustaría saber cuántas horas está Nueva York por delante de Winnipeg.,I'd like to know how many hours New York is ahead of Winnipeg.,None
METALW-003339-0004,Nueva York está 3 horas por delante de Winnipeg,New York is 3 hours ahead of Winnipeg,None
METALW-003339-0005,fresco. ¿En qué zona horaria está Winnipeg?,fresh. What time zone is Winnipeg in?,None
METALW-003339-0006,Eso es en lo que se llama la zona horaria fría,That's what's called the cold time zone.,None
METALW-003339-0007,¿En qué zona horaria está Nueva York?,What time zone is New York in?,None
METALW-003339-0008,Nueva York es la zona horaria oriental,New York is the eastern time zone,None
METALW-003339-0009,"Neat, no sabía que había una zona horaria llamada ""Cold"" ja, aprender algo nuevo todo el tiempo","Neat, I didn't know there was a time zone called ""Cold"" ha, learning something new all the time",None
METALW-003339-0010,¿Hay algo más con lo que pueda ayudarte? :),Is there anything else I can help you with? :),None
METALW-003339-0011,Gracias por la información.,Thanks for the information.,None
METALW-003339-0012,De nada,You are welcome,None
METALW-003339-0013,Es todo,That's all,None
METALW-003340-0000,"Hola, ¿en qué puedo ayudarle?","Hi, how can I help you?",None
METALW-003340-0001,Necesito ayuda con las zonas horarias.,I need help with time zones.,None
METALW-003340-0002,seguro. ¿Con qué necesitas ayuda>?,sure. What do you need help with>?,None
METALW-003340-0003,"Si es medianoche en San Petersburgo, ¿a qué hora sería en Vancouver?","If it's midnight in St. Petersburg, what time would it be in Vancouver?",None
METALW-003340-0004,"Un momento, por favor, según calculo.","Wait a minute, please, as I reckon.",None
METALW-003340-0005,Bien.,Not bad.,None
METALW-003340-0006,Serán las 2:00 p.m. en Vancouver el día anterior.,It'll be 2:00 p.m in Vancouver the day before.,None
METALW-003340-0007,¿Y en qué huso horario está San Petersburgo?,And what time zone is St. Petersburg in?,None
METALW-003340-0008,UTC +3.,UTC +3.,None
METALW-003340-0009,Muy bien gracias por la información.,"All right, thanks for the information.",None
METALW-003340-0010,No hay problema.,No problem.,None
METALW-003341-0000,"Hola, ¿en qué puedo ayudarle?","Hi, how can I help you?",None
METALW-003341-0001,Necesito ayuda en las zonas horarias,I need help in time zones.,None
METALW-003341-0002,seguro. ¿Cómo puedo ayudarle?,sure. How can I help you?,None
METALW-003341-0003,¿En qué zona horaria se encuentra Nueva York?,What time zone is New York in?,None
METALW-003341-0004,Nueva York está en la zona horaria del este.,New York is in the East Time Zone.,None
METALW-003341-0005,¿Cuántas horas está Nueva York por delante de Winnipeg?,How many hours is New York ahead of Winnipeg?,None
METALW-003341-0006,Nueva York y Winnipeg están en la misma zona horaria.,New York and Winnipeg are in the same time zone.,None
METALW-003341-0007,Gracias por esa información,Thank you for that information,None
METALW-003341-0008,De nada. ¿Hay algo más que pueda hacer por ti?,You are welcome. Is there anything else I can do for you?,None
METALW-003341-0009,Eso es todo por ahora,That's all for now.,None
METALW-003341-0010,Que tengas un buen día.,Have a nice day.,None
METALW-003342-0000,"Hola, ¿en qué puedo ayudarle?","Hi, how can I help you?",None
METALW-003342-0001,¿Cuántas horas por delante está Nueva York de Winnipeg?,How many hours ahead is Winnipeg's New York?,None
METALW-003342-0002,es una hora por delante,it's an hour ahead,None
METALW-003342-0003,¿En qué zona horaria está Winnipeg?,What time zone is Winnipeg in?,None
METALW-003342-0004,está en el tiempo estándar central,is in the central standard time,None
METALW-003342-0005,¿Cuál es el huso horario para Nueva York?,What is the time zone for New York?,None
METALW-003342-0006,Estándar oriental,Eastern standard,None
METALW-003342-0007,¿Cuántas horas por delante si Nueva York viene de Los Ángeles?,How many hours ahead if New York comes from Los Angeles?,None
METALW-003342-0008,5 ¿Algo más?,5 Anything else?,None
