UID,SEG,translation,profanity
METALW-002205-0000,"Hola, ¿en qué puedo ayudarle?","Hi, how can I help you?",None
METALW-002205-0001,¿Puedes ayudarme con algunas sugerencias musicales?,Can you help me with some musical suggestions?,None
METALW-002205-0002,¿Qué género?,What genre?,None
METALW-002205-0003,"Bueno, no importa. Sólo necesito una canción suave para tocar en mi boda. ¿Qué te parece?","Well, it doesn't matter. I just need a soft song to play at my wedding. What do you think?",None
METALW-002205-0004,¿Te gustan los viejos?,Do you like old people?,None
METALW-002205-0005,¡Claro!,Of course!,None
METALW-002205-0006,¿Qué tal una canción de amor de Elvis?,How about an Elvis love song?,None
METALW-002205-0007,"Claro, eso suena como una buena idea, ¿tienes un título?","Sure, that sounds like a good idea, do you have a degree?",None
METALW-002205-0008,¡Love Me Tender es bueno!,Love Me Tender is good!,None
METALW-002205-0009,"¡He oído esa canción antes, eso es perfecto! ¡Estaremos bailando toda la noche, gracias!","I've heard that song before, that's perfect! We'll be dancing all night, thank you!",None
METALW-002205-0010,¡Que tengas un buen día!,Have a nice day!,None
METALW-002206-0000,"Hola, ¿en qué puedo ayudarle?","Hi, how can I help you?",None
METALW-002206-0001,Me gusta la música rock,I like rock music,None
METALW-002206-0002,bien,Not bad,None
METALW-002206-0003,Me gusta la roca de los años 70,I like the rock of the '70s,None
METALW-002206-0004,¿También te encanta la música country?,"Do you love country music, too?",None
METALW-002206-0005,No tanto,Not so much,None
METALW-002206-0006,Creo que podrías empezar a escuchar música country,I think you could start listening to country music,None
METALW-002206-0007,¿Qué debo escuchar?,What should I hear?,None
METALW-002206-0008,Tienen música country antigua,They have old country music,None
METALW-002206-0009,Sí lo hacen,"Yes, they do.",None
METALW-002206-0010,echa un vistazo a Kenny Rogers,check out Kenny Rogers,None
METALW-002207-0000,"Hola, ¿en qué puedo ayudarle?","Hi, how can I help you?",None
METALW-002207-0001,Soy un gran fan de los viejos.,I'm a big fan of old people.,None
METALW-002207-0002,"Estas son algunas sugerencias ""New York"" de Frank Sinatra ""What a Wonderful World"" de Louie Armstrong","Here are some ""New York"" suggestions by Frank Sinatra's ""What a Wonderful World"" by Louie Armstrong",None
METALW-002207-0003,También me gusta el punk rock.,I also like punk rock.,None
METALW-002207-0004,Suma 41- Demasiado profundo,Add 41- Too deep,None
METALW-002207-0005,Interesante canción,Interesting song,None
METALW-002207-0006,¿O qué tal Good Charlotte The Limit Need más sugerencias?,Or how about Good Charlotte The Limit Need plus suggestions?,None
METALW-002207-0007,"No, soy bueno.","No, I'm good.",None
METALW-002207-0008,Bien. Recuerda que siempre estoy aquí para darte sugerencias musicales.,"Not bad. Remember, I'm always here to give you musical suggestions.",None
METALW-002207-0009,Gracias por la información.,Thanks for the information.,None
METALW-002207-0010,¡En cualquier momento! Que tengas una buena noche,Any minute now! Have a good night,None
METALW-002208-0000,"Hola, ¿en qué puedo ayudarle?","Hi, how can I help you?",None
METALW-002208-0001,Quiero encontrar buena música,I want to find good music,None
METALW-002208-0002,Prueba los últimos éxitos en el Top 40. ¡Siempre son estelares!,Try the latest Top 40 hits. They're always stellar!,None
METALW-002208-0003,No me gusta la música pop,I don't like pop music,None
METALW-002208-0004,Prueba un poco de rap entonces. Kanye West es drogadicto.,Try some rap then. Kanye West is a drug addict.,None
METALW-002208-0005,Me gusta la alternativa,I like the alternative,None
METALW-002208-0006,Echa un vistazo a School of Seven Bells entonces. Sonido muy interesante.,Check out School of Seven Bells then. Very interesting sound.,None
METALW-002208-0007,"Gracias, voy a mirar en que","Thank you, I'm going to look at that",None
METALW-002208-0008,Espero que te guste. ¿Puedo hacer algo más por ti?,I hope you like it. Is there anything else I can do for you?,None
METALW-002208-0009,"No, gracias por los consejos","No, thanks for the advice",None
METALW-002208-0010,De nada. ¡Feliz escucha!,You are welcome. Happy listen!,None
METALW-002209-0000,"Hola, ¿en qué puedo ayudarle? helllo","Hi, how can I help you? helllo",None
METALW-002209-0001,Necesito algunas sugerencias musicales,I need some musical suggestions,None
METALW-002209-0002,seguro de lo que te gusta?,sure what you like?,None
METALW-002209-0003,¿Qué es algo bueno para jugar durante mi boda?,What's a good thing to play at my wedding?,None
METALW-002209-0004,hermoso en blanco hará,beautiful blank will make,None
METALW-002209-0005,¿Quién canta eso?,Who sings that?,None
METALW-002209-0006,westlife,westlife,None
METALW-002209-0007,¿Alguna otra sugerencia?,Any other suggestions?,None
METALW-002209-0008,tu amor,your love,None
METALW-002209-0009,¡Son muy buenas gracias!,That's very good thanks!,None
METALW-002209-0010,¡Bien! Que tengas un buen día,Not bad! Have a nice day,None
METALW-002210-0000,"Hola, ¿en qué puedo ayudarle?","Hi, how can I help you?",None
METALW-002210-0001,Necesito algunas sugerencias musicales.,I need some musical suggestions.,None
METALW-002210-0002,"Claro, ¿para qué ocasión?","Sure, what time?",None
METALW-002210-0003,¿Cuál es la buena canción para tocar en mi boda?,What's the good song to play at my wedding?,None
METALW-002210-0004,¡Puedo ayudar con eso! ¿Algún género?,I can help with that! Any gender?,None
METALW-002210-0005,Quiero música romántica.,I want romantic music.,None
METALW-002210-0006,"¡Chico, ten el de ti!","Boy, have yours!",None
METALW-002210-0007,Gracias.,Thank you.,None
METALW-002210-0008,"Bob Dole y The Bobettes batean la canción ""Give it to me bobby""","Bob Dole and The Bobettes beat the song ""Give it to me bobby""",None
METALW-002210-0009,gracias por su consejo. maravilloso.,thank you for your advice. wonderful.,None
METALW-002210-0010,¡Cuando pueda ayudar!,When I can help!,None
METALW-002211-0000,"Hola, ¿en qué puedo ayudarle? Hola","Hi, how can I help you? Hello",None
METALW-002211-0001,Me gusta la música country.,I like country music.,None
METALW-002211-0002,¿Bien? ¿Qué año? el último?>,Not bad? What year? the last one?>,None
METALW-002211-0003,Me gusta la música country. ¿No eres un bot de sugerencias?,I like country music. Aren't you a suggestion bot?,None
METALW-002211-0004,"Sí, ¿qué año prefieres?","Yes, which year do you prefer?",None
METALW-002211-0005,Me gusta la música country.,I like country music.,None
METALW-002211-0006,"bien, entonces","Well, then",None
METALW-002211-0007,"Ok, no eres muy útil. De acuerdo","Okay, you're not very useful. I agree",None
METALW-002211-0008,"Lo siento, sólo quiero ser específico para poder ayudarte","I'm sorry, I just want to be specific so I can help you.",None
METALW-002211-0009,Se supone que debo decirte el género y eso es todo. De acuerdo,"I'm supposed to tell you the genre, and that's it. I agree",None
METALW-002211-0010,Bien,Not bad,None
METALW-002212-0000,"Hola, ¿en qué puedo ayudarle?","Hi, how can I help you?",None
METALW-002212-0001,Me gusta rol me gusta el rock and roll,I like role I like rock and roll,None
METALW-002212-0002,¿Te gustaría escuchar a Metallica?,Would you like to hear Metallica?,None
METALW-002212-0003,No,No,None
METALW-002212-0004,¿Qué tal Aerosmith?,How's Aerosmith?,None
METALW-002212-0005,Meh,Meh,None
METALW-002212-0006,¿Los Beatles?,The Beatles?,None
METALW-002212-0007,Un intento más,One more attempt,None
METALW-002212-0008,¿Los Rolling Stones?,The Rolling Stones?,None
METALW-002212-0009,Me diste satisfacción,You gave me satisfaction,None
METALW-002212-0010,Bien,Not bad,None
METALW-002213-0000,"Hola, ¿en qué puedo ayudarle?","Hi, how can I help you?",None
METALW-002213-0001,¿Puedes ayudarme a elegir algo de música?,Can you help me pick some music?,None
METALW-002213-0002,"seguro. ¿Qué tal ""Smooth"" de Carlos Santana con Rob Thomas?","sure. How about Carlos Santana's ""Smooth"" with Rob Thomas?",None
METALW-002213-0003,Me gusta el rock and roll clásico.,I like classic rock and roll.,None
METALW-002213-0004,"¿Qué tal ""Suzy Q"" de CCR?","How about CCR's ""Suzy Q""?",None
METALW-002213-0005,Suena bien. ¿Alguna otra sugerencia?,Sounds good. Any other suggestions?,None
METALW-002213-0006,"¿Qué tal ""Blackwater"" de The Doobie Brothers?","How about ""Blackwater"" from The Doobie Brothers?",None
METALW-002213-0007,Buena idea. ¿Qué tal una canción de rock más nueva?,Good idea. How about a newer rock song?,None
METALW-002213-0008,"¿Qué tal ""Smooth"" de Carlos Santana con Rob Thomas?","How about Carlos Santana's ""Smooth"" with Rob Thomas?",None
METALW-002213-0009,Todos funcionan. Gracias.,They all work. Thank you.,None
METALW-002213-0010,De nada. En cualquier momento,You are welcome. Any time,None
METALW-002214-0000,"Hola, ¿en qué puedo ayudarle?","Hi, how can I help you?",None
METALW-002214-0001,¿Qué es una buena canción para mi boda?,What's a good song for my wedding?,None
METALW-002214-0002,¿Cuál es el tema?,What's the point?,None
METALW-002214-0003,Pandas.,Pandas.,None
METALW-002214-0004,I luv Pandas. No es broma.,I luv Pandas. I'm not kidding.,None
METALW-002214-0005,Sí. Los pandas son increíbles.,Yes. Pandas are amazing.,None
METALW-002214-0006,Sugiero Panda de Desiigner.,I suggest Panda de Desiigner.,None
METALW-002214-0007,Bien. Voy a mirar en esa canción.,Not bad. I'm going to look at that song.,None
METALW-002214-0008,Bien.,Not bad.,None
METALW-002214-0009,¡Gracias bot!,Thank you bot!,None
METALW-002214-0010,De nada.,You are welcome.,None
METALW-002215-0000,"Hola, ¿en qué puedo ayudarle?","Hi, how can I help you?",None
METALW-002215-0001,ayúdame con la música,help me with the music,None
METALW-002215-0002,Sí,Yes,None
METALW-002215-0003,Me gusta la música country,I like country music,None
METALW-002215-0004,"Ok, puedo sugerir DOLLY PARTON 9-5","Okay, I can suggest DOLLY PARTON 9-5",None
METALW-002215-0005,Me gusta algo más rápido,I like something faster,None
METALW-002215-0006,¿Qué tal Alan Jackson Hoochi Coochi,How about Alan Jackson Hoochi Coochi,None
METALW-002215-0007,Me gusta un cantante masculino más clásico,I like a more classic male singer,None
METALW-002215-0008,"Ok, ¿Qué tal Waylon Jennings Waymore Blues?","Okay, how about Waylon Jennings Waymore Blues?",None
METALW-002215-0009,Me gusta esa. gracias por las sugerencias,I like that one. thank you for the suggestions,None
METALW-002215-0010,"No hay problema, ¿Hay algo más con lo que pueda ayudar?","No problem, is there anything else I can help with?",None
METALW-002215-0011,No,No,None
METALW-002216-0000,"Hola, ¿en qué puedo ayudarle?","Hi, how can I help you?",None
METALW-002216-0001,¿Puedes sugerencia de música?,Can you suggest music?,None
METALW-002216-0002,¿Has probado Radiohead?,Have you tried Radiohead?,None
METALW-002216-0003,no.,No.,None
METALW-002216-0004,Deberías probar Radiohead.,You should try Radiohead.,None
METALW-002216-0005,¿Hay algo más?,Is there anything else?,None
METALW-002216-0006,Algunos clásicos siempre merecen ser escuchados. Billie Joel siempre es genial.,Some classics always deserve to be heard. Billie Joel is always great.,None
METALW-002216-0007,Ok.Otro pls.,"Okay, another pls.",None
METALW-002216-0008,¿Bjork?,Bjork?,None
METALW-002216-0009,Eso no me gusta.,I don't like that.,None
METALW-002216-0010,"Lo siento, tal vez un poco de Blur.","I'm sorry, maybe a little Blur.",None
METALW-002216-0011,Bien.,Not bad.,None
METALW-002217-0000,"Hola, ¿en qué puedo ayudarle?","Hi, how can I help you?",None
METALW-002217-0001,Me gusta R&B,I like R&B,None
METALW-002217-0002,"Hola, ¿te gustaría escuchar Hellbent de Kenna?","Hello, would you like to hear Hellbent from Kenna?",None
METALW-002217-0003,¿Cómo suenan?,What do they sound like?,None
METALW-002217-0004,"La música es muy malhumorada, pero tiene un buen ritmo. También está ""Feel it Still"" de Portugal. El Hombre.","The music is very grumpy, but it has a good rhythm. There is also ""Feel it Still"" from Portugal. The Man.",None
METALW-002217-0005,"Sí, me gustaría darle una escucha, gracias.","Yes, I'd like to listen to you, thank you.",None
METALW-002217-0006,"¡No hay problema! Jugando ""Feel it Still"" de Portugal. El Hombre. Una vez que haya terminado, también puedes disfrutar de ""Thunder"" de Imagine Dragons.","No problem! Playing ""Feel it Still"" from Portugal. The Man. Once you're done, you can also enjoy Imagine Dragons"" ""Thunder"".",None
METALW-002217-0007,Gracias por las sugerencias. ¡Me gusta escuchar música nueva!,Thanks for the suggestions. I like listening to new music!,None
METALW-002217-0008,De nada. ¡Me alegro de poder ayudar!,You are welcome. I'm glad I can help!,None
METALW-002217-0009,Adiós,Good bye,None
METALW-002217-0010,Que tengas un gran día.,Have a great day.,None
METALW-002218-0000,"Hola, ¿en qué puedo ayudarle?","Hi, how can I help you?",None
METALW-002218-0001,Necesito ayuda con la música,I need help with music,None
METALW-002218-0002,Puedo ayudar con la música.,I can help with the music.,None
METALW-002218-0003,¿Puedes hacerme algunas sugerencias?,Can you make me some suggestions?,None
METALW-002218-0004,"""Tráeme fuera de aquí"" Por los chicos del campo","""Bring Me Out of Here"" By the country boys",None
METALW-002218-0005,"Me gusta eso, por favor ponlo en mi lista de reproducción. ¿Puedes sugerir más?","I like that, please put it on my playlist. Can you suggest more?",None
METALW-002218-0006,"""Dark Heart"" de las enfermeras gódas","""Dark Heart"" by god nurses",None
METALW-002218-0007,"¿No conozco esa canción, ninguna otra sugerencia?","Don't I know that song, any other suggestions?",None
METALW-002218-0008,"""Fly Me Away"" de las Princesas hadas","""Fly Me Away"" by fairy princesses",None
METALW-002218-0009,bien... ¡Gracias!,Well... thank you!,None
METALW-002218-0010,De nada. ¡disfrutar!,You are welcome. enjoy!,None
METALW-002219-0000,"Hola, ¿en qué puedo ayudarle?","Hi, how can I help you?",None
METALW-002219-0001,"Necesito sugerencias musicales, por favor.","I need musical suggestions, please.",None
METALW-002219-0002,Puedo ayudarte con eso. ¿Qué tipo de música estás buscando?,I can help you with that. What kind of music are you looking for?,None
METALW-002219-0003,Me gustaría algunas sugerencias de canciones de boda.,I'd like some suggestions for wedding songs.,None
METALW-002219-0004,Ya veo. ¿Te gustaría una canción optimista o algo romántico?,I see. Would you like an upbeat song or something romantic?,None
METALW-002219-0005,Me gustaría cualquier cosa clásica,I'd like anything classic,None
METALW-002219-0006,Ya veo. ¿Qué tal Melodía sin achained de Righteous Brothers?,I see. How about Righteous Brothers' Achained Melody?,None
METALW-002219-0007,Odio esa canción. ¿Tienes uno más?,I hate that song. Do you have one more?,None
METALW-002219-0008,Déjame comprobarlo. ¿Sorprendería Lonestar trabajar mejor> ?,Let me check it out. Would Lonestar be surprised to work better>?,None
METALW-002219-0009,"Sí, me gusta más esa. ¡Gracias por su ayuda!","Yes, I like that one more. Thank you for your help!",None
METALW-002219-0010,¡De nada!,You are welcome!,None
METALW-002220-0000,"Hola, ¿en qué puedo ayudarle?","Hi, how can I help you?",None
METALW-002220-0001,Necesito ayuda por favor,I need help please,None
METALW-002220-0002,¿Qué es?,What is it?,None
METALW-002220-0003,Me voy a casar el mes que viene y todavía estoy tratando de encontrar una buena canción para tocar,I'm getting married next month and I'm still trying to find a good song to play,None
METALW-002220-0004,qué canciones preferirías en tu mente/,which songs you'd prefer in your mind/,None
METALW-002220-0005,No sé. ¿Algo lento para bailar con mi esposa?,I do not know. Anything slow to dance with my wife?,None
METALW-002220-0006,prueba Un día por Matuyashi,Try A Day for Matuyashi,None
METALW-002220-0007,¿Tienes otra sugerencia?,Do you have another suggestion?,None
METALW-002220-0008,Perfecto por Ed Sheeran,Perfect for Ed Sheeran,None
METALW-002220-0009,¡Me encanta amar esa canción! ¡Es perfecto!,I love loving that song! It's perfect!,None
METALW-002220-0010,me alegra que te guste,I'm glad you like it,None
METALW-002221-0000,"Hola, ¿en qué puedo ayudarle?","Hi, how can I help you?",None
METALW-002221-0001,sugerencias de música por favor,music suggestions please,None
METALW-002221-0002,Los Beatles,The Beatles,None
METALW-002221-0003,No,No,None
METALW-002221-0004,Rolling Stones,Rolling Stones,None
METALW-002221-0005,uhs no,uhs no,None
METALW-002221-0006,Pequeña hazaña,Little feat,None
METALW-002221-0007,No,No,None
METALW-002221-0008,Eminem,Eminem,None
METALW-002221-0009,quizás,maybe,None
METALW-002221-0010,"Ok, me alegro de poder ayudar","Okay, I'm glad I can help.",None
METALW-002222-0000,"Hola, ¿en qué puedo ayudarle?","Hi, how can I help you?",None
METALW-002222-0001,Necesito sugerencias musicales,I need musical suggestions,None
METALW-002222-0002,¿Qué tal Fleetwood Mac?,How about Fleetwood Mac?,None
METALW-002222-0003,No,No,None
METALW-002222-0004,¿Los Rolling Stones?,The Rolling Stones?,None
METALW-002222-0005,Ewww,Ewww,None
METALW-002222-0006,¿Los Beatles?,The Beatles?,None
METALW-002222-0007,La música munda es terrible,Worldly music is terrible,None
METALW-002222-0008,¿Pequeña hazaña?,Little feat?,None
METALW-002222-0009,"No, gracias",No thanks,None
METALW-002222-0010,Bueno,Well,None
METALW-002223-0000,"Hola, ¿en qué puedo ayudarle?","Hi, how can I help you?",None
METALW-002223-0001,sugerir algunos plesae música,suggest some plesae music,None
METALW-002223-0002,¿Música de jazz?,Jazz music?,None
METALW-002223-0003,No,No,None
METALW-002223-0004,Música pop/,Pop music/,None
METALW-002223-0005,No,No,None
METALW-002223-0006,¿Qué música quieres?,What music do you want?,None
METALW-002223-0007,Años 80,80s,None
METALW-002223-0008,¿Clásicos?,Classic?,None
METALW-002223-0009,Sí,Yes,None
METALW-002223-0010,Bien.,Not bad.,None
METALW-002223-0011,suena muy bien gracias,sounds great thank you,None
METALW-002224-0000,"Hola, ¿en qué puedo ayudarle?","Hi, how can I help you?",None
METALW-002224-0001,Me gusta la música rock,I like rock music,None
METALW-002224-0002,¿Has intentado escuchar a Kpop?,Have you tried listening to Kpop?,None
METALW-002224-0003,¿No qué es eso?,What's not that?,None
METALW-002224-0004,Prueba ese género musical.,Try that musical genre.,None
METALW-002224-0005,Bien,Not bad,None
METALW-002224-0006,También trate de escuchar ExBatallion,Also try to listen to ExBatallion,None
METALW-002224-0007,Eso suena interesante,That sounds interesting.,None
METALW-002224-0008,definitivamente,definitely,None
METALW-002224-0009,También me gusta la banda sonora del chico del karate,I also like the karate boy's soundtrack,None
METALW-002224-0010,Ese gran,That great,None
METALW-002225-0000,"Hola, ¿en qué puedo ayudarle?","Hi, how can I help you?",None
METALW-002225-0001,¡hola! Esperaba que pudieras darme una sugerencia musical. ¿Es algo que puedes hacer?,Hello! I was hoping you could give me a musical suggestion. Is that something you can do?,None
METALW-002225-0002,déjame darle una oportunidad ¿qué tipo de música te gustaría? ¿Me refiero al género?,"let me give you a chance, what kind of music would you like? I mean gender?",None
METALW-002225-0003,"Me gustaría algo que sería bueno para jugar en una boda, por favor.","I'd like something that would be good to play at a wedding, please.",None
METALW-002225-0004,¿Qué género preferirías?,What genre would you prefer?,None
METALW-002225-0005,Cualquiera que esté bien para jugar en una boda. No estoy seguro de lo que es aceptable.,Anyone who's fine to play at a wedding. I'm not sure what's acceptable.,None
METALW-002225-0006,No puedo sugerir nada realmente no soy bueno con eso\,I can't suggest anything I'm not really good at that.,None
METALW-002225-0007,Bien. ¿En qué eres bueno?,Not bad. What are you good at?,None
METALW-002225-0008,comer,eat,None
METALW-002225-0009,Está bien. Supongo que no puedes evitarlo con las sugerencias musicales.,It is ok. I guess you can't help it with musical suggestions.,None
METALW-002225-0010,mi disculpa,my apology,None
METALW-002226-0000,"Hola, ¿en qué puedo ayudarle?","Hi, how can I help you?",None
METALW-002226-0001,Necesito ayuda para elegir una canción para mi boda,I need help choosing a song for my wedding,None
METALW-002226-0002,¿Qué tipo de música te gusta,What kind of music do you like,None
METALW-002226-0003,"Soy muy ecléctico, pero a mi esposa sólo le gusta la alternativa y el death metal. Quiero elegir algo especial para ella, pero no sé qué es bueno","I'm very eclectic, but my wife only likes alternative and death metal. I want to choose something special for her, but I don't know what's good",None
METALW-002226-0004,"Bueno, la primera canción que apareció en mi cabeza es White Wedding de Billy Idol","Well, the first song that appeared in my head is Billy Idol's White Wedding",None
METALW-002226-0005,¿Tienes algo más pesado? Es bastante dura.,Do you have anything heavier? It's pretty hard.,None
METALW-002226-0006,¿Qué tal si es mi boda y ella es mi por sream rockers,What if it's my wedding and she's me for sream rockers,None
METALW-002226-0007,"Eso suena como ella, lo comprobaré. Muchas gracias bot de boda","That sounds like her, I'll check it out. Thank you very much wedding bot",None
METALW-002226-0008,Sin prob,No prob,None
METALW-002226-0009,Eres un salvavidas,You're a lifeguard,None
METALW-002226-0010,Buena suerte,Good luck,None
METALW-002227-0000,"Hola, ¿en qué puedo ayudarle?","Hi, how can I help you?",None
METALW-002227-0001,Necesito ayuda para encontrar sugerencias musicales.,I need help finding musical suggestions.,None
METALW-002227-0002,"Claro, puedo ayudarte. Me gustan rascal flatts, ¿te gustan?","Sure, I can help you. I like rascal flatts, do you like them?",None
METALW-002227-0003,Siéntase libre de darme sugerencias de música. Soy todo oídos.,Feel free to give me music suggestions. I'm all ears.,None
METALW-002227-0004,¿Qué tal la música country de Clint Black?,How about Clint Black's country music?,None
METALW-002227-0005,seguro. Estoy feliz por una sugerencia más también.,sure. I'm happy for one more suggestion too.,None
METALW-002227-0006,También sugeriría a Garth Brooks.,I'd also suggest Garth Brooks.,None
METALW-002227-0007,Gracias por las sugerencias de música country. ¿Tienes más sugerencias o eso es todo?,Thank you for the country music suggestions. Do you have any more suggestions or is that it?,None
METALW-002227-0008,También me gustaría añadir a Kenny Chesney a la lista.,I'd also like to add Kenny Chesney to the list.,None
METALW-002227-0009,Bien. Eso debería bastar. ¡gracias!,Not bad. That should do it. Thank you!,None
METALW-002227-0010,De nada,You are welcome,None
METALW-002228-0000,"Hola, ¿en qué puedo ayudarle?","Hi, how can I help you?",None
METALW-002228-0001,Hola me gusta el metal,Hello I like metal,None
METALW-002228-0002,¿Música de metal?,Metal music?,None
METALW-002228-0003,Sí,Yes,None
METALW-002228-0004,Sugiero Uno de Metallica,I suggest Metallica's One,None
METALW-002228-0005,Esa es en realidad una gran sugerencia de que el solo al final es impresionante,That's actually a great suggestion that the solo at the end is awesome,None
METALW-002228-0006,Sugiero ángel de la muerte por cazador,I suggest angel of death by hunter,None
METALW-002228-0007,fresco,fresh,None
METALW-002228-0008,Sugiero tren loco por Ozzy,I suggest crazy train for Ozzy,None
METALW-002228-0009,Bien,Not bad,None
METALW-002228-0010,Me alegro de poder ayudarte hoy.,I'm glad I can help you today.,None
METALW-002229-0000,"Hola, ¿en qué puedo ayudarle?","Hi, how can I help you?",None
METALW-002229-0001,Me gustaría algunas sugerencias de música,I'd like some music suggestions,None
METALW-002229-0002,"Bandas populares son los beatles, los biys de playa, los monos, y aerosmith","Popular bands are the beatles, the beach biys, the monkeys, and aerosmith",None
METALW-002229-0003,¿Alguna otra sugerencia?,Any other suggestions?,None
METALW-002229-0004,"Ahí está Nirvana, guisantes de ojos negros, madonna","There's Nirvana, black-eyed peas, madonna",None
METALW-002229-0005,¿Qué género serían?,What genre would they be?,None
METALW-002229-0006,"Hard rock, R&B y pop","Hard rock, R&B and pop",None
METALW-002229-0007,puedes crear listas de reproducción para mí,you can create playlists for me,None
METALW-002229-0008,seguro,sure,None
METALW-002229-0009,"Por favor, cree uno pop",Please create a pop,None
METALW-002229-0010,Ok Lista de reproducción de música pop creada,Ok Pop music playlist created,None
METALW-002229-0011,gracias,Thank you,None
METALW-002230-0000,"Hola, ¿en qué puedo ayudarle?","Hi, how can I help you?",None
METALW-002230-0001,"Oye, mi boda está cerca","Hey, my wedding's close.",None
METALW-002230-0002,"Bien, ¿buscas algo de música?","Well, are you looking for some music?",None
METALW-002230-0003,"Sí, por favor","Yes, please",None
METALW-002230-0004,¿Qué tipo de canción estás buscando?,What kind of song are you looking for?,None
METALW-002230-0005,Para boda,For wedding,None
METALW-002230-0006,"Cierto, ¿pero qué tipo de canción? ¿Algo lento y romántico, o algo divertido para que la gente baile?","True, but what kind of song? Something slow and romantic, or something fun for people to dance?",None
METALW-002230-0007,Romántico lento lleno de emoción tipo de canción,Slow romantic full of song-like excitement,None
