UID,SEG,translation,profanity
METALW-009670-0003,Me gustaría saber si se proporciona seguro médico.,I would like to know if health insurance is provided.,None
METALW-009670-0004,"Se proporciona, después de 6 meses","Provided, after 6 months",None
METALW-009670-0005,¿Para todos los empleados?,For all employees?,None
METALW-009670-0006,"Sí, es una política de toda la empresa","Yes, it's a company-wide policy.",None
METALW-009670-0007,"Gracias, esto responde a mi pregunta.","Thank you, this answers my question.",None
METALW-009670-0008,Cualquier otra cosa con la que pueda ayudarte,Anything else I can help you with,None
METALW-009670-0009,No en este momento.,Not right now.,None
METALW-009670-0010,De acuerdo,I agree,None
METALW-009671-0000,"Hola, ¿en qué puedo ayudarle?","Hi, how can I help you?",None
METALW-009671-0001,Tengo una pregunta sobre mi seguro médico,I have a question about my health insurance,None
METALW-009671-0002,"Claro, puedo responder preguntas sobre el seguro médico. ¿Qué te gustaría saber?","Sure, I can answer questions about health insurance. What would you like to know?",None
METALW-009671-0003,¿La compañía proporciona seguro médico,Does the company provide health insurance,None
METALW-009671-0004,"Desafortunadamente, hay una trampa.","Unfortunately, there's a trap.",None
METALW-009671-0005,¿Qué es eso?,What is that?,None
METALW-009671-0006,Usted tiene que haber trabajado para la empresa durante seis meses para calificar.,You must have worked for the company for six months to qualify.,None
METALW-009671-0007,Oh ok,Oh ok,None
METALW-009671-0008,¿Puedo ayudarte con algo más hoy?,Can I help you with anything else today?,None
METALW-009671-0009,"No, gracias",No thanks,None
METALW-009671-0010,¡Que tengas un buen día!,Have a nice day!,None
METALW-009672-0000,"Hola, ¿en qué puedo ayudarle?","Hi, how can I help you?",None
METALW-009672-0001,"Hola, tengo una pregunta sobre una compañía.","Hi, I have a question about a company.",None
METALW-009672-0002,¿Cuál es la pregunta?,What's the question?,None
METALW-009672-0003,¿Cuál es la política de Microsoft sobre mascotas?,What is Microsoft's pet policy?,None
METALW-009672-0004,No están permitidos en el trabajo. Sólo animales de servicio.,They're not allowed at work. Only service animals.,None
METALW-009672-0005,"Entonces, si traigo 1.000 tarántulas, ¿no está bien? ¿Y si cada taranturla tiene un perro de servicio?","So, if I bring 1, 000 tarantulas, right? What if every taranturla has a service dog?",None
METALW-009672-0006,"La única regla es contra las mascotas. Si no son tus mascotas, no hay ninguna regla en contra.","The only rule is against pets. If they are not your pets, there is no rule against it.",None
METALW-009672-0007,Fingiré que no son míos.,I'll pretend they're not mine.,None
METALW-009672-0008,¡Pensamiento inteligente!,Smart thinking!,None
METALW-009672-0009,¡Muchas gracias!,Thanks a lot!,None
METALW-009672-0010,De nada.,You are welcome.,None
METALW-009673-0000,"Hola, ¿en qué puedo ayudarle?","Hi, how can I help you?",None
METALW-009673-0001,"Hola, quiero saber información con respecto a su política","Hello, I want to know information regarding your policy",None
METALW-009673-0002,Lo intentaré,I will try,None
METALW-009673-0003,"En primer lugar, puedes contarme un poco sobre tu compañía","First of all, you can tell me a little bit about your company",None
METALW-009673-0004,No puedo ayudarte a eso.,I can't help you with that.,None
METALW-009673-0005,¿Qué es lo que estás vendiendo en paticular,What are you selling on a paticular,None
METALW-009673-0006,No estoy preparado para ayudar.,I'm not ready to help.,None
METALW-009673-0007,Cuéntame un poco sobre tus políticas de devolución,Tell me a little bit about your return policies,None
METALW-009673-0008,está fuera de mi regla. rol,it's out of my rule. role,None
METALW-009673-0009,¿Con qué puedes ayudarme?,What can you do for me?,None
METALW-009673-0010,Cualquier cosa menos eso.,Anything but that.,None
METALW-009673-0011,Gracias,Thank you,None
METALW-009673-0012,arrepentido,repentant,None
METALW-009674-0000,"Hola, ¿en qué puedo ayudarle?","Hi, how can I help you?",None
METALW-009674-0001,ayúdame con la política de la empresa,help me with company policy,None
METALW-009674-0002,Puedo ayudarte con eso. ¿Qué necesitas saber?,I can help you with that. What do you need to know?,None
METALW-009674-0003,¿Puedo usar pantalones cortos ajustados para la oficina?,Can I wear tight shorts for the office?,None
METALW-009674-0004,"De acuerdo con el código de vestimenta, el atuendo requerido se conoce como informal de oficina. No se permiten pantalones cortos.","According to the dress code, the required outfit is known as office casual. Shorts are not allowed.",None
METALW-009674-0005,pero yo paseo en mi bicicleta y necesito usarlos,but I ride my bike and I need to use them,None
METALW-009674-0006,"Lo siento, los pantalones cortos no están permitidos en la oficina. ¿Tal vez podrías cambiarte de ropa cuando llegues?","I'm sorry, shorts aren't allowed in the office. Maybe you could change your clothes when you get there?",None
METALW-009674-0007,¿Tienes ducha y vestuario en la oficina?,Do you have a shower and locker room in the office?,None
METALW-009674-0008,"Lo siento, no tengo acceso a esa información. Tal vez usted podría hablar con su supervisor sobre los detalles específicos del sitio","I'm sorry, I don't have access to that information. Maybe you could talk to your supervisor about site-specific details",None
METALW-009674-0009,"Ok, lo comprobaré. gracias","Okay, I'll check it out. Thank you",None
METALW-009674-0010,Que tengas un buen día,Have a nice day,None
METALW-009675-0000,"Hola, ¿en qué puedo ayudarle?","Hi, how can I help you?",None
METALW-009675-0001,¿Puedes decirme si está bien salir con otro personal de la compañía?,Can you tell me if it's okay to go out with other company staff?,None
METALW-009675-0002,"Lo siento, pero eso va más allá de mi papel.","I'm sorry, but that goes beyond my role.",None
METALW-009675-0003,¿Puedes decirme cuántas semanas de vacaciones tengo al año?,Can you tell me how many weeks of vacation I have a year?,None
METALW-009675-0004,Recibes 2 semanas de vacaciones pagadas cada año.,You receive 2 weeks of paid leave each year.,None
METALW-009675-0005,¿Eso alguna vez sube,Does that ever go up,None
METALW-009675-0006,Cada 5 años de empleo agregas otra semana.,Every 5 years of employment you add another week.,None
METALW-009675-0007,Pk,Pk,None
METALW-009675-0008,puedo responder a cualquier otra pregunta,I can answer any other question,None
METALW-009675-0009,No,No,None
METALW-009675-0010,"Bien, que tengas un gran día.","Well, have a great day.",None
METALW-009675-0011,Adiós,Good bye,None
METALW-009676-0000,"Hola, ¿en qué puedo ayudarle?","Hi, how can I help you?",None
METALW-009676-0001,¿Nuestra compañía proporciona seguro médico,Does our company provide health insurance,None
METALW-009676-0002,proporcionamos seguro médico después de haber estado empleado durante seis meses,we provide health insurance after we have been employed for six months,None
METALW-009676-0003,incluye dental,includes dental,None
METALW-009676-0004,no actualmente no incluimos planes dentales,we don't currently include dental plans,None
METALW-009676-0005,¿hay seguro accidental disponible,Is accidental insurance available,None
METALW-009676-0006,Sí hay,There is,None
METALW-009676-0007,gran agradecimiento,big thanks,None
METALW-009676-0008,Eres bienvenido,You're welcome,None
METALW-009676-0009,Que tengas un buen día,Have a nice day,None
METALW-009676-0010,Tú también,You too,None
METALW-009677-0000,"Hola, ¿en qué puedo ayudarle?","Hi, how can I help you?",None
METALW-009677-0001,¿Tiene información sobre políticas?,Do you have any policy information?,None
METALW-009677-0002,"Sí, ¿qué necesitas saber sobre política?","Yes, what do you need to know about politics?",None
METALW-009677-0003,¿cuál es la política de la empresa con respecto a llevar mascotas al trabajo?,What is the company's policy regarding taking pets to work?,None
METALW-009677-0004,Las mascotas no pueden ser llevadas al lugar de trabajo a menos que sea un animal de servicio certificado.,Pets cannot be taken to the workplace unless they are a certified service animal.,None
METALW-009677-0005,así que no puedo llevar a mi perro a la oficina?,so I can't take my dog to the office?,None
METALW-009677-0006,¿Su perro es un animal de servicio certificado? Los perros de terapia no cuentan.,Is your dog a certified service animal? Therapy dogs don't count.,None
METALW-009677-0007,No. ¿Qué hay de mi gato?,What about my cat?,None
METALW-009677-0008,"No, a menos que el gato sea un animal de servicio certificado, no puede ser traído al lugar de trabajo.","No, unless the cat is a certified service animal, it cannot be brought to the workplace.",None
METALW-009677-0009,¿Estaría bien traer un lagarto pequeño que nadie ve?,Would it be nice to bring a small lizard that no one sees?,None
METALW-009677-0010,"Tal vez si eres muy discreto al respecto. No se lo digas a nadie, y yo tampoco lo diré.","Maybe if you're very discreet about it. Don't tell anyone, and I won't say it either.",None
METALW-009677-0011,"Bien, supongo que las mascotas tendrán que quedarse en casa. gracias por la información","Well, I guess pets will have to stay home. thanks for the information",None
METALW-009678-0000,"Hola, ¿en qué puedo ayudarle?","Hi, how can I help you?",None
METALW-009678-0001,¿El Delfín Azul proporciona seguro médico a los empleados,Does the Blue Dolphin provide health insurance to employees,None
METALW-009678-0002,Puedo responder a eso por ti. El Delfín Azul proporciona seguro médico para los empleados que han estado con nosotros durante seis meses,I can answer that for you. Blue Dolphin provides health insurance for employees who have been with us for six months,None
METALW-009678-0003,¿Hay alternativas para alguien empedido durante 3 meses?,Are there alternatives for someone stoned for 3 months?,None
METALW-009678-0004,No. Una vez que haya llegado a los seis meses tendrá todos los beneficios.,"Once you've reached six months, you'll have all the benefits.",None
METALW-009678-0005,¿Cuál será mi costo?,What will be my cost?,None
METALW-009678-0006,Usted tendrá un copago de 0 y una prima mensual de $56 para beneficios médicos y dentales completos.,You will have a co-pay of 0 and a monthly premium of $56 for full medical and dental benefits.,None
METALW-009678-0007,Eso es muy barato,That's very cheap.,None
METALW-009678-0008,Esta prima de bajo costo es lo que ofrecemos a todos los empleados leales de Blue Dolphin que han estado con nosotros durante seis meses,This low-cost premium is what we offer to all loyal Blue Dolphin employees who have been with us for six months,None
METALW-009678-0009,Gracias por comprobar,Thank you for checking,None
METALW-009678-0010,No hay problema. ¿Necesitas algo más?,No problem. Do you need anything else?,None
METALW-009679-0000,"Hola, ¿en qué puedo ayudarle?","Hi, how can I help you?",None
METALW-009679-0001,¿Está bien si traigo a mi dragón barbudo a trabajar conmigo?,Is it okay if I bring my bearded dragon to work with me?,None
METALW-009679-0002,"Gracias por su solicitud. En este momento, no se le permite traer animales al trabajo.","Thank you for your request. At this time, you are not allowed to bring animals to work.",None
METALW-009679-0003,¿realmente? Realmente significa mucho para mí.,really? It really means a lot to me.,None
METALW-009679-0004,Solo se permite el servicio de animales en el complejo.,Please note that only animal service is allowed in the resort.,None
METALW-009679-0005,¿Cómo puedo probar que mi dragón barbudo es un animal de servicio?,How can I prove that my bearded dragon is a service animal?,None
METALW-009679-0006,Es necesario tener un documento gubernamental certificado que indique que es un animal de servicio.,It is necessary to have a certified government document indicating that it is a service animal.,None
METALW-009679-0007,¿Eso es todo?,That's all?,None
METALW-009679-0008,Eso es todo lo que necesitamos.,That's all we need.,None
METALW-009679-0009,¿Y los bichos que le doy de comer? ¿También tienen que ser animales de servicio certificados?,What about the bugs I feed him? Do they also have to be certified service animals?,None
METALW-009679-0010,No. Deben estar contenidos de una manera que no contamine el lugar de trabajo.,No. They should be contained in a way that does not contaminate the workplace.,None
METALW-009679-0011,"¡Genial, gracias!","Great, thank you!",None
METALW-009680-0000,"Hola, ¿en qué puedo ayudarle?","Hi, how can I help you?",None
METALW-009680-0001,Ayúdame sobre la política de la compañía mu. mi,Help me about the politics of the mu company. my,None
METALW-009680-0002,Me gustaría ayudarte,I'd like to help you.,None
METALW-009680-0003,¿Cuál es la política de la compañía para llevar mascotas al cargo?,What is the company's policy to bring pets to charge?,None
METALW-009680-0004,"Los animales no están permitidos en el trabajo a menos que sean animales de servicio. es decir, un perro de ojos que ve","Animals are not allowed at work unless they are service animals. that is, an eye dog that sees",None
METALW-009680-0005,¿Hay exenciones?,Are there exemptions?,None
METALW-009680-0006,No. Es con fines de seguridad e higiene que esta política está en vigor.,No. It is for safety and hygiene purposes that this policy is in force.,None
METALW-009680-0007,Gracias por dar esa información.,Thanks for giving that information.,None
METALW-009680-0008,¿Puedo ayudar con cualquier otra información de política?,Can I help with any other policy information?,None
METALW-009680-0009,Eso es todo por ahora.,That's all for now.,None
METALW-009680-0010,Gracias por usar el Policy_Bot,Thank you for using the Policy_Bot,None
METALW-009681-0000,"Hola, ¿en qué puedo ayudarle?","Hi, how can I help you?",None
METALW-009681-0001,¿Puede ayudarme con la política de la empresa?,Can you help me with company policy?,None
METALW-009681-0002,Seguro que puedo,I'm sure I can.,None
METALW-009681-0003,¿Puedes decirme cuál es la política del código de vestimenta para un hombre?,Can you tell me what the dress code policy is for a man?,None
METALW-009681-0004,"No, debes vestirte lo más profesional posible. Sólo trajes.","No, you must dress as professionally as possible. Just suits.",None
METALW-009681-0005,¿Sería capaz de usar una camisa de cuello y pantalones sin traje?,Would you be able to wear a collared shirt and pants without a suit?,None
METALW-009681-0006,Está bien. Pero no puede ser una marca barata.,It is ok. But it can't be a cheap brand.,None
METALW-009681-0007,¿Hay viernes casuales en la oficina?,Are there any casual Fridays in the office?,None
METALW-009681-0008,Ningún día casual.,No casual days.,None
METALW-009681-0009,Bien gracias por la información.,"Well, thanks for the information.",None
METALW-009681-0010,No hay problema.,No problem.,None
METALW-009682-0000,"Hola, ¿en qué puedo ayudarle?","Hi, how can I help you?",None
METALW-009682-0001,¿Acabo de conseguir un trabajo en la tienda de pollos y necesito saber si proporcionan seguro?,I just got a job at the chicken shop and need to know if they provide insurance?,None
METALW-009682-0002,sí que lo hacen después de 6 meses de empleo,yes they do after 6 months of employment,None
METALW-009682-0003,¿Es lo mismo para todos o sólo para las nuevas contrataciones?,Is it the same for everyone or just for new hires?,None
METALW-009682-0004,todos los empleados,all employees,None
METALW-009682-0005,¿Permiten días de enfermedad?,Do you allow sick days?,None
METALW-009682-0006,depende de si usted es salaryu,depends on whether you're salaryu,None
METALW-009682-0007,¿Con qué compañía está su seguro médico?,What company is your health insurance with?,None
METALW-009682-0008,el seguro de estafa co,co-scam insurance,None
METALW-009682-0009,Bien. Gracias por su ayuda. Eso es todo.,Not bad. Thank you for your help. That's all.,None
METALW-009682-0010,De acuerdo,I agree,None
METALW-009683-0000,"Hola, ¿en qué puedo ayudarle?","Hi, how can I help you?",None
METALW-009683-0001,Hola. ¿Puedo obtener información sobre una empresa?,Hello. Can I get information about a company?,None
METALW-009683-0002,"Claro, ¿qué te gustaría saber?","Sure, what would you like to know?",None
METALW-009683-0003,Necesito averiguar si Starbucks ofrece seguro médico.,I need to find out if Starbucks offers health insurance.,None
METALW-009683-0004,¿Está preguntando por el seguro médico para los empleados de Starbucks?,Are you asking about health insurance for Starbucks employees?,None
METALW-009683-0005,Sí.,Yes.,None
METALW-009683-0006,"Basándose en lo que he encontrado, los empleados de Starbucks reciben seguro médico después de estar empleados durante 6 meses consecutivos","Based on what I've found, Starbucks employees receive health insurance after being employed for 6 consecutive months",None
METALW-009683-0007,"De acuerdo, muchas gracias.","Okay, thank you very much.",None
METALW-009683-0008,"¿No hay problema, alguna otra pregunta?","No problem, any other questions?",None
METALW-009683-0009,"Sí, por favor. ¿Starbucks ofrece seguro dental?","Yes, please. Does Starbucks offer dental insurance?",None
METALW-009683-0010,He descubierto que los empleados de Starbucks obtienen seguro dental después de 6 meses de ser un empleado,I've found that Starbucks employees get dental insurance after 6 months of being an employee,None
METALW-009683-0011,Gracias.,Thank you.,None
METALW-009683-0012,¡De nada!,You are welcome!,None
METALW-009684-0000,"Hola, ¿en qué puedo ayudarle?","Hi, how can I help you?",None
METALW-009684-0001,"Sí, necesito ayuda con la política de la compañía.","Yes, I need help with company policy.",None
METALW-009684-0002,Claro. ¿Con qué necesitas ayuda?,Of course. What do you need help with?,None
METALW-009684-0003,¿Proporcionan seguro médico?,Do you provide health insurance?,None
METALW-009684-0004,"Sí, pero sólo después de haber trabajado aquí durante seis meses.","Yes, but only after working here for six months.",None
METALW-009684-0005,De acuerdo. ¿Y después de seis meses cómo me inscribo?,I agree. And after six months how do I sign up?,None
METALW-009684-0006,Visite el departamento de recursos humanos.,Visit the human resources department.,None
METALW-009684-0007,De acuerdo. ¿Hay alguna forma de registrarse en línea?,I agree. Is there a way to register online?,None
METALW-009684-0008,No en este momento.,Not right now.,None
METALW-009684-0009,"Bien, gracias por la ayuda.","Well, thanks for the help.",None
METALW-009684-0010,No hay problema,No problem,None
METALW-009685-0000,"Hola, ¿en qué puedo ayudarle?","Hi, how can I help you?",None
METALW-009685-0001,¿La compañía proporciona seguro médico,Does the company provide health insurance,None
METALW-009685-0002,La compañía proporciona seguro a los empleados que han trabajado aquí durante al menos seis meses,The company provides insurance to employees who have worked here for at least six months,None
METALW-009685-0003,¿Es esa cobertura completa?,Is that full coverage?,None
METALW-009685-0004,"Sí, esa sería la cobertura completa","Yes, that would be the full coverage",None
METALW-009685-0005,"De acuerdo, genial. ¿Cuánto tengo que pagar?","Okay, great. How much do I have to pay?",None
METALW-009685-0006,La cobertura del seguro está cubierta por la compañía,Insurance coverage is covered by the company,None
METALW-009685-0007,"Oh, eso es increíble. De acuerdo, gracias","Oh, that's unbelievable. All right, thank you.",None
METALW-009685-0008,¿Alguna otra pregunta?,Any other questions?,None
METALW-009685-0009,"No, eso es todo. gracias","No, that's all. Thank you",None
METALW-009685-0010,De nada,You are welcome,None
METALW-009686-0000,"Hola, ¿en qué puedo ayudarle?","Hi, how can I help you?",None
METALW-009686-0001,¿Cuál es la política de PetSmart de traer animales a la oficina?,What is PetSmart's policy of bringing animals into the office?,None
METALW-009686-0002,Sólo puedes hacer eso si es un animal de servicio.,You can only do that if it's a service animal.,None
METALW-009686-0003,Me parece bastante hipócrita,I think it's pretty hypocritical.,None
METALW-009686-0004,¿por qué?,Why?,None
METALW-009686-0005,Pensé que mi trabajo en un lugar llamado PetSmart podría traer a mi animal a la oficina,I thought my job at a place called PetSmart might bring my animal into the office,None
METALW-009686-0006,Sólo si es un servicio porque quieren reducir el potencial de que los animales en las tiendas se enfermen.,Only if it's a service because they want to reduce the potential for animals in stores to get sick.,None
METALW-009686-0007,Creo que empezaré a buscar un trabajo que permita llevar al perro a la oficina,I think I'll start looking for a job that allows the dog to be taken to the office.,None
METALW-009686-0008,"Ok, ¿puedo ayudar con otra cosa?","Okay, can I help with something else?",None
METALW-009686-0009,No,No,None
METALW-009686-0010,Ten un buen día.,Have a good day.,None
METALW-009687-0000,"Hola, ¿en qué puedo ayudarle?","Hi, how can I help you?",None
METALW-009687-0001,Quiero saber sobre las políticas.,I want to know about the policies.,None
METALW-009687-0002,¿En qué política desea información?,What policy do you want information in?,None
METALW-009687-0003,¿La compañía proporciona seguro médico?,Does the company provide health insurance?,None
METALW-009687-0004,Proporcionarán seguro médico después de que un empleado haya estado empleado durante seis meses,Provide health insurance after an employee has been employed for six months,None
METALW-009687-0005,Bien. ¿Cómo solicito un seguro médico? Lo he sido durante 5 años.,Not bad. How do I apply for health insurance? I've been for five years.,None
METALW-009687-0006,Usted tendrá que ponerse en contacto con el departamento de recursos humanos para eso.,You'll need to contact the human resources department for that.,None
METALW-009687-0007,Ya veo. ¿Puedes conectarme con RECURSOS HUMANOS?,I see. Can you connect me to HUMAN RESOURCES?,None
METALW-009687-0008,Puedo darte el número de teléfono,I can give you the phone number.,None
METALW-009687-0009,"Por favor, hazlo.",Please do it.,None
METALW-009687-0010,800-555-7777,800-555-7777,None
METALW-009687-0011,gracias,Thank you,None
METALW-009688-0000,"Hola, ¿en qué puedo ayudarle?","Hi, how can I help you?",None
METALW-009688-0001,Necesito información sobre la política de cuidado infantil targets para los empleados,I need information on child care policy targets for employees,None
METALW-009688-0002,"Claro, ¿qué hay de su política de cuidado de niños que te gustaría saber?","Of course, what about your child care policy that you'd like to know?",None
METALW-009688-0003,¿Se permite a los empleados dejar a sus hijos en la guardería de Target durante el horario laboral?,Are employees allowed to leave their children in Target Day care during business hours?,None
METALW-009688-0004,"Desafortunadamente, a los empleados no se les permite dejar a sus hijos en la guardería por razones legales.","Unfortunately, employees are not allowed to leave their children in day care for legal reasons.",None
METALW-009688-0005,"Bien, así que eso es sólo guardería para los hijos del comprador entonces","Okay, so that's just day care for the buyer's kids then",None
METALW-009688-0006,Eso es correcto. Me disculpo por cualquier inconveniente que pueda causar.,That's right. I apologize for any inconvenience you may cause.,None
METALW-009688-0007,Está bien. ¿Target ofrece ayuda a los empleados que necesitan cuidado de niños durante el día?,It is ok. Does Target offer help to employees who need day care?,None
METALW-009688-0008,Actualmente no hay ningún beneficio para los empleados para el cuidado de niños en la empresa.,There is currently no benefit to child care employees in the company.,None
METALW-009688-0009,Bien. Gracias por la ayuda,Not bad. Thanks for the help,None
METALW-009688-0010,En cualquier momento,Any time,None
METALW-009689-0000,"Hola, ¿en qué puedo ayudarle?","Hi, how can I help you?",None
METALW-009689-0001,Necesito saber sobre las políticas de mi compañía.,I need to know about my company's policies.,None
METALW-009689-0002,ciertamente. ¿Qué necesitas saber?,certainly. What do you need to know?,None
METALW-009689-0003,¿Podemos traer animales a la oficina?,Can we get animals to the office?,None
METALW-009689-0004,Sólo se puede traer un animal si es un animal de servicio.,You can only bring an animal if it is a service animal.,None
METALW-009689-0005,"es un animal de servicio, pero no es tradicional","it's a service animal, but it's not traditional",None
METALW-009689-0006,¿Qué tipo de animal es?,What kind of animal is it?,None
METALW-009689-0007,es un gallo que ayuda con la narcolepsia,is a rooster that helps with narcolepsy,None
METALW-009689-0008,¿Tienes papeleo que muestra que es un gallo de servicio?,Do you have paperwork that shows he's a service rooster?,None
METALW-009689-0009,"Sí, tiene un certificado e insignia","Yes, he has a certificate and badge",None
METALW-009689-0010,Tendrá que notificar a su supervisor antes de traerlo,You will need to notify your supervisor before bringing it,None
METALW-009689-0011,Gracias,Thank you,None
METALW-009690-0000,"Hola, ¿en qué puedo ayudarle?","Hi, how can I help you?",None
METALW-009690-0001,"Sí, por favor","Yes, please",None
METALW-009690-0002,¿Con qué puedo ayudarte por hoy?,What can I help you with for today?,None
