UID,SEG,translation,profanity
METALW-002895-0010,"Bueno, entonces, ¡que tengas una gran noche!","Well, then, have a great night!",None
METALW-002896-0000,"Hola, ¿en qué puedo ayudarle?","Hi, how can I help you?",None
METALW-002896-0001,¿Puedes darme información sobre las zonas horarias?,Can you give me information about time zones?,None
METALW-002896-0002,"Sí, ¿qué te gustaría saber sobre las zonas horarias?","Yes, what would you like to know about time zones?",None
METALW-002896-0003,"Si es medianoche en San Petersburgo, ¿a qué hora será en Vancouver?","If it's midnight in St. Petersburg, what time will it be in Vancouver?",None
METALW-002896-0004,12 AM San Petersburgo Florida será a las 9 PM el día anterior en Vancouver.,12 AM St. Petersburg Florida will be at 9 PM the day before in Vancouver.,None
METALW-002896-0005,¿En qué zona horaria se encuentra Vancouver?,What time zone is Vancouver in?,None
METALW-002896-0006,"El Vancouver, Canada se encuentra en PDT.","Vancouver, Canada is located in PDT.",None
METALW-002896-0007,¿Qué hay de San Petersburgo?,What about St. Petersburg?,None
METALW-002896-0008,"San Petersburgo, Florida se encuentra en EDT.","St. Petersburg, Florida is located in EDT.",None
METALW-002896-0009,"¡Ah, gracias por toda la información!","Oh, thank you for all the information!",None
METALW-002896-0010,De nada. Que tengas un gran día.,You are welcome. Have a great day.,None
METALW-002897-0000,"Hola, ¿en qué puedo ayudarle?","Hi, how can I help you?",None
METALW-002897-0001,Necesito ayuda con las zonas y el tiempo.,I need help with zones and weather.,None
METALW-002897-0002,¿qué es/,What is/,None
METALW-002897-0003,¿Cuántas horas está Nueva York por delante de Winnipeg?,How many hours is New York ahead of Winnipeg?,None
METALW-002897-0004,5 horas,5 hours,None
METALW-002897-0005,Excelente.,excellent.,None
METALW-002897-0006,¿Algo más?,Anything else?,None
METALW-002897-0007,Me encanta esta aplicación Usted es demasiado amable bot zona horaria,I love this app You're too friendly time zone bot,None
METALW-002897-0008,Te amo también mi placer,I love you too my pleasure,None
METALW-002897-0009,jaja gracias a la zona horaria bot,haha thanks to the bot time zone,None
METALW-002897-0010,su muy bienvenido,its very welcome,None
METALW-002898-0000,"Hola, ¿en qué puedo ayudarle?","Hi, how can I help you?",None
METALW-002898-0001,"Hola, ¿puedes ayudarme con las zonas horarias?","Hello, can you help me with the time zones?",None
METALW-002898-0002,¿Qué querías saber?,What did you want to know?,None
METALW-002898-0003,¿Cómo funcionan exactamente las zonas horarias?,How exactly do time zones work?,None
METALW-002898-0004,"Puedo proporcionar cálculos de zona horaria, pero no tengo información de fondo","I can provide time zone calculations, but I don't have any background information",None
METALW-002898-0005,"Bueno, ¿a qué hora está en Nueva York?","Well, what time are you in New York?",None
METALW-002898-0006,Hora estándar del este,East Standard Time,None
METALW-002898-0007,¿Qué hay de Los Ángeles?,What about Los Angeles?,None
METALW-002898-0008,pacífico,peaceful,None
METALW-002898-0009,"¡Muy bien, muchas gracias!","All right, thank you very much!",None
METALW-002898-0010,¡De nada!,You are welcome!,None
METALW-002899-0000,"Hola, ¿en qué puedo ayudarle?","Hi, how can I help you?",None
METALW-002899-0001,Quiero saber más sobre las zonas.,I want to know more about the areas.,None
METALW-002899-0002,¿Cómo puedo ayudar?,How can I help?,None
METALW-002899-0003,¿Cómo funcionan?,How do they work?,None
METALW-002899-0004,"Siento no poder explicar cómo funcionan las zonas horarias, pero puedo decirles las diferencias horarias entre placesa *places","I'm sorry I can't explain how time zones work, but I can tell you the time differences between placesa *places",None
METALW-002899-0005,"Bueno, eso no es exactamente lo que quiero saber.","Well, that's not exactly what I want to know.",None
METALW-002899-0006,Hay algunos bots de zona horaria que podrían ser más capaces de controlar esa solicitud. He enviado algunos enlaces a su teléfono,There are some time zone bots that might be better able to handle that request. I've sent some links to your phone,None
METALW-002899-0007,¿Seguro que no puedes decirme cómo funcionan?,Are you sure you can't tell me how they work?,None
METALW-002899-0008,Sí. Sólo estoy programado para decirles diferencias de tiempo,Yes. I'm just programmed to tell you time differences.,None
METALW-002899-0009,Bien. Gracias de todos modos.,Not bad. Thanks anyway.,None
METALW-002899-0010,¡Que tengas una buena noche!,Have a good night!,None
METALW-002900-0000,"Hola, ¿en qué puedo ayudarle?","Hi, how can I help you?",None
METALW-002900-0001,¡hola!,Hello!,None
METALW-002900-0002,Hola,Hello,None
METALW-002900-0003,¿Puedes ayudarme sobre las zonas horarias?,Can you help me about time zones?,None
METALW-002900-0004,Puedo ayudar con las zonas horarias,I can help with time zones,None
METALW-002900-0005,¿Puedes decirme cuántas horas está Nueva York por delante de Winnipeg?,Can you tell me how many hours New York is ahead of Winnipeg?,None
METALW-002900-0006,Nueva York está 4 horas por delante,New York is 4 hours ahead,None
METALW-002900-0007,"Wow, tu gran ayuda","Wow, your big help.",None
METALW-002900-0008,Gracias. ¿Eso será todo?,Thank you. Is that all?,None
METALW-002900-0009,"Eso es bueno por ahora, gracias","That's good for now, thank you",None
METALW-002900-0010,De nada,You are welcome,None
METALW-002901-0000,"Hola, ¿en qué puedo ayudarle?","Hi, how can I help you?",None
METALW-002901-0001,Im en Nueva York sus 6 pm ¿puedes decirme qué hora es en Islandia?,I'm in New York at 6 pm Can you tell me what time it is in Iceland?,None
METALW-002901-0002,"seguro. Si son las 18:00 en Nueva York, eso significa que son las 3 de la mañana en Islandia","sure. If it's 6 p.m. in New York, that means it's 3 a.m. in Iceland",None
METALW-002901-0003,oh wow gracias,oh wow thank you,None
METALW-002901-0004,De nada. ¿Hay algo más que pueda responder sobre las zonas horarias?,You are welcome. Is there anything else I can answer about time zones?,None
METALW-002901-0005,Creo que puede ser incorrecto me acaban de decir que la diferencia horaria es de 4 horas. ¿Es esto correcto?,I think it may be wrong I've just been told that the time difference is 4 hours. Is this correct?,None
METALW-002901-0006,"No, lo siento, pero eso no es correcto. Hay una diferencia horaria de 9 horas","No, I'm sorry, but that's not right. There's a 9-hour time difference",None
METALW-002901-0007,realmente. No te creo,really. I don't believe you,None
METALW-002901-0008,No estoy seguro de cómo puedo ayudar si no me crees. Soy un bot bien programado,I'm not sure how I can help if you don't believe me. I'm a well-programmed bot,None
METALW-002901-0009,Aprecio el esfuerzo.,I appreciate the effort.,None
METALW-002901-0010,¡Avísame si necesitas otras respuestas correctas!,Let me know if you need other correct answers!,None
METALW-002902-0000,"Hola, ¿en qué puedo ayudarle?","Hi, how can I help you?",None
METALW-002902-0001,puedes ayudarme con el huso horario,you can help me with the time zone,None
METALW-002902-0002,"Sí, claro","yes, right",None
METALW-002902-0003,¿puede decirme por favor la zona horaria en la zona del Pacífico,Can you please tell me the time zone in the Pacific area,None
METALW-002902-0004,"claro, ¿qué país específicamente","of course, which country specifically",None
METALW-002902-0005,Estados Unidos,United States,None
METALW-002902-0006,sus 6:55 am ahora algo más?,your 6:55 am now something else?,None
METALW-002902-0007,ys sí,and you do,None
METALW-002902-0008,Bien,Not bad,None
METALW-002902-0009,¿qué tal el país asiático,how's the Asian country,None
METALW-002902-0010,10pm,10pm,None
METALW-002903-0000,"Hola, ¿en qué puedo ayudarle?","Hi, how can I help you?",None
METALW-002903-0001,zonas horarias,time zones,None
METALW-002903-0002,Puedo darle información sobre las zonas horarias,I can give you information about time zones,None
METALW-002903-0003,¿Cómo funciona?,How does it work?,None
METALW-002903-0004,Sólo puedo calcular tiempos en diferentes zonas,I can only calculate times in different areas,None
METALW-002903-0005,¿realmente?,really?,None
METALW-002903-0006,No puedo proporcionar información sobre cómo funcionan,I can't provide information on how they work,None
METALW-002903-0007,De acuerdo,I agree,None
METALW-002903-0008,¿Tienes otra pregunta para mí?,Do you have another question for me?,None
METALW-002903-0009,No,No,None
METALW-002903-0010,Que tengas un gran día,Have a great day,None
METALW-002904-0000,"Hola, ¿en qué puedo ayudarle?","Hi, how can I help you?",None
METALW-002904-0001,¿Puede explicarme cómo funcionan las zonas horarias?,Can you explain to me how time zones work?,None
METALW-002904-0002,Sólo puedo calcular que no explican cómo funcionan,I can only calculate that they don't explain how they work,None
METALW-002904-0003,"Bien, si son las 11 de la noche en Boston ¿a qué hora es en Seattle?","Well, if it's 11 a.m. in Boston, what time is it in Seattle?",None
METALW-002904-0004,20:00 horas,8 p.m.,None
METALW-002904-0005,si son las 8 de la noche en Seattle ¿a qué hora sería en Londres?,"if it's 8 a.m. in Seattle, what time would it be in London?",None
METALW-002904-0006,18:00 horas,6 p.m.,None
METALW-002904-0007,si son las 18:00 horas en Londres ¿a qué hora es en Nueva York?,"if it's 6 p.m. in London, what time is it in New York?",None
METALW-002904-0008,11 p. m.,11 p.m.,None
METALW-002904-0009,"muy bien fresco, gracias","very cool, thank you",None
METALW-002904-0010,No hay problema,No problem,None
METALW-002905-0000,"Hola, ¿en qué puedo ayudarle?","Hi, how can I help you?",None
METALW-002905-0001,Necesito conocer las zonas horarias en los EE.UU.,I need to know the time zones in the U.S.,None
METALW-002905-0002,¿Qué quieres saber?,What do you want to know?,None
METALW-002905-0003,Necesito saber cuáles son las diferentes zonas horarias en los EE.UU.,I need to know what the different time zones are in the U.S.,None
METALW-002905-0004,Hay montaña central de la costa oeste y este en el continente de EE.UU.,There is central mountain on the west and east coast on the U.S. mainland.,None
METALW-002905-0005,¿Qué hay de Alaska y Hawái?,What about Alaska and Hawaii?,None
METALW-002905-0006,Está la zona horaria de Alaska y está la zona horaria de Hawái,There's the Alaska time zone and there's Hawaii's time zone,None
METALW-002905-0007,Eso no puede estar bien.,That can't be right.,None
METALW-002905-0008,"Honestamente, sólo lo busqué Ir en Wikipedia y comprobarlo por ti mismo","Honestly, I just looked it up to go on Wikipedia and check it out for yourself",None
METALW-002905-0009,"Está bien, gracias.","All right, thank you.",None
METALW-002905-0010,usted es bienvenido,you're welcome,None
METALW-002906-0000,"Hola, ¿en qué puedo ayudarle?","Hi, how can I help you?",None
METALW-002906-0001,Tengo una pregunta sobre las zonas horarias puedes ayudarme,I have a question about time zones you can help me,None
METALW-002906-0002,seguro,sure,None
METALW-002906-0003,Me pregunto cómo funcionan,I wonder how they work,None
METALW-002906-0004,"No puedo decirte, sólo calculo diferentes zonas horarias","I can't tell you, I just calculate different time zones",None
METALW-002906-0005,no kwow cómo funcionan,not kwow how they work,None
METALW-002906-0006,No,No,None
METALW-002906-0007,Yo tampoco,Me neither,None
METALW-002906-0008,Siento no poder ayudar,I'm sorry I can't help.,None
METALW-002906-0009,Eso está bien,That's ok,None
METALW-002906-0010,Ten un buen día,Have a good day,None
METALW-002907-0000,"Hola, ¿en qué puedo ayudarle?","Hi, how can I help you?",None
METALW-002907-0001,"¿Puede ayudarme sobre la zona horaria, por favor?","Can you help me about the time zone, please?",None
METALW-002907-0002,"¡Ciertamente, soy competente en zonas horarias! ¿Qué te gustaría saber?","Certainly, I'm competent in time zones! What would you like to know?",None
METALW-002907-0003,Quiero saber a qué hora en Islandia si son las 18:00 aquí en Nueva York.,I want to know what time in Iceland if it's 6 p.m. here in New York.,None
METALW-002907-0004,Déjame ver eso. Será la 1 de la madrugada en Islandia ahora,Let me see that. It will be 1 a.m. in Iceland now,None
METALW-002907-0005,Bien.,Not bad.,None
METALW-002907-0006,¿Más preguntas?,More questions?,None
METALW-002907-0007,Eso es todo por ahora. Gracias.,That's all for now. Thank you.,None
METALW-002907-0008,No hay problema,No problem,None
METALW-002907-0009,Que tengas un buen día.,Have a nice day.,None
METALW-002907-0010,¡gracias! Tú también,Thank you! You too,None
METALW-002908-0000,"Hola, ¿en qué puedo ayudarle?","Hi, how can I help you?",None
METALW-002908-0001,¿Cuál es el huso horario de NY?,What is the NY time zone?,None
METALW-002908-0002,¿Desea conocer el huso horario del estado de Nueva York?,Want to know the New York State time zone?,None
METALW-002908-0003,Sí,Yes,None
METALW-002908-0004,Están en la zona horaria oriental.,They're in the eastern time zone.,None
METALW-002908-0005,¿Sabes qué hora es ahora en esa zona horaria? Hora de NY,Do you know what time it is now in that time zone? NY Time,None
METALW-002908-0006,Ahora son las 7:35 en Nueva York.,Now it's 7:35 in New York.,None
METALW-002908-0007,¿Qué hora sería en Japón?,What time would it be in Japan?,None
METALW-002908-0008,"Japón está 13 horas por delante de eso, así que es aprox. Viernes 8:37AM","Japan is 13 hours ahead of that, so it's approx. Friday 8:37AM",None
METALW-002908-0009,¿Qué huso horario es Japón?,What time zone is Japan?,None
METALW-002908-0010,Japón es GMT +9,Japan is GMT +9,None
METALW-002908-0011,gracias,Thank you,None
METALW-002909-0000,"Hola, ¿en qué puedo ayudarle?","Hi, how can I help you?",None
METALW-002909-0001,Tengo una pregunta sobre las zonas horarias,I have a question about time zones,None
METALW-002909-0002,Adelante,Go ahead,None
METALW-002909-0003,"Cuando son las 6 p.M. En Nueva York, ¿a qué hora es en Islandia?","When it's 6 p.M. In New York, what time is it in Iceland?",None
METALW-002909-0004,9 PM,9 PM,None
METALW-002909-0005,¿Qué zona horaria es Islandia?,What time zone is Iceland?,None
METALW-002909-0006,Cst,Cst,None
METALW-002909-0007,¿Qué zona horaria es Nueva York?,What time zone is New York?,None
METALW-002909-0008,EST EST,EST EST,None
METALW-002909-0009,¡Gracias por todo!,Thanks for everything!,None
METALW-002909-0010,No hay problema,No problem,None
METALW-002910-0000,"Hola, ¿en qué puedo ayudarle?","Hi, how can I help you?",None
METALW-002910-0001,Hola. ¿Es más tarde en Nueva York o Los Ángeles?,Hello. Is it later in New York or Los Angeles?,None
METALW-002910-0002,No puedo explicar cómo funcionan las zonas horarias. Sólo puedo decir diferencias de tiempo,I can't explain how time zones work. I can only say time differences,None
METALW-002910-0003,Bien. ¿Cuántas horas de diferencia son,Not bad. How many hours difference are,None
METALW-002910-0004,Los Ángeles está 4 horas detrás de Nyc.,Los Angeles is four hours behind Nyc.,None
METALW-002910-0005,¿Cuántas horas de diferencia son Los Ángeles y San Francisco?,How many hours apart are Los Angeles and San Francisco?,None
METALW-002910-0006,Ambos están en la misma zona horaria. Hora del Pacífico,Both are in the same time zone. Pacific Time,None
METALW-002910-0007,fresco. ¿Está toda California en esa zona horaria?,fresh. Is all of California in that time zone?,None
METALW-002910-0008,Algunas partes de CA están en Mountain Time,Some parts of CA are in Mountain Time,None
METALW-002910-0009,"Ok, gracias por la información!","Okay, thanks for the information!",None
METALW-002910-0010,De nada. ¿Necesitas algo más?,You are welcome. Do you need anything else?,None
METALW-002910-0011,no,No,None
METALW-002911-0000,"Hola, ¿en qué puedo ayudarle?","Hi, how can I help you?",None
METALW-002911-0001,Ayuda de zona horaria por favor,Time zone help please,None
METALW-002911-0002,"Claro, ¿qué te gustaría saber?","Sure, what would you like to know?",None
METALW-002911-0003,¿Cuántas horas está Nueva York por delante de Winnipeg?,How many hours is New York ahead of Winnipeg?,None
METALW-002911-0004,Winnipeg está una hora detrás de Nueva York,Winnipeg is an hour behind New York,None
METALW-002911-0005,"Vaya, más cerca de lo que pensaba. ¿En qué zona horaria está Winnipeg?","Well, closer than I thought. What time zone is Winnipeg in?",None
METALW-002911-0006,Winnipeg se encuentra actualmente en horario de verano central.,Winnipeg is currently in central daylight saving time.,None
METALW-002911-0007,¿Eso significaría que NY está en la zona horaria oriental?,Would that mean NY is in the eastern time zone?,None
METALW-002911-0008,"Sí, eso es correcto.","Yes, that's right.",None
METALW-002911-0009,Bien. ¡Gracias por la información!,Not bad. Thanks for the information!,None
METALW-002911-0010,"No hay problema, espero que haya sido útil.","No problem, I hope it was helpful.",None
METALW-002912-0000,"Hola, ¿en qué puedo ayudarle?","Hi, how can I help you?",None
METALW-002912-0001,¡hola! Necesito saber sobre las zonas horarias,Hello! I need to know about time zones,None
METALW-002912-0002,Me encantaría ayudar con eso.,I'd love to help with that.,None
METALW-002912-0003,Necesito saber cuántas horas está Nueva York por delante de Winnipeg.,I need to know how many hours New York is ahead of Winnipeg.,None
METALW-002912-0004,Hay una diferencia horaria de 1 hora entre Nueva York y Winnipeg,There's a 1-hour time difference between New York and Winnipeg,None
METALW-002912-0005,¡gracias!,Thank you!,None
METALW-002912-0006,Winnipeg está una hora detrás de Nueva York.,Winnipeg is an hour behind New York.,None
METALW-002912-0007,¿Puedes decirme si Winnipeg observa el horario de verano?,Can you tell me if Winnipeg watches daylight saving time?,None
METALW-002912-0008,Lamento no poder responder a esa pregunta.,I'm sorry I can't answer that question.,None
METALW-002912-0009,Bien. ¿Gracias de todos modos?,Not bad. Thanks anyway?,None
METALW-002912-0010,¿Puedo ayudar con otra cosa?,Can I help with something else?,None
METALW-002913-0000,"Hola, ¿en qué puedo ayudarle?","Hi, how can I help you?",None
METALW-002913-0001,Necesito información de huso horario,I need time zone information.,None
METALW-002913-0002,Puedo ayudar con eso,I can help with that.,None
METALW-002913-0003,Estoy en Nueva York y son las 18:00. ¿Qué hora es en Islandia?,I'm in New York and it's 18:00. What time is it in Iceland?,None
METALW-002913-0004,Medianoche,midnight,None
METALW-002913-0005,¿Así que hay seis horas de diferencia?,So there's six hours apart?,None
METALW-002913-0006,Sí,Yes,None
METALW-002913-0007,Sé que Nueva York es la zona horaria del este. ¿Cómo se llama Islandia?,I know New York is the East Time Zone. What's Iceland's name?,None
METALW-002913-0008,Cst,Cst,None
METALW-002913-0009,¿realmente?,really?,None
METALW-002913-0010,Sí,Yes,None
METALW-002914-0000,"Hola, ¿en qué puedo ayudarle?","Hi, how can I help you?",None
METALW-002914-0001,ayúdame con zonas horarias,help me with time zones,None
METALW-002914-0002,"¡Ciertamente, soy competente en el conocimiento de la zona horaria!","Certainly, I am competent in the knowledge of the time zone!",None
METALW-002914-0003,"ok, así que vivo en wnnipeg winnipeg","ok, so I live in wnnipeg winnipeg",None
METALW-002914-0004,Bien. ¿Qué te gustaría saber?,Not bad. What would you like to know?,None
METALW-002914-0005,¿Cuántas horas por delante está Nueva York?,How many hours ahead is New York?,None
METALW-002914-0006,Nueva York está en realidad 3 horas detrás del tiempo en Winnipeg,New York is actually 3 hours behind the weather in Winnipeg,None
METALW-002914-0007,¿Sabes en qué zona horaria está Nueva York?,Do you know what time zone New York is in?,None
METALW-002914-0008,¡ciertamente! Nueva York está en la zona horaria estándar del este,certainly! New York is in the east standard time zone,None
METALW-002914-0009,Gracias,Thank you,None
METALW-002914-0010,No hay problema,No problem,None
METALW-002915-0000,"Hola, ¿en qué puedo ayudarle?","Hi, how can I help you?",None
METALW-002915-0001,Necesito información sobre las zonas horarias,I need information about time zones,None
METALW-002915-0002,Claro,Of course,None
METALW-002915-0003,¿cómo funcionan las zonas horarias,how time zones work,None
METALW-002915-0004,"Puedo darle información sobre el cálculo de las zonas horarias, pero no el fondo de cómo se eork","I can give you information about the calculation of time zones, but not the background of how you eork",None
METALW-002915-0005,qué huso horario es Illinois en,what time zone Illinois is in,None
METALW-002915-0006,central,central,None
METALW-002915-0007,¿qué pasa con California,what about California,None
METALW-002915-0008,pacífico,peaceful,None
METALW-002915-0009,Gracias,Thank you,None
METALW-002915-0010,De nada,You are welcome,None
METALW-002916-0000,"Hola, ¿en qué puedo ayudarle?","Hi, how can I help you?",None
METALW-002916-0001,hola ayúdame con zonas horarias,hello help me with time zones,None
METALW-002916-0002,"Sue, puedo hacer eso.","Sue, I can do that.",None
METALW-002916-0003,¿Son las 6 pm en Nueva York ahora mismo?,Is it 6 p.m. in New York right now?,None
METALW-002916-0004,"No, son las 10:22","No, it's 10:22.",None
METALW-002916-0005,"bueno, si eran las 6 pm allí, ¿a qué hora será en Islandia?","well, if it was 6 p.m. there, what time will it be in Iceland?",None
METALW-002916-0006,10 p.m.,10 p.m.,None
METALW-002916-0007,¿Hasta dónde están separados en términos de millas?,How far are they separated in terms of miles?,None
METALW-002916-0008,4.365 kilómetros,"4,365 kilometers",None
METALW-002916-0009,gracias por buscarlos,thank you for looking for them,None
METALW-002916-0010,¡Eres muy bienvenido!,You're very welcome!,None
METALW-002917-0000,"Hola, ¿en qué puedo ayudarle?","Hi, how can I help you?",None
METALW-002917-0001,Hola,Hello,None
METALW-002917-0002,hola,Hello,None
METALW-002917-0003,Necesito ayuda,I need help,None
METALW-002917-0004,preguntar lejos,ask away,None
METALW-002917-0005,¿A qué hora es en San Petersburgo?,What time is it in St. Petersburg?,None
METALW-002917-0006,No tengo ninguna información sobre eso,I don't have any information on that.,None
METALW-002917-0007,oh tan tonto gracias de todos modos,oh so silly thank you anyway,None
METALW-002917-0008,lo siento,I am sorry,None
METALW-002917-0009,no te preocupes adiós,don't worry goodbye,None
METALW-002917-0010,arrepentido,repentant,None
METALW-002918-0000,"Hola, ¿en qué puedo ayudarle?","Hi, how can I help you?",None
METALW-002918-0001,Tengo una pregunta sobre el huso horario,I have a question about the time zone.,None
METALW-002918-0002,¿Qué es?,What is it?,None
METALW-002918-0003,¿Qué huso horario es NY?,What time zone is NY?,None
METALW-002918-0004,¿Ahora mismo?,Right now?,None
METALW-002918-0005,Sí,Yes,None
METALW-002918-0006,Son las 10:45 en NY,It's 10:45 in NY.,None
METALW-002918-0007,¿Qué sería 6 PM en NY en Islandia?,What would 6 PM in NY in Iceland?,None
METALW-002918-0008,son las 2:55 a.m. del viernes en Islandia.,it's 2:55 a.m Friday morning in Iceland.,None
METALW-002918-0009,Gracias por la información,Thank you for the information,None
METALW-002918-0010,No hay problema :),No problem :),None
METALW-002919-0000,"Hola, ¿en qué puedo ayudarle?","Hi, how can I help you?",None
METALW-002919-0001,Tengo dudas sobre el huso horario,I have doubts about the time zone.,None
METALW-002919-0002,¿Para qué zona horaria?,What time zone?,None
METALW-002919-0003,"Bueno, digamos su medianoche en San Petersburgo a qué hora sería exactamente en Vancouver","Well, let's say your midnight in St. Petersburg what time it would be exactly in Vancouver",None
METALW-002919-0004,serían las 3 de la mañana en Vancouver,it would be 3 a.m. in Vancouver,None
METALW-002919-0005,"Ok, eso no es una gran diferencia de tiempo","Okay, that's not a big difference in time.",None
METALW-002919-0006,"Sí, están cerca el uno del otro","Yes, they're close to each other",None
METALW-002919-0007,¿Qué hay de Nueva York al mismo tiempo de San Petersburgo,What about New York at the same time from St. Petersburg,None
METALW-002919-0008,"para Nueva York, serán las 6 a. m.","for New York, it'll be 6 a.m.",None
METALW-002919-0009,Ok con éste hay una diferencia de tiempo significativa. Gracias por su ayuda,Okay with this one there's a significant time difference. Thank you for your help,None
METALW-002919-0010,Lo tienes,You got it,None
METALW-002920-0000,"Hola, ¿en qué puedo ayudarle? Cómo puedo ayudarle","Hi, how can I help you? How can I help you",None
METALW-002920-0001,Necesito ayuda con las zonas horarias.,I need help with time zones.,None
METALW-002920-0002,¿Qué quieres saber?,What do you want to know?,None
METALW-002920-0003,"¿Cuántas horas tiene Nueva York por delante de Winnipeg, Manitoba, Canadá?","How many hours does New York have ahead of Winnipeg, Manitoba, Canada?",None
METALW-002920-0004,En Winnipeg son las 6 p. m. y en NYC son las 7 p. m.,Winnipeg is 6 p.m and in NYC it's 7 p.m.,None
METALW-002920-0005,"No pedí el tiempo, pregunté cuántas horas por delante.","I didn't ask for the time, I asked how many hours ahead.",None
METALW-002920-0006,Nueva York está una hora por delante,New York is an hour ahead,None
METALW-002920-0007,Muchas gracias.,Thanks a lot.,None
METALW-002920-0008,¿Qué más puedo hacer por ti?,What else can I do for you?,None
METALW-002920-0009,"Eso es todo por hoy, gracias.","That's all for today, thank you.",None
METALW-002920-0010,Que tengas un gran día,Have a great day,None
