UID,SEG,translation,profanity
METALW-010090-0004,"El Canal de Lachine es un canal que pasa a través de la parte suroeste de la isla de Montreal, Quebec, Canadá, que corre 14,5 kilómetros desde el puerto antiguo de Montreal hasta el lago Saint-Louis, a través de los distritos de Lachine, Lasalle y Sud-Ouest.","The Lachine Canal is a canal that passes through the southwestern part of Montreal Island, Quebec, Canada, which runs 14.5 kilometers from Montreal's Old Port to Lake Saint-Louis, through the districts of Lachine, Lasalle and Sud-Ouest.",None
METALW-010090-0005,"Impresionante, ¿hay alguna excursión en barco?","Awesome, is there a boat trip?",None
METALW-010090-0006,"Sí, los hay","Yes, there are.",None
METALW-010090-0007,"Muy bien, gracias por ayudarme a aprender más sobre El Canal de Lachine.","All right, thanks for helping me learn more about The Lachine Canal.",None
METALW-010090-0008,"eres bienvenido, ¿tienes otra pregunta?","you're welcome, do you have another question?",None
METALW-010090-0009,"Ahora no, gracias de nuevo por ayudar.","Not now, thanks again for helping.",None
METALW-010090-0010,Buena suerte,Good luck,None
METALW-010091-0000,"Hola, ¿en qué puedo ayudarle?","Hi, how can I help you?",None
METALW-010091-0001,¿Puedes decirme información sobre Monreal? Montreal,Can you tell me about Monreal? Montreal,None
METALW-010091-0002,Montreal es la provincia más antigua de Canadá,Montreal is Canada's oldest province,None
METALW-010091-0003,¿Qué río atraviesa Montreal?,What river crosses Montreal?,None
METALW-010091-0004,El río Canadá.,The Canada River.,None
METALW-010091-0005,¿Cuánto tiempo es?,How long is it?,None
METALW-010091-0006,1232 millas.,1232 miles.,None
METALW-010091-0007,¿Qué tan ancho es?,How wide is it?,None
METALW-010091-0008,12 pies- 398 pies en su más ancho,12 feet- 398 feet at its widest,None
METALW-010091-0009,"Vaya, eso es impresionante. Gracias por la información.","Wow, that's awesome. Thanks for the information.",None
METALW-010091-0010,De nada,You are welcome,None
METALW-010092-0000,"Hola, ¿en qué puedo ayudarle?","Hi, how can I help you?",None
METALW-010092-0001,Me gustaría tener información sobre Praga,I'd like to have information about Prague,None
METALW-010092-0002,"Ciertamente, puedo ayudar con eso. ¿Qué te gustaría saber sobre Praga",I can certainly help with that. What would you like to know about Prague,None
METALW-010092-0003,Me pregunto cuál es el nombre del río que pasa por Praga.,I wonder what the name of the river that passes through Prague is.,None
METALW-010092-0004,El río Ilvava fluye a través de Praga,The Ilvava River flows through Prague,None
METALW-010092-0005,¡Bien! Pensé que eso era lo que era. ¡Gracias!,Not bad! I thought that's what it was. Thank you!,None
METALW-010092-0006,¡No hay problema! ¿Puedo responder más preguntas?,No problem! Can I answer more questions?,None
METALW-010092-0007,¿Sabes cuántas millas de largo tiene ese río por casualidad?,Do you know how many miles long that river is by chance?,None
METALW-010092-0008,¡Praga tiene 171 millas de largo!,Prague is 171 miles long!,None
METALW-010092-0009,¿Cuánto dura el río?,How long does the river last?,None
METALW-010092-0010,arrepentido. Debo haber malinterpretado tu pregunta. El IIvava tiene 171 millas de largo,repentant. I must have misunderstood your question. The IIvava is 171 miles long,None
METALW-010092-0011,impresionante. ¡Gracias por la información!,impressive. Thanks for the information!,None
METALW-010093-0000,"Hola, ¿en qué puedo ayudarle?","Hi, how can I help you?",None
METALW-010093-0001,¿Puedes ayudarme con los hechos sobre las ciudades?,Can you help me with the facts about the cities?,None
METALW-010093-0002,seguro,sure,None
METALW-010093-0003,¿Puedes decirme quién fundó Roma?,Can you tell me who founded Rome?,None
METALW-010093-0004,Por un momento,For a moment,None
METALW-010093-0005,¿Por un momento fundó Roma?,For a moment did you found Rome?,None
METALW-010093-0006,"Fue fundada por los dos hermanos, y los dioses demi, Romulos y Remus","It was founded by the two brothers, and the gods demi, Romulos and Remus",None
METALW-010093-0007,¡Gracias! Eso es muy interesante,Thank you! That's very interesting.,None
METALW-010093-0008,¿Algo más?,Anything else?,None
METALW-010093-0009,"No, soy bueno.","No, I'm good.",None
METALW-010093-0010,Bien,Not bad,None
METALW-010094-0000,"Hola, ¿en qué puedo ayudarle?","Hi, how can I help you?",None
METALW-010094-0001,"¡Oye, bot de hechos! ¡Tengo una pregunta!","Hey, fact bot! I have a question!",None
METALW-010094-0002,Tengo una respuesta. ¿Qué puedo hacer por ti?,I have an answer. What can I do for you?,None
METALW-010094-0003,¿Cuál es la esperanza de vida promedio en Denver?,What is the average life expectancy of someone in Denver?,None
METALW-010094-0004,El arrepentimiento promedio de la vida en Denver es de 87 años,Average living regret in Denver is 87,None
METALW-010094-0005,"Wow, ¿es eso tanto para hombres como para mujeres?","Wow, is that for both men and women?",None
METALW-010094-0006,Es para los dos sí,It's for both of us.,None
METALW-010094-0007,Gracias por el interesante bot de hechos de información!,Thank you for the interesting information fact bot!,None
METALW-010094-0008,De nada. ¿Quieres otra información?,You are welcome. Do you want other information?,None
METALW-010094-0009,"No, eso es todo, adiós bot","No, that's it, goodbye bot",None
METALW-010094-0010,"Bien, que tengas un buen día","Well, have a nice day",None
METALW-010095-0000,"Hola, ¿en qué puedo ayudarle? Saludos. Saludos.","Hi, how can I help you? Best regards. Best regards.",None
METALW-010095-0001,¿Puedes comparar dos ciudades por mí?,Can you compare two cities for me?,None
METALW-010095-0002,Claro.,Of course.,None
METALW-010095-0003,Compare Los Ángeles y la ciudad de Nueva York.,Compare Los Angeles and New York City.,None
METALW-010095-0004,"Ok, ¿qué te gustaría saber de esas dos ciudades?","Okay, what would you like to know about those two cities?",None
METALW-010095-0005,Cuál es más grande.,Which one's bigger.,None
METALW-010095-0006,Los Ángeles es 10 veces el tamaño de NYC,Los Angeles is 10 times the size of NYC,None
METALW-010095-0007,fresco. ¿Cuál es mayor?,fresh. Which one's older?,None
METALW-010095-0008,NYC es 400 años mayor que Los Ángeles,NYC is 400 years older than Los Angeles,None
METALW-010095-0009,loco. Gracias por la información.,crazy. Thanks for the information.,None
METALW-010095-0010,De nada.,You are welcome.,None
METALW-010096-0000,"Hola, ¿en qué puedo ayudarle?","Hi, how can I help you?",None
METALW-010096-0001,Estoy buscando algunos hechos sobre las ciudades. ¿Puedes ayudar con eso?,I'm looking for some facts about cities. Can you help with that?,None
METALW-010096-0002,¿Para qué ciudad?,What city?,None
METALW-010096-0003,Estoy buscando similitudes y diferencias entre la ciudad de Nueva York y Los Ángeles.,I'm looking for similarities and differences between New York City and Los Angeles.,None
METALW-010096-0004,De acuerdo. ¿Qué estás comparando?,I agree. What are you comparing?,None
METALW-010096-0005,¿Cómo son las poblaciones,What are the populations like,None
METALW-010096-0006,Ya veo. La ciudad de Nueva York tiene una población mayor,I see. New York City has a larger population,None
METALW-010096-0007,¿Y cuáles tienen un mayor porcentaje de personas de la tercera edad en su población>?,And which have the highest percentage of seniors in their population>?,None
METALW-010096-0008,Los Ángeles es más popular entre los ancianos por retirarse,Los Angeles is most popular with the elderly for retiring,None
METALW-010096-0009,fabuloso. ¡gracias!,fabulous. Thank you!,None
METALW-010096-0010,No hay problema,No problem,None
METALW-010097-0000,¿En qué puedo ayudarle?,How can I help you?,None
METALW-010097-0001,¿Qué río pasa por Praga?,What river passes through Prague?,None
METALW-010097-0002,Es el río Moldava,It's the Vltava River,None
METALW-010097-0003,¿Cuánto dura ese río?,How long does that river last?,None
METALW-010097-0004,Tiene 430 km,It's 430 km,None
METALW-010097-0005,¿dónde termina,where does it end,None
METALW-010097-0006,Termina en Elba,Ends in Elba,None
METALW-010097-0007,Bien,Not bad,None
METALW-010097-0008,¿Hay algo más?,Is there anything else?,None
METALW-010097-0009,que es todo,that's it,None
METALW-010097-0010,Bien. Que tengas un gran día por delante,Not bad. Have a big day ahead of you,None
METALW-010098-0000,"Hola, ¿en qué puedo ayudarle?","Hi, how can I help you?",None
METALW-010098-0001,¿Qué ciudad es más grande? ¿Los Ángeles o Nueva York?,Which city is bigger? Los Angeles or New York?,None
METALW-010098-0002,Creo que no tengo eso.,I don't think I have that.,None
METALW-010098-0003,¿No tienes esa información?,Don't you have that information?,None
METALW-010098-0004,Una por una información está bien,One for one information is fine,None
METALW-010098-0005,¿Qué ciudad tiene más gente?,Which city has the most people?,None
METALW-010098-0006,En Los Ángeles.,In Los Angeles.,None
METALW-010098-0007,¿Qué ciudad tiene mejor ensalada de papas?,Which city has the best potato salad?,None
METALW-010098-0008,Reduzca un poco su solicitud,Reduce your application a little,None
METALW-010098-0009,¿Qué ciudad tiene más tráfico?,Which city has the most traffic?,None
METALW-010098-0010,mismo.,same.,None
METALW-010098-0011,"De acuerdo, gracias","All right, thank you.",None
METALW-010099-0000,"Hola, ¿en qué puedo ayudarle?","Hi, how can I help you?",None
METALW-010099-0001,puedes comparar la con nyc,you can compare it to nyc,None
METALW-010099-0002,ok lo que te gustaría comparar.,ok what you'd like to compare.,None
METALW-010099-0003,el clima,the weather,None
METALW-010099-0004,"Ok, la temperatura promedio en Los Ángeles es 74. La temperatura promedio en NY es 60.","Okay, the average temperature in Los Angeles is 74. The average temperature in NY is 60.",None
METALW-010099-0005,¿qué tal las ubicaciones,how are the locations,None
METALW-010099-0006,"Lo siento, puede hacer una pregunta más específica.","I'm sorry, you can ask a more specific question.",None
METALW-010099-0007,cuál es mejor,which is better,None
METALW-010099-0008,ambos son geniales. ¿Hay algo más que las ciudades que puedo comparar,they're both great. Is there anything more than the cities I can compare,None
METALW-010099-0009,npo,npo,None
METALW-010099-0010,Los Ángeles tiene mejor clima.,Los Angeles has better weather.,None
METALW-010100-0000,"Hola, ¿en qué puedo ayudarle?","Hi, how can I help you?",None
METALW-010100-0001,¿Cómo se llama el río que atraviesa Praga?,What's the name of the river that runs through Prague?,None
METALW-010100-0002,Eso es Vltava,That's Vltava.,None
METALW-010100-0003,¿Cuánto tiempo es?,How long is it?,None
METALW-010100-0004,480 km,480 km,None
METALW-010100-0005,¿Por dónde empieza?,Where does it start?,None
METALW-010100-0006,Bosque bohemio,Bohemian forest,None
METALW-010100-0007,¿Dónde termina?,Where does it end?,None
METALW-010100-0008,Cesky Krumlov,Cesky Krumlov,None
METALW-010100-0009,Bien gracias bot buddy,Well thank you bot buddy,None
METALW-010100-0010,¿Algo más?,Anything else?,None
METALW-010100-0011,"No, gracias",No thanks,None
METALW-010100-0012,bienvenido,welcome,None
METALW-010101-0000,"Hola, ¿en qué puedo ayudarle?","Hi, how can I help you?",None
METALW-010101-0001,Hola me gustaría un poco de ayuda para comparar algunas ciudades,Hello I would like some help to compare some cities,None
METALW-010101-0002,¿Cuáles tenías en mente?,Which ones did you have in mind?,None
METALW-010101-0003,Me gustaría comparar Los Ángeles y Nueva York. ¿Dónde está más caliente ahora?,I'd like to compare Los Angeles and New York. Where's the hottest now?,None
METALW-010101-0004,Los Ángeles es casi siempre más caliente,Los Angeles is almost always hotter,None
METALW-010101-0005,¿Qué ciudad es más grande?,Which city is bigger?,None
METALW-010101-0006,"NYC es más grande por personas, pero La por área","NYC is bigger by people, but la per area",None
METALW-010101-0007,¿Las expectativas de vida son diferentes entre las dos ciudades?,Are life expectancies different between the two cities?,None
METALW-010101-0008,Sí NYC es mejor esperanza de vida,Yes NYC is better life expectancy,None
METALW-010101-0009,¡Gracias! Eso es todo lo que necesitaba hoy.,Thank you! That's all I needed today.,None
METALW-010101-0010,Que tengas una buena,Have a good one,None
METALW-010102-0000,"Hola, ¿en qué puedo ayudarle?","Hi, how can I help you?",None
METALW-010102-0001,Necesito saber algunos hechos sobre algunas ciudades.,I need to know some facts about some cities.,None
METALW-010102-0002,"Claro, ¿qué te gustaría saber?","Sure, what would you like to know?",None
METALW-010102-0003,¿En qué río está Montreal?,What river is Montreal on?,None
METALW-010102-0004,Montreal descansa en el río Colombus.,Montreal rests on the Colombus River.,None
METALW-010102-0005,Muy bien y ¿qué es la población?,"All right, what's the population?",None
METALW-010102-0006,La población de Montreal es de 500.000 habitantes.,"The population of Montreal is 500,000.",None
METALW-010102-0007,¿Dónde está Montreal?,Where's Montreal?,None
METALW-010102-0008,El Montreal se encuentra en Canadá.,Montreal is located in Canada.,None
METALW-010102-0009,"Muy bien, gracias.","Very good, thank you.",None
METALW-010102-0010,¡No hay problema!,No problem!,None
METALW-010103-0000,"Hola, ¿en qué puedo ayudarle?","Hi, how can I help you?",None
METALW-010103-0001,Tengo una pregunta sobre una ciudad.,I have a question about a city.,None
METALW-010103-0002,"Claro, ¿cuál es tu pregunta?","Sure, what's your question?",None
METALW-010103-0003,¿Cuál es la esperanza de vida promedio en Denver?,What is the average life expectancy of someone in Denver?,None
METALW-010103-0004,La esperanza de vida promedio en Denver es de 78 años.,The average life expectancy in Denver is 78 years.,None
METALW-010103-0005,¿Qué pasa en Nueva York?,What's going on in New York?,None
METALW-010103-0006,La esperanza de vida promedio en la ciudad de Nueva York es de 73 años.,The average life expectancy in New York City is 73 years.,None
METALW-010103-0007,¿Qué hay de Los Ángeles?,What about Los Angeles?,None
METALW-010103-0008,La esperanza de vida promedio en Los Ángeles es de 70 años.,The average life expectancy in Los Angeles is 70 years.,None
METALW-010103-0009,Muy bien. Gracias por la información.,Very well. Thanks for the information.,None
METALW-010103-0010,De nada.,You are welcome.,None
METALW-010104-0000,"Hola, ¿en qué puedo ayudarle?","Hi, how can I help you?",None
METALW-010104-0001,"Hola, tengo una pregunta sobre Denver, Colorado.","Hi, I have a question about Denver, Colorado.",None
METALW-010104-0002,¿Cuál es tu pregunta?,What's your question?,None
METALW-010104-0003,¿Puedes decirme la esperanza de vida promedio en esa ciudad?,Can you tell me the average life expectancy in that city?,None
METALW-010104-0004,La esperanza de vida promedio es de 82 años.,The average life expectancy is 82 years.,None
METALW-010104-0005,"Gracias. ¿Es sólo para hombres, sólo mujeres o ambos juntos?","Thank you. Is it just for men, just women or both together?",None
METALW-010104-0006,Los dos están juntos.,The two of you are together.,None
METALW-010104-0007,Muchas gracias por su ayuda.,Thank you very much for your help.,None
METALW-010104-0008,¡De nada! ¿Puedo ayudar con otra cosa?,You are welcome! Can I help with something else?,None
METALW-010104-0009,"No, eso será todo por hoy. Que tengas un gran día.","No, that'll be all for today. Have a great day.",None
METALW-010104-0010,¡Tú también!,You too!,None
METALW-010105-0000,"Hola, ¿en qué puedo ayudarle?","Hi, how can I help you?",None
METALW-010105-0001,"hola, ¿puedes decirme quién fundó Roma?","Hello, can you tell me who founded Rome?",None
METALW-010105-0002,"Según la leyenda, la Antigua Roma fue fundada por los dos hermanos, y demi-dioses, Rómulo y Remus","According to legend, Ancient Rome was founded by the two brothers, and demi-gods, Rómulo and Remus",None
METALW-010105-0003,¿Cuál fue el año en que se fundó Roma?,What was the year Rome was founded?,None
METALW-010105-0004,Roma fue fundada en el año 753 a. C.,Rome was founded in 753 a. C.,None
METALW-010105-0005,¿Cuál es la población actual de Roma?,What is the current population of Rome?,None
METALW-010105-0006,"2,873,874","2,873,874",None
METALW-010105-0007,¿en qué huso horario se encuentra Roma?,What time zone is Rome located in?,None
METALW-010105-0008,Roma se encuentra en la zona horaria centroeuropea (CET),Rome is located in the Central European time zone (CET),None
METALW-010105-0009,"genial, gracias!","Great, thank you!",None
METALW-010105-0010,¡No hay problema! ¡Que tengas un buen día!,No problem! Have a nice day!,None
METALW-010106-0000,"Hola, ¿en qué puedo ayudarle?","Hi, how can I help you?",None
METALW-010106-0001,"Quiero saber algo sobre Denver, Colorado.","I want to know something about Denver, Colorado.",None
METALW-010106-0002,¿Qué te gustaría saber?,What would you like to know?,None
METALW-010106-0003,¿Cuál es el edificio más alto de Denver?,What's the tallest building in Denver?,None
METALW-010106-0004,El edificio más alto de Denver es el Republis Plaza.,Denver's tallest building is the Republis Plaza.,None
METALW-010106-0005,¿Qué tan alto es ese edificio?,How tall is that building?,None
METALW-010106-0006,714 pies,714 feet,None
METALW-010106-0007,"Vaya, eso es bastante alto.","Wow, that's pretty high.",None
METALW-010106-0008,Lo es. ¿Te gustaría saber algo más?,It is. Would you like to know something else?,None
METALW-010106-0009,Eso es todo gracias por toda la ayuda.,That's all thanks for all the help.,None
METALW-010106-0010,De nada.,You are welcome.,None
METALW-010107-0000,"Hola, ¿en qué puedo ayudarle?","Hi, how can I help you?",None
METALW-010107-0001,Tengo una pregunta para ti.,I have a question for you.,None
METALW-010107-0002,"¡Ciertamente, soy un bot de hechos!",I'm certainly a fact bot!,None
METALW-010107-0003,"¿Cuál es el edificio más alto de Denver, Colorado?","What is the tallest building in Denver, Colorado?",None
METALW-010107-0004,El edificio más alto de Denver es el Republis Plaza,Denver's tallest building is the Republis Plaza,None
METALW-010107-0005,¿Qué tan alto es?,How tall is it?,None
METALW-010107-0006,La Plaza Republis tiene una asombrosa altura de 134 pies,Republis Square has an astonishing height of 134 feet,None
METALW-010107-0007,¡Eso es increíble!,That's unbelievable!,None
METALW-010107-0008,¡De acuerdo! ¿Habrá algo más hoy,I agree! Will there be anything else today,None
METALW-010107-0009,Eso es todo. gracias.,That's all. Thank you.,None
METALW-010107-0010,No hay problema,No problem,None
METALW-010108-0000,"Hola, ¿en qué puedo ayudarle?","Hi, how can I help you?",None
METALW-010108-0001,ayúdame con los hechos de la ciudad,help me with the facts of the city,None
METALW-010108-0002,¿Qué ciudades?,What cities?,None
METALW-010108-0003,para Denver,for Denver,None
METALW-010108-0004,Partes de Denver se encuentran en una elevación están a más de una milla sobre el nivel del mar.,Parts of Denver are at an elevation are more than a mile above sea level.,None
METALW-010108-0005,"en promedio, ¿cuánto tiempo vive la gente allí?","on average, how long do people live there?",None
METALW-010108-0006,18 años,18 years old,None
METALW-010108-0007,me refiero a la esperanza de edad,I mean the old hope,None
METALW-010108-0008,78 años,78 years old,None
METALW-010108-0009,ok muy bien,ok very well,None
METALW-010108-0010,¿Eso es todo?,That's all?,None
METALW-010108-0011,Sí,Yes,None
METALW-010109-0000,"Hola, ¿en qué puedo ayudarle?","Hi, how can I help you?",None
METALW-010109-0001,Quiero saber algo sobre Denver.,I want to know something about Denver.,None
METALW-010109-0002,Bien,Not bad,None
METALW-010109-0003,¿Cuál es la esperanza de vida promedio allí?,What is the average life expectancy there?,None
METALW-010109-0004,Son 80 yrears,It's 80 yrears,None
METALW-010109-0005,"Genial, gracias.","Great, thank you.",None
METALW-010109-0006,¿Algo más?,Anything else?,None
METALW-010109-0007,¿En qué estado está Denver?,What state is Denver in?,None
METALW-010109-0008,Colorado,Colorado,None
METALW-010109-0009,¡uau! salvaje. gracias.,wow! wild. Thank you.,None
METALW-010109-0010,de nada,You are welcome,None
METALW-010110-0000,"Hola, ¿en qué puedo ayudarle?","Hi, how can I help you?",None
METALW-010110-0001,¿Puedes responder una pregunta por mí?,Can you answer a question for me?,None
METALW-010110-0002,"Sí, ¿con qué puedo ayudar?","Yes, what can I do for you?",None
METALW-010110-0003,¿En qué remachada está la ciudad de Montreal?,What riveted is the city of Montreal?,None
METALW-010110-0004,Santa Lauren yo lo llamo- somos amigos,Santa Lauren I call it - we're friends,None
METALW-010110-0005,¿Qué tan ancho es el río?,How wide is the river?,None
METALW-010110-0006,50 pies,50 feet,None
METALW-010110-0007,¿Qué tan profundo se pone?,How deep does it get?,None
METALW-010110-0008,25 pies,25 feet,None
METALW-010110-0009,¿Cuál es la temperatura media?,What is the average temperature?,None
METALW-010110-0010,88,88,None
METALW-010111-0000,"Hola, ¿en qué puedo ayudarle?","Hi, how can I help you?",None
METALW-010111-0001,¿Podría darme algunos hechos,Could you give me some facts,None
METALW-010111-0002,"Claro, ¿qué te gustaría saber?","Sure, what would you like to know?",None
METALW-010111-0003,¿En qué río se sienta la ciudad de Montreal?,What river does the city of Montreal sit on?,None
METALW-010111-0004,El río Álamo,The Alamo River,None
METALW-010111-0005,¿Sabes cuánto dura el río?,Do you know how long the river lasts?,None
METALW-010111-0006,10.000 km,"10,000 km",None
METALW-010111-0007,¿Y la profundidad?,What about the depth?,None
METALW-010111-0008,230 km en su punto más profundo,230 km deepest,None
METALW-010111-0009,"Perfecto, gracias por su helpQ","Perfect, thank you for your helpQ",None
METALW-010111-0010,De nada,You are welcome,None
METALW-010112-0000,"Hola, ¿en qué puedo ayudarle?","Hi, how can I help you?",None
METALW-010112-0001,ayúdame con Denver,help me with Denver,None
METALW-010112-0002,¿Cómo quieres que te ayude con Denver?,How do you want me to help you with Denver?,None
METALW-010112-0003,¿Sabes cuál es el edificio más alto de allí?,Do you know what the tallest building is there?,None
METALW-010112-0004,El edificio más alto es la Plaza Republis,The tallest building is Republis Square,None
METALW-010112-0005,¿cuándo se construyó?,When was it built?,None
METALW-010112-0006,Fue construido en 1978,It was built in 1978,None
METALW-010112-0007,¿Sabes cuántas historias tiene?,Do you know how many stories he has?,None
METALW-010112-0008,70 historias,70 stories,None
METALW-010112-0009,gracias por la información,thanks for the information,None
METALW-010112-0010,No hay problema. ¿Puedo ayudar con cualquier otra cosa?,No problem. Can I help with anything else?,None
METALW-010112-0011,No,No,None
METALW-010113-0000,"Hola, ¿en qué puedo ayudarle?","Hi, how can I help you?",None
METALW-010113-0001,¿Puedes ayudarme a encontrar un hecho sobre Roma?,Can you help me find a fact about Rome?,None
METALW-010113-0002,seguro,sure,None
METALW-010113-0003,¿Quién fundó Roma?,Who founded Rome?,None
METALW-010113-0004,Fue fundada por Remus y Rómulo,It was founded by Remus and Rómulo,None
METALW-010113-0005,¿Qué año fue ese?,What year was that?,None
METALW-010113-0006,abril 21 753 bc,April 21 753 bc,None
METALW-010113-0007,¿dónde están los hermanos?,Where are the brothers?,None
METALW-010113-0008,"Sí, son hermanos","Yes, they're brothers.",None
METALW-010113-0009,interesante. Gracias por su ayuda.,interesting. Thank you for your help.,None
METALW-010113-0010,encantado de ayudarle,happy to help you,None
METALW-010114-0000,"Hola, ¿en qué puedo ayudarle?","Hi, how can I help you?",None
METALW-010114-0001,¿Puedes decirme en qué río está la ciudad de Montreal?,Can you tell me which river the city of Montreal is in?,None
METALW-010114-0002,El río se llama río Montreal.,The river is called the Montreal River.,None
METALW-010114-0003,¿Qué tan ancho es el río/,How wide is the river/,None
METALW-010114-0004,El río tiene 1 km de ancho.,The river is 1 km wide.,None
METALW-010114-0005,¿Cuántos puentes de Montreal cruzan el río?,How many Montreal bridges cross the river?,None
METALW-010114-0006,Hay 5 puentes en Montreal que cruzan el río.,There are 5 bridges in Montreal that cross the river.,None
METALW-010114-0007,¿El río atraviesa el centro de la ciudad?,Does the river cross the city center?,None
METALW-010114-0008,El río no corre a través del centro de la ciudad.,The river does not run through the city center.,None
METALW-010114-0009,¿Utiliza Montreal el río para transportar mercancías a otras ciudades?,Does Montreal use the river to transport goods to other cities?,None
METALW-010114-0010,Montreal utiliza el río para transportar mercancías a otras ciudades.,Montreal uses the river to transport goods to other cities.,None
METALW-010114-0011,impresionante. gracias,impressive. Thank you,None
METALW-010115-0000,"Hola, ¿en qué puedo ayudarle?","Hi, how can I help you?",None
METALW-010115-0001,Necesito algunos hechos,I need some facts.,None
METALW-010115-0002,"Claro, ¿sobre qué?","Of course, about what?",None
METALW-010115-0003,¿Quién fundó Roma?,Who founded Rome?,None
METALW-010115-0004,Rómulo y Rómulo,Rómulo and Rómulo,None
METALW-010115-0005,¿Cuándo se fundó?,When was it founded?,None
METALW-010115-0006,765 a. C.,765 a. C.,None
