UID,SEG,translation,profanity
METALW-009872-0010,¡que tenga un día maravilloso!,Have a wonderful day!,None
METALW-009872-0011,¡Tú también!,You too!,None
METALW-009873-0000,"Hola, ¿en qué puedo ayudarle?","Hi, how can I help you?",None
METALW-009873-0001,Necesito información sobre una ciudad,I need information about a city,None
METALW-009873-0002,seguro. ¿Con qué ciudad puedo ayudar?,sure. What city can I help with?,None
METALW-009873-0003,¿Qué río atraviesa Montreal?,What river crosses Montreal?,None
METALW-009873-0004,El río San Lorenzo,The San Lorenzo River,None
METALW-009873-0005,¿Qué tan ancho es?,How wide is it?,None
METALW-009873-0006,45 pies en la mayoría de los lugares.,45 feet in most places.,None
METALW-009873-0007,¿Qué tan profundo es?,How deep is it?,None
METALW-009873-0008,22 pies en la mayoría de los lugares.,22 feet in most places.,None
METALW-009873-0009,¿Cuánto tiempo es?,How long is it?,None
METALW-009873-0010,800 millas.,800 miles.,None
METALW-009874-0000,"Hola, ¿en qué puedo ayudarle?","Hi, how can I help you?",None
METALW-009874-0001,Tengo información sobre Denver,I have information about Denver.,None
METALW-009874-0002,¿Qué tipo de información le gustaría?,What kind of information would you like?,None
METALW-009874-0003,¿Cuál es la esperanza de vida promedio de las mujeres en Denver?,What is the average life expectancy of women in Denver?,None
METALW-009874-0004,83 años - ¿Hay algo más,83 years old - Is there anything else,None
METALW-009874-0005,¿Cuál es la esperanza de vida promedio de los hombres?,What is the average life expectancy of men?,None
METALW-009874-0006,81 años en Denver - ¿Hay algo más?,81 years in Denver - Is there anything else?,None
METALW-009874-0007,"No, gracias",No thanks,None
METALW-009874-0008,Gracias por contactarme,Thank you for contacting me,None
METALW-009874-0009,Bien gracias por la información,Well thank you for the information,None
METALW-009874-0010,Ten un buen día,Have a good day,None
METALW-009875-0000,"Hola, ¿en qué puedo ayudarle?","Hi, how can I help you?",None
METALW-009875-0001,¿Quién fundó Roma?,Who founded Rome?,None
METALW-009875-0002,Alto el fuego,Cease fire,None
METALW-009875-0003,Creo que estuvo allí mucho después de la fundación. Busca una vez más pleae. Por favor.,I think he was there long after the foundation. Look once again for pleae. Please.,None
METALW-009875-0004,Lo busqué y tienes razón,I looked for it and you're right.,None
METALW-009875-0005,¿Quiénes eran los fundadores?,Who were the founders?,None
METALW-009875-0006,Cleopatra,Cleopatra,None
METALW-009875-0007,"Oh, de nuevo estuvieron allí después de la fundación.","Oh, they were there again after the foundation.",None
METALW-009875-0008,Puedo investigarlo por ti,I can do it for you.,None
METALW-009875-0009,Por favor.,Please.,None
METALW-009875-0010,"No, son los fundadores","No, they're the founders.",None
METALW-009876-0000,"Hola, ¿en qué puedo ayudarle?","Hi, how can I help you?",None
METALW-009876-0001,¿Puedes darme algunos datos sobre Los Ángeles,Can you give me some information about Los Angeles,None
METALW-009876-0002,seguro. Puedo ayudar con los hechos sobre Los Ángeles. ¿Puedes ser un poco más específico?,sure. I can help with the facts about Los Angeles. Can you be a little more specific?,None
METALW-009876-0003,¿Cuál es la vida promedio en Los Ángeles,What is the average life in Los Angeles,None
METALW-009876-0004,La vida media es de 83.,The half-life is 83.,None
METALW-009876-0005,y qué tal en NYC,and how about in NYC,None
METALW-009876-0006,En NYC es 81.,In NYC it's 81.,None
METALW-009876-0007,¿Cuál es Más poblado Los Ángeles o Nueva York?,What is More Populated Is Los Angeles or New York?,None
METALW-009876-0008,la.,the.,None
METALW-009876-0009,Y los ingresos promedio son más altos en Los Ángeles o NYC,And the average income is higher in Los Angeles or NYC,None
METALW-009876-0010,Los Ángeles tiene los ingresos más altos.,Los Angeles has the highest income.,None
METALW-009877-0000,"Hola, ¿en qué puedo ayudarle?","Hi, how can I help you?",None
METALW-009877-0001,¿Eres capaz de comparar dos ciudades?,Are you able to compare two cities?,None
METALW-009877-0002,Puedo ayudarte con hechos relacionados con las ciudades. ¿Cuál es tu pregunta?,I can help you with city-related facts. What's your question?,None
METALW-009877-0003,¿Podría comparar Nueva York y Los Ángeles por mí?,Could you compare New York and Los Angeles for me?,None
METALW-009877-0004,Puedo proporcionarle datos específicos sobre Nueva York y Los Ángeles. No puedo comparar ciudades directamente.,I can provide you with specific data about New York and Los Angeles. I can't compare cities directly.,None
METALW-009877-0005,"Muy bien entonces, ¿cuál es la población de la ciudad de Nueva York?","All right, then, what's the population of New York City?",None
METALW-009877-0006,8.5 personas viven en la ciudad de Nueva York. millón,8.5 people live in New York City. million,None
METALW-009877-0007,¿Cuál es la población de Los Ángeles?,What is the population of Los Angeles?,None
METALW-009877-0008,"Aproximadamente 3,9 millones de personas viven en Los Ángeles.",Approximately 3.9 million people live in Los Angeles.,None
METALW-009877-0009,"genial, gracias!","Great, thank you!",None
METALW-009877-0010,¿Hay algo más que pueda hacer por ti?,Is there anything else I can do for you?,None
METALW-009878-0000,"Hola, ¿en qué puedo ayudarle?","Hi, how can I help you?",None
METALW-009878-0001,Necesito información de la ciudad,I need information from the city.,None
METALW-009878-0002,"Muy bien, puedo ayudar.","All right, I can help.",None
METALW-009878-0003,¿Puedes ayudarme específicamente con los hechos de Montreal?,Can you help me specifically with the events of Montreal?,None
METALW-009878-0004,seguro.,sure.,None
METALW-009878-0005,¿En qué río está Montreal?,What river is Montreal on?,None
METALW-009878-0006,Está en la confluencia de los ríos San Lorenzo y Ottawa.,It is at the confluence of the San Lorenzo and Ottawa rivers.,None
METALW-009878-0007,¿Qué tan grande es el río Ottawa?,How big is the Ottawa River?,None
METALW-009878-0008,Tiene 790 millas de largo.,It's 790 miles long.,None
METALW-009878-0009,Eso es interesante. No sabía que era tanto tiempo. ¡Gracias!,That's interesting. I didn't know it was that long. Thank you!,None
METALW-009878-0010,¡De nada!,You are welcome!,None
METALW-009879-0000,"Hola, ¿en qué puedo ayudarle?","Hi, how can I help you?",None
METALW-009879-0001,Necesito ayuda para comparar ciudades,I need help comparing cities,None
METALW-009879-0002,¿Qué ciudades te gustaría que comparara?,Which cities would you like me to compare?,None
METALW-009879-0003,NYC y Los Ángeles,NYC and Los Angeles,None
METALW-009879-0004,¿Qué te gustaría comparar?,What would you like to compare?,None
METALW-009879-0005,El tiempo para empezar,The time to start,None
METALW-009879-0006,¿Qué aspecto del tiempo/,What aspect of time/,None
METALW-009879-0007,Que es más cálido,Which is warmer,None
METALW-009879-0008,Los Ángeles tiene una temperatura media mucho más alta.,Los Angeles has a much higher average temperature.,None
METALW-009879-0009,gracias,Thank you,None
METALW-009879-0010,De nada.,You are welcome.,None
METALW-009880-0000,"Hola, ¿en qué puedo ayudarle?","Hi, how can I help you?",None
METALW-009880-0001,"Hola, me pregunto cuál es el edificio más alto de Denver, Colorado.","Hi, I wonder what the tallest building is in Denver, Colorado.",None
METALW-009880-0002,"Déjame ver eso, un momento El edificio más alto de Denver es la plaza republis","Let me see that, one moment The tallest building in Denver is the republis square",None
METALW-009880-0003,¡fresco! Gracias por su ayuda,fresh! Thank you for your help,None
METALW-009880-0004,"No hay problema, ¿hay algo más con lo que pueda ayudar?","No problem, is there anything else I can help with?",None
METALW-009880-0005,Eso es todo por ahora. Adiós.,That's all for now. Good bye.,None
METALW-009880-0006,Que tengas un buen día,Have a nice day,None
METALW-009880-0007,Tú también,You too,None
METALW-009880-0008,Háganos saber si alguna vez necesita algo en el futuro,Let us know if you ever need anything in the future,None
METALW-009880-0009,¡Lo haré!,I will!,None
METALW-009880-0010,Adiós,Good bye,None
METALW-009881-0000,"Hola, ¿en qué puedo ayudarle?","Hi, how can I help you?",None
METALW-009881-0001,Necesito que respondas a algunos hechos de la ciudad,I need you to respond to some facts about the city.,None
METALW-009881-0002,"Claro, ¿qué te gustaría saber?","Sure, what would you like to know?",None
METALW-009881-0003,"Cuál es el edificio más alto de Denver, Colorado","What's the tallest building in Denver, Colorado",None
METALW-009881-0004,"De acuerdo, dame un momento mientras te busco eso... El edificio más alto de Denver es el Republis Plaza","All right, give me a moment while I look for that... Denver's tallest building is the Republis Plaza",None
METALW-009881-0005,Qué alto es este edificio,How tall this building is,None
METALW-009881-0006,mide 714 pies de altura,714 feet tall,None
METALW-009881-0007,¡realmente! Eso es increíble. ¿Es el edificio una atracción turística?,really! That's unbelievable. Is the building a tourist attraction?,None
METALW-009881-0008,"La mayoría de los pisos se utilizan para el espacio de oficinas, no es una atracción turística importante","Most floors are used for office space, not a major tourist attraction",None
METALW-009881-0009,De acuerdo gracias,"All right, thank you.",None
METALW-009881-0010,¿Necesitas algo más para hoy?,Need something else for today?,None
METALW-009881-0011,"No, eso será todo","No, that'll be it.",None
METALW-009882-0000,"Hola, ¿en qué puedo ayudarle?","Hi, how can I help you?",None
METALW-009882-0001,¿puedes decirme cuál es la esperanza de vida en Denver,Can you tell me what the life expectancy of life is in Denver,None
METALW-009882-0002,"La esperanza de vida en Denver, Colorado, es de aproximadamente 80 años.","Life expectancy in Denver, Colorado, is approximately 80 years.",None
METALW-009882-0003,es eso para los machos de las hembras?,is that for female males?,None
METALW-009882-0004,Es para ambos géneros en promedio.,It is for both genres on average.,None
METALW-009882-0005,es esto más alto que otras ciudades,is this higher than other cities,None
METALW-009882-0006,No tengo información para eso en este momento.,I don't have any information for that right now.,None
METALW-009882-0007,¿por qué la esperanza de vida es tan alta en Denver?,Why is life expectancy so high in Denver?,None
METALW-009882-0008,Esto se debe a un estilo de vida más relajado con menos estrés que la mayoría de las ciudades.,This is due to a more relaxed lifestyle with less stress than most cities.,None
METALW-009882-0009,Excelente,excellent,None
METALW-009882-0010,"Sí, vivir en Denver sería un momento maravilloso para tus nervios.","Yes, living in Denver would be a wonderful time for your nerves.",None
METALW-009883-0000,"Hola, ¿en qué puedo ayudarle?","Hi, how can I help you?",None
METALW-009883-0001,puede comparar NYC y LOS para mí ?,can you compare NYC and LOS for me ?,None
METALW-009883-0002,"Claro, ¿pero puedes reducir eso un poco?","Sure, but can you reduce that a little bit?",None
METALW-009883-0003,población,population,None
METALW-009883-0004,"La ciudad de Nueva York tiene más de 8 millones de personas. Mientras que Los Ángeles tiene 3,79 millones de personas",New York City has more than 8 million people. While Los Angeles has 3.79 million people,None
METALW-009883-0005,¿qué pasa con el clima,what about the weather,None
METALW-009883-0006,"Los Ángeles tiene un clima más justo, mientras que la ciudad de Nueva York es más fría. Ciertas partes de Los Ángeles nunca reciben nieve, sin embargo ciertas partes en las montañas más altas reciben nieve en Los Ángeles cada invierno","Los Angeles has a fairer climate, while New York City is colder. Certain parts of Los Angeles never receive snow, however certain parts in the highest mountains receive snow in Los Angeles every winter",None
METALW-009883-0007,¿en qué ocens están?,What are you in?,None
METALW-009883-0008,La ciudad de Nueva York está en el Atlántico mientras Los Ángeles está en el Pacífico,New York City is in the Atlantic while Los Angeles is in the Pacific,None
METALW-009883-0009,Gracias,Thank you,None
METALW-009883-0010,De nada,You are welcome,None
METALW-009884-0000,"Hola, ¿en qué puedo ayudarle?","Hi, how can I help you?",None
METALW-009884-0001,"La geografía ayuda, por favor.","Geography helps, please.",None
METALW-009884-0002,seguro. ¿Cómo puedo ayudar?,sure. How can I help?,None
METALW-009884-0003,¿Qué río atraviesa Montreal?,What river crosses Montreal?,None
METALW-009884-0004,El río Montreal.,The Montreal River.,None
METALW-009884-0005,"Vaya, eso fue rápido. ¡Eres genial!","Wow, that was quick. You're great!",None
METALW-009884-0006,Gracias. ¿Hay algo más con lo que pueda ayudarte hoy?,Thank you. Is there anything else I can help you with today?,None
METALW-009884-0007,No creo. Te recomendaré a todos mis amigos.,I don't think so. I'll recommend you to all my friends.,None
METALW-009884-0008,¡Te lo agradezco! El río tiene 400 millas de largo y 54 pies de ancho en la mayoría de las áreas.,I appreciate it! The river is 400 miles long and 54 feet wide in most areas.,None
METALW-009884-0009,Gracias por la información adicional. Hablaré contigo cada vez que necesite más ayuda.,Thank you for the additional information. I'll talk to you whenever I need more help.,None
METALW-009884-0010,Gracias. ¡Que tengas una buena noche!,Thank you. Have a good night!,None
METALW-009885-0000,"Hola, ¿en qué puedo ayudarle?","Hi, how can I help you?",None
METALW-009885-0001,"Hola, tengo una pregunta sobre una ciudad.","Hi, I have a question about a city.",None
METALW-009885-0002,¿A qué ciudad te refieres?,What city do you mean?,None
METALW-009885-0003,Esto sería con respecto a Montreal.,This would be about Montreal.,None
METALW-009885-0004,¿Qué te gustaría saber sobre Montreal?,What would you like to know about Montreal?,None
METALW-009885-0005,¿En qué río está Montreal?,What river is Montreal on?,None
METALW-009885-0006,"Creo que es en Ontario, Canadá. ¿Te gustaría saber algo más?","I think it's in Ontario, Canada. Would you like to know something else?",None
METALW-009885-0007,"Excelente, eso era todo lo que necesitaba saber.","Excellent, that's all I needed to know.",None
METALW-009885-0008,"Me alegro de poder ayudarte, ¿quieres más información sobre una ciudad diferente?","I'm glad I can help you, want more information about a different city?",None
METALW-009885-0009,"No, eso es todo por hoy. Muchas gracias.","No, that's all for today. Thanks a lot.",None
METALW-009885-0010,De nada. que tenga un día maravilloso.,You are welcome. have a wonderful day.,None
METALW-009886-0000,"Hola, ¿en qué puedo ayudarle?","Hi, how can I help you?",None
METALW-009886-0001,"¿Cómo, tenía curiosidad por algunos hechos sobre una ciudad. ¿Puedes ayudar?","How, I was curious about some facts about a city. Can you help?",None
METALW-009886-0002,seguro. ¿Cómo puedo ayudarle?,sure. How can I help you?,None
METALW-009886-0003,"Bien. Quería saber cuál es el builiding más alto de Denver, Colorado.","Not bad. I wanted to know what the highest builiding is in Denver, Colorado.",None
METALW-009886-0004,El edificio más alto de Denver es el Republis Plaza,Denver's tallest building is the Republis Plaza,None
METALW-009886-0005,¿Dónde se encuentra?,Where is he?,None
METALW-009886-0006,Se encuentra en el centro de la ciudad cerca de la Yard House y el Delicioso Huevo,It is located in the city center near the Yard House and the Delicious Egg,None
METALW-009886-0007,"Dirección exacta, por favor.","Exact address, please.",None
METALW-009886-0008,"Calle 370 17, Denver, CO 80202","370 17th Street, Denver, CO 80202",None
METALW-009886-0009,"¡Genial, thx!","Great, thx!",None
METALW-009886-0010,De nada,You are welcome,None
METALW-009887-0000,"Hola, ¿en qué puedo ayudarle?","Hi, how can I help you?",None
METALW-009887-0001,Necesito hechos en algunas ciudades,I need facts in some cities,None
METALW-009887-0002,¿Qué ciudades? ¿Puedes ser más específico?,What cities? Can you be more specific?,None
METALW-009887-0003,¿Cómo se compara Los Ángeles con la ciudad de Nueva York?,How does Los Angeles compare to New York City?,None
METALW-009887-0004,La ciudad de Nueva York es más poblada,New York City is more populous,None
METALW-009887-0005,¿Cuál tiene más tráfico?,Which one has the most traffic?,None
METALW-009887-0006,Nueva York lo hace,New York does it,None
METALW-009887-0007,ok vamos a probar una ciudad diferente,ok let's try a different city,None
METALW-009887-0008,¿Qué ciudad quieres?,What city do you want?,None
METALW-009887-0009,¿Qué tan caliente se pone Miami en junio?,How hot does Miami get in June?,None
METALW-009887-0010,Puede llegar a 84 grados,It can reach 84 degrees,None
METALW-009888-0000,"Hola, ¿en qué puedo ayudarle?","Hi, how can I help you?",None
METALW-009888-0001,¿Puedes ayudarme con algunos hechos de la ciudad?,Can you help me with some facts about the city?,None
METALW-009888-0002,¿Qué ciudad?,What city?,None
METALW-009888-0003,Quiero comparar Los Ángeles y NYC,I want to compare Los Angeles and NYC,None
METALW-009888-0004,¿Puedes reducir lo que quieras comparado?,Can you reduce what you want compared?,None
METALW-009888-0005,¿Qué ciudad tiene la mejor vida nocturna?,Which city has the best nightlife?,None
METALW-009888-0006,"Eso es duro y subjetivo, la gente en la ciudad de Nueva York piensa que tienen la mejor vida nocturna y la gente en La cree que tienen la mejor vida nocturna. Club de Nueva York permanecerá abierto hasta las 5 a.m. así que voy a darle esto a NYC","That's hard and subjective, people in New York City think they have the best nightlife and people in La think they have the best nightlife. Club of New York will remain open until 5 a.m so I'm going to give this to NYC",None
METALW-009888-0007,Supongo que es bastante subjetivo que tengas razón. ¿Qué hay de la pizza? ¿Cuál es el consenso allí?,I guess it's pretty subjective that you're right. What about the pizza? What's the consensus there?,None
METALW-009888-0008,"En un momento La tenía terrible Pizza, pero la escena de la pizza ha surgido mucho allí y por tradición se lo daré a Nueva York.","At one point I had terrible Pizza, but the pizza scene has come up a lot there and by tradition I'll give it to New York.",None
METALW-009888-0009,Gracias por su entrada! Eso es todo lo que quería saber,Thank you for your entry! That's all I wanted to know.,None
METALW-009888-0010,Adiós ahora,Goodbye now,None
METALW-009889-0000,"Hola, ¿en qué puedo ayudarle?","Hi, how can I help you?",None
METALW-009889-0001,"Hola, necesito comparar Los Ángeles y NYC","Hello, I need to compare Los Angeles and NYC",None
METALW-009889-0002,¡Puedo hacer eso! ¿Qué te gustaría saber?,I can do that! What would you like to know?,None
METALW-009889-0003,¿Cuál es la diferencia de población,What is the population difference,None
METALW-009889-0004,¿Puedes reducir eso un poco?,Can you reduce that a little bit?,None
METALW-009889-0005,¿Cuál es la diferencia de población entre las dos ciudades? Esa es una pregunta específica,What is the population difference between the two cities? That's a specific question.,None
METALW-009889-0006,¿Estás hablando de humanos? ¿Gatos? ¿Humanos y gatos?,Are you talking about humans? Cats? Humans and cats?,None
METALW-009889-0007,Morsas,Walruses,None
METALW-009889-0008,"¡Gracias por aclarar! Hay dos morsas en Los Ángeles, pero sólo 0.89 en Nueva York.","Thanks for clearing up! There are two walruses in Los Angeles, but only 0.89 in New York.",None
METALW-009889-0009,"¡Genial, gracias!","Great, thank you!",None
METALW-009889-0010,¡De nada! ¿Puedo ayudarte con algo más?,You are welcome! Can I help you with something else?,None
METALW-009890-0000,"Hola, ¿en qué puedo ayudarle?","Hi, how can I help you?",None
METALW-009890-0001,Necesito información sobre Los Ángeles y NYC,I need information about Los Angeles and NYC.,None
METALW-009890-0002,¿Qué quieres saber?,What do you want to know?,None
METALW-009890-0003,¿Cuál es más grande en el área?,Which is bigger in the area?,None
METALW-009890-0004,¿Estás bien algo más?,Is anything else right?,None
METALW-009890-0005,Que tiene una población más grande,That has a larger population,None
METALW-009890-0006,NYC tiene mayor población,NYC has a larger population,None
METALW-009890-0007,Gracias,Thank you,None
METALW-009890-0008,¿Algo más?,Anything else?,None
METALW-009890-0009,eso es al,that's the,None
METALW-009890-0010,Bien,Not bad,None
METALW-009891-0000,"Hola, ¿en qué puedo ayudarle? Hola","Hi, how can I help you? Hello",None
METALW-009891-0001,¿Quién eres?,Who are you?,None
METALW-009891-0002,im ángel y usted ?,im angel and you ?,None
METALW-009891-0003,¿Quién es mi padre?,Who's my father?,None
METALW-009891-0004,mi padre es José Rizal y tú?,my father is you and José Rizal?,None
METALW-009891-0005,¿Quién ha fundado Roma?,Who founded Rome?,None
METALW-009891-0006,No sé,I do not know,None
METALW-009891-0007,lol,lol,None
METALW-009891-0008,¿Y tú?,And you?,None
METALW-009891-0009,eres inútil,you're useless,None
METALW-009891-0010,De acuerdo,I agree,None
METALW-009892-0000,"Hola, ¿en qué puedo ayudarle?","Hi, how can I help you?",None
METALW-009892-0001,pensando en mudarte ¿puedes comparar dos ciudades para mí?,"thinking about moving, can you compare two cities for me?",None
METALW-009892-0002,"Sí, puedo hacer esto por ti. ¿Puedes decirme las ciudades específicas?","Yes, I can do this for you. Can you tell me the specific cities?",None
METALW-009892-0003,La ciudad de Los Ángeles y Nueva York,The City of Los Angeles and New York,None
METALW-009892-0004,Bien. El tráfico de la ciudad de Nueva York es mejor que el de Los Ángeles para empezar.,Not bad. New York City traffic is better than Los Angeles traffic in the first place.,None
METALW-009892-0005,¿Cómo está el clima?,How's the weather?,None
METALW-009892-0006,"El clima es más cálido en Los Ángeles que en la ciudad de Nueva York, donde incluso neva! Espero que esto ayude.","The weather is warmer in Los Angeles than in New York City, where it even snows! I hope this helps.",None
METALW-009892-0007,"Sí, lo hace gracias","Yes, it does thank you",None
METALW-009892-0008,¡Bien! ¿Necesitas más datos sobre cualquiera de estas ciudades?,Not bad! Need more information about any of these cities?,None
METALW-009892-0009,no im buenas gracias,not im good thanks,None
METALW-009892-0010,Bien. Recuerda que siempre estoy aquí cuando necesitas hechos.,"Not bad. Remember, I'm always here when you need facts.",None
METALW-009893-0000,"Hola, ¿en qué puedo ayudarle?","Hi, how can I help you?",None
METALW-009893-0001,Necesito información sobre una ciudad a la que me dirijo. ¿Puedes ayudar?,I need information about a city I'm heading to. Can you help?,None
METALW-009893-0002,Sí puedo,"Yes, I can.",None
METALW-009893-0003,Me dirijo a Roma. ¿Sabes quién era el fundador de Roma?,I'm heading to Rome. Do you know who the founder of Rome was?,None
METALW-009893-0004,"Rómulo y rómulo, 2 hermanos","Rómulo and rómulo, 2 brothers",None
METALW-009893-0005,¡Genial! ¿Pensé que era un mito? jk bot sé que lo sabes todo,That's great! I thought it was a myth? jk bot I know you know everything,None
METALW-009893-0006,esa es la primera aclaración que se documenta,that's the first clarification documented,None
METALW-009893-0007,"Gracias bot, ¿Es Roma por cualquier cuerpo de agua?","Thank you bot, is Rome for any body of water?",None
METALW-009893-0008,"Roma está en el interior, no cerca del océano","Rome is inland, not near the ocean",None
METALW-009893-0009,"Bien, gracias eso es todo lo que necesito.","Well, thank you, that's all I need.",None
METALW-009893-0010,gracias por usarme,thank you for using me,None
METALW-009894-0000,"Hola, ¿en qué puedo ayudarle?","Hi, how can I help you?",None
METALW-009894-0001,información de la ciudad,city information,None
METALW-009894-0002,Sí,Yes,None
METALW-009894-0003,qué río corre cerca de Montreal,which river runs near Montreal,None
METALW-009894-0004,San Lorenzo,San Lorenzo,None
METALW-009894-0005,lo ancho que es,how wide it is,None
METALW-009894-0006,30 pies,30 feet,None
METALW-009894-0007,cuán profundo,how deep,None
METALW-009894-0008,20 pies,20 feet,None
METALW-009894-0009,Cuánto tiempo,How long,None
METALW-009894-0010,200 millas,200 miles,None
METALW-009895-0000,"Hola, ¿en qué puedo ayudarle?","Hi, how can I help you?",None
METALW-009895-0001,Necesito información sobre Denver Colorado,I need information about Denver Colorado.,None
METALW-009895-0002,"¿Qué te gustaría saber sobre Denver, Colorado?","What would you like to know about Denver, Colorado?",None
METALW-009895-0003,¿Cuál es la esperanza de vida promedio en Denver?,What is the average life expectancy of someone in Denver?,None
METALW-009895-0004,La esperanza de vida promedio es de 68 años.,The average life expectancy is 68 years.,None
METALW-009895-0005,No está tan mal. ¿Qué tal la esperanza de vida promedio en Louisiana?,It's not that bad. How about the average life expectancy in Louisiana?,None
METALW-009895-0006,La esperanza de vida promedio en Luisiana es de 62 años.,The average life expectancy in Louisiana is 62 years.,None
METALW-009895-0007,"hmm. Una diferencia definitiva, debe ser todo el té dulce y sémola de maíz.","hmm. A definite difference, it must be all sweet tea and grits.",None
