UID,SEG,translation,profanity
METALW-003107-0001,Tengo una pregunta sobre el huso horario,I have a question about the time zone.,None
METALW-003107-0002,fuego seguro lejos,safe fire away,None
METALW-003107-0003,¿Cómo funcionan las zonas horarias?,How do time zones work?,None
METALW-003107-0004,depende de la rotación de la tierra,depends on the rotation of the earth,None
METALW-003107-0005,¿qué hora es en NY,what time is it in NY,None
METALW-003107-0006,10pm,10pm,None
METALW-003107-0007,Gracias por la información,Thank you for the information,None
METALW-003107-0008,ewlcome,ewlcome,None
METALW-003107-0009,Adiós,Good bye,None
METALW-003107-0010,gracias,Thank you,None
METALW-003108-0000,"Hola, ¿en qué puedo ayudarle?","Hi, how can I help you?",None
METALW-003108-0001,Necesito ayuda con un problema de tiempo.,I need help with a time problem.,None
METALW-003108-0002,"¡Claro, puedo ayudar!","Sure, I can help!",None
METALW-003108-0003,"Tengo que llamar a Nueva York, pero actualmente estoy en Winnipeg. ¿Cuántas horas por delante está Nueva York?","I have to call New York, but I'm currently in Winnipeg. How many hours ahead is New York?",None
METALW-003108-0004,Sólo 1 hora.,Only 1 hour.,None
METALW-003108-0005,¿Sólo 1 hora? Eso no es mucho. También necesito llamar a Los Ángeles. ¿Asumo que están detrás de mí entonces?,Only 1 hour? That's not much. I also need to call Los Angeles. I assume they're behind me then?,None
METALW-003108-0006,Sí por 5 horas.,Yes for 5 hours.,None
METALW-003108-0007,"Bien. Es bueno saberlo. Sólo quiero asegurarme de no sacar a alguien de la cama, o durante la hora de la comida.","Not bad. It's good to know. I just want to make sure I don't get someone out of bed, or during mealtime.",None
METALW-003108-0008,¿Puedo hacer algo más?,Is there anything else I can do?,None
METALW-003108-0009,"No ahora, pero sé por dónde venir en el futuro.","Not now, but I know where to come in the future.",None
METALW-003108-0010,¡Cuídate!,Take care!,None
METALW-003109-0000,"Hola, ¿en qué puedo ayudarle?","Hi, how can I help you?",None
METALW-003109-0001,Necesito ayuda con las zonas horarias,I need help with time zones.,None
METALW-003109-0002,¿Cómo puedo ayudar con las zonas horarias?,How can I help with time zones?,None
METALW-003109-0003,medianoche en San Petersburgo es a qué hora en Vancouver,midnight in St. Petersburg is what time in Vancouver,None
METALW-003109-0004,San Petersburgo está 3 horas por delante de Vancouver do 12am en San Petersburgo es 8pm en Vancouver,St. Petersburg is 3 hours ahead of Vancouver do 12am in St. Petersburg is 8pm in Vancouver,None
METALW-003109-0005,¿Eso es todo? sólo 3 horas,That's all? only 3 hours,None
METALW-003109-0006,"Sí, ¿te referías a San Petersburgo Florida, verdad?","Yes, you meant St. Petersburg Florida, right?",None
METALW-003109-0007,Sí,Yes,None
METALW-003109-0008,"Bien, entonces sí. San Petersburgo Rusia está 10 horas por delante de Vancouver BC como una nota.","Well, then yes. St. Petersburg Russia is 10 hours ahead of Vancouver BC as a note.",None
METALW-003109-0009,gran gracias tanto,great thanks so much,None
METALW-003109-0010,De nada,You are welcome,None
METALW-003110-0000,"Hola, ¿en qué puedo ayudarle?","Hi, how can I help you?",None
METALW-003110-0001,Tengo una pregunta sobre las zonas horarias,I have a question about time zones,None
METALW-003110-0002,Puedo ayudar con las zonas horarias. ¿Qué necesitas saber?,I can help with time zones. What do you need to know?,None
METALW-003110-0003,¿A qué hora será en Vancouver cuando sea medianoche aquí en San Petersburgo?,What time will it be in Vancouver when it's midnight here in St. Petersburg?,None
METALW-003110-0004,Serían las 9 de la mañana en Vancouver cuando su medianoche en San Petersburgo. Espero que esto ayude,It would be 9 a.m. in Vancouver when his midnight in St. Petersburg. I hope this helps,None
METALW-003110-0005,¿Qué zona horaria es Vancouver?,What time zone is Vancouver?,None
METALW-003110-0006,Vancouver se encuentra dentro de la zona horaria pdt.,Vancouver is located within the pdt time zone.,None
METALW-003110-0007,"¡De acuerdo, gracias!","All right, thank you!",None
METALW-003110-0008,En cualquier momento. ¿Necesitas que te ayude con otra cosa?,Any minute now. Do you need me to help you with something else?,None
METALW-003110-0009,"¡No, eso es todo gracias otra vez!","No, that's all thanks again!",None
METALW-003110-0010,No hay problema. Que tengas un gran día,No problem. Have a great day,None
METALW-003111-0000,"Hola, ¿en qué puedo ayudarle?","Hi, how can I help you?",None
METALW-003111-0001,¿Puedo obtener ayuda con una pregunta de zona horaria?,Can I get help with a time zone question?,None
METALW-003111-0002,¿Qué querrías saber?,What would you like to know?,None
METALW-003111-0003,"Actualmente estoy en Nueva York, pero necesito llamar a Islandia. Son las 18:00 aquí. ¿A qué hora está ahí?","I'm currently in New York, but I need to call Iceland. It's 6 p.m. here. What time is he there?",None
METALW-003111-0004,Son las nueve de la noche,It's nine o'clock at night.,None
METALW-003111-0005,¿En qué zona horaria está Islandia?,What time zone is Iceland in?,None
METALW-003111-0006,GMT -3,GMT -3,None
METALW-003111-0007,¿Pero se llama GMT? -3,But is it called GMT? -3,None
METALW-003111-0008,O Greenwich mean time,O Greenwich mean time,None
METALW-003111-0009,Muy bien. ¡gracias!,Very well. Thank you!,None
METALW-003111-0010,Greenwich es una ciudad en Inglaterra,Greenwich is a city in England,None
METALW-003111-0011,¡Entiendo! gracias,I understand! Thank you,None
METALW-003112-0000,"Hola, ¿en qué puedo ayudarle?","Hi, how can I help you?",None
METALW-003112-0001,ayúdame con zonas horarias,help me with time zones,None
METALW-003112-0002,"por supuesto, ¿con qué puedo ayudarte?","of course, what can I do for you?",None
METALW-003112-0003,¿A qué hora es en Seattle?,What time is it in Seattle?,None
METALW-003112-0004,es actualmente 6:29 pm en Seattle,is currently 6:29 pm in Seattle,None
METALW-003112-0005,¿Estaría San Diego en la misma zona horaria?,Would San Diego be in the same time zone?,None
METALW-003112-0006,ningún San Diego no está en la misma zona horaria,no San Diego is not in the same time zone,None
METALW-003112-0007,¿Qué tan lejos o detrás está San Diego?,How far or behind is San Diego?,None
METALW-003112-0008,Siento haberme equivocado es en la misma zona horaria,I'm sorry I made a mistake in the same time zone.,None
METALW-003112-0009,Ya veo. gracias por la ayuda,I see. thank you for the help,None
METALW-003112-0010,¿Puedo ayudar con cualquier otra cosa?,Can I help with anything else?,None
METALW-003113-0000,"Hola, ¿en qué puedo ayudarle?","Hi, how can I help you?",None
METALW-003113-0001,Necesito saber a qué hora es,I need to know what time it is,None
METALW-003113-0002,"Ciertamente, puedo ayudar con eso. ¿Dónde estás ubicado?",I can certainly help with that. Where are you located?,None
METALW-003113-0003,Estoy en Nueva York y sus 18:00 horas... ¿qué hora es en Islandia,I'm in New York and your 6 p.m. ... what time is it in Iceland,None
METALW-003113-0004,"Está bien, déjame ver eso. Son las 1:00 a.m. en Islandia en este momento","All right, let me see that. It's 1:00 a.m in Iceland right now",None
METALW-003113-0005,¿Qué hay de Groenlandia?,What about Greenland?,None
METALW-003113-0006,comprobación. Son las 6 de la mañana en Groenlandia,check. It's 6 a.m. in Greenland,None
METALW-003113-0007,¿Qué pasa con Escandinavia,What about Scandinavia,None
METALW-003113-0008,Parece que son las 23:00 horas en Escandinavia.,Looks like it's 23:00 in Scandinavia.,None
METALW-003113-0009,ok gracias eso es todo!,ok thank you that's it!,None
METALW-003113-0010,¡No hay problema!,No problem!,None
METALW-003114-0000,"Hola, ¿en qué puedo ayudarle?","Hi, how can I help you?",None
METALW-003114-0001,Tengo una pregunta que hacer,I have a question to ask,None
METALW-003114-0002,Estoy aquí para ayudar. ¿Cuál es tu pregunta?,I'm here to help. What's your question?,None
METALW-003114-0003,¿Cuál es la zona horaria de Japón?,What is japan's time zone?,None
METALW-003114-0004,Hora estándar de JST o Japón,JST or Japan Standard Time,None
METALW-003114-0005,Jst. ¿Qué hora es ahora?,Jst. What time is it now?,None
METALW-003114-0006,2:57PM del jueves.,2:57PM on Thursday.,None
METALW-003114-0007,¿Qué tal Corea?,How's Korea?,None
METALW-003114-0008,Son las 2:58 p.m. del jueves en Corea del Sur.,It's 2:58 p.m Thursday in South Korea.,None
METALW-003114-0009,gracias,Thank you,None
METALW-003114-0010,De nada.,You are welcome.,None
METALW-003115-0000,"Hola, ¿en qué puedo ayudarle?","Hi, how can I help you?",None
METALW-003115-0001,Quiero saber algo de información sobre las zonas horarias por favor,I want to know some information about time zones please,None
METALW-003115-0002,¿Qué quieres saber?,What do you want to know?,None
METALW-003115-0003,"Bueno, estoy en Nueva York. Son las 18:00 horas y quiero saber a qué hora es en Islandia","Well, I'm in New York. It's 6 p.m. and I want to know what time it is in Iceland",None
METALW-003115-0004,Serían las 10 de la noche en Islandia en esas circunstancias.,It would be 10 a.m. in Iceland in those circumstances.,None
METALW-003115-0005,Bien. ¿Cuál es la diferencia horaria entre los dos,Not bad. What is the time difference between the two,None
METALW-003115-0006,Cuatro horas.,Four hours.,None
METALW-003115-0007,"Por último, ¿Cuándo oscurece en Islandia? cuándo es*","Finally, when does it dark in Iceland? when it is*",None
METALW-003115-0008,Se oscurece alrededor de las 22:00 hora local de esta temporada del año.,It darkens around 22:00 local time this season.,None
METALW-003115-0009,¡Muchas gracias!,Thanks a lot!,None
METALW-003115-0010,De nada. Ten un buen día.,You are welcome. Have a good day.,None
METALW-003116-0000,"Hola, ¿en qué puedo ayudarle?","Hi, how can I help you?",None
METALW-003116-0001,¿Puedes responder una pregunta por mí?,Can you answer a question for me?,None
METALW-003116-0002,"Ciertamente, puedo ayudar con sus preguntas de zona horaria","Certainly, I can help with your time zone questions",None
METALW-003116-0003,eso es lo que me preguntaba. ¿Cómo funcionan las zonas horarias?,that's what I was wondering. How do time zones work?,None
METALW-003116-0004,"Sólo puedo calcular los tiempos en diferentes zonas horarias, no dar información sobre cómo funcionan","I can only calculate times in different time zones, not give information on how they work",None
METALW-003116-0005,¿Así que no puedes decirme dónde empieza la primera zona?,So you can't tell me where the first zone starts?,None
METALW-003116-0006,Sólo puedo calcular zonas horarias,I can only calculate time zones,None
METALW-003116-0007,"Ok, ¿cómo puedo averiguar qué hora es en una zona que está en otro país?","Okay, how can I find out what time it is in an area that's in another country?",None
METALW-003116-0008,No puedo proporcionar información sobre cómo funcionan las zonas horarias,I can't provide information on how time zones work,None
METALW-003116-0009,¿Cuál es la diferencia entre mi zona en Texas y la zona en California?,What is the difference between my area in Texas and the california area?,None
METALW-003116-0010,"Una vez más, no puedo proporcionar información sobre cómo funcionan las zonas horarias","Again, I can't provide information on how time zones work",None
METALW-003116-0011,No creo que seas un bot muy inteligente,I don't think you're a very smart bot.,None
METALW-003116-0012,Ese es tu perogativo.,That's your perogative.,None
METALW-003117-0000,"Hola, ¿en qué puedo ayudarle?","Hi, how can I help you?",None
METALW-003117-0001,Tengo una pregunta sobre las zonas horarias,I have a question about time zones,None
METALW-003117-0002,seguro. ¿Qué necesita saber sobre las zonas horarias?,sure. What do you need to know about time zones?,None
METALW-003117-0003,"si NY es a las 6 pm, ¿qué sería eso en Islandia?","if NY is at 6 p.m., what would that be in Iceland?",None
METALW-003117-0004,"Cuatro horas por delante, así que a las 10 PM","Four hours ahead, so at 10 p.m.",None
METALW-003117-0005,¿Le afecta el horario de verano?,Is daylight saving time affecting you?,None
METALW-003117-0006,"No, siempre son cuatro horas.","No, it's always four hours.",None
METALW-003117-0007,gracias por la información,thanks for the information,None
METALW-003117-0008,No hay problema. ¿Puedo ayudarte con algo más?,No problem. Can I help you with something else?,None
METALW-003117-0009,No,No,None
METALW-003117-0010,Muy bien tener un buen día,All right to have a good day,None
METALW-003118-0000,"Hola, ¿en qué puedo ayudarle?","Hi, how can I help you?",None
METALW-003118-0001,¿Cómo funcionan las zonas horarias?,How do time zones work?,None
METALW-003118-0002,"No puedo decir cómo funcionan, pero puedo calcular los tiempos en diferentes ciudades y países para ti.","I can't tell how they work, but I can calculate times in different cities and countries for you.",None
METALW-003118-0003,"Ok, ¿a qué hora es en Nueva York si es medianoche en Londres?","Okay, what time is it in New York if it's midnight in London?",None
METALW-003118-0004,"Ok, actualmente son las 6 de la mañana en Nueva York si es medianoche en Londres.","Okay, it's currently 6 a.m. in New York if it's midnight in London.",None
METALW-003118-0005,"Ok, ¿hay vuelos entre los dos para mañana?","Okay, are there flights between the two by tomorrow?",None
METALW-003118-0006,Hay dos vuelos disponibles mañana entre Nueva York y Londres.,Two flights are available tomorrow between New York and London.,None
METALW-003118-0007,"Ok, por favor reserva el anterior.","Okay, please book the previous one.",None
METALW-003118-0008,¡He reservado tu vuelo! Te vas mañana a las 6:21 AM.,I booked your flight! You're leaving tomorrow at 6:21 a.m.,None
METALW-003118-0009,¡Gracias!,Thank you!,None
METALW-003118-0010,Que tengas un buen viaje.,Have a nice trip.,None
METALW-003119-0000,"Hola, ¿en qué puedo ayudarle?","Hi, how can I help you?",None
METALW-003119-0001,Necesito información sobre zonas horarias.,I need time zone information.,None
METALW-003119-0002,¿Seguro lo que te gustaría saber?,Are you sure what you'd like to know?,None
METALW-003119-0003,"Im en Nueva York, y sus 6pm. ¿a qué hora es en Islandia?","I'm in New York, and its 6pm. what time is it in Iceland?",None
METALW-003119-0004,Serían las 10 p. m. M.,It would be 10 p.m. M.,None
METALW-003119-0005,Excelente.,excellent.,None
METALW-003119-0006,Maravilloso ¿Tenía alguna otra pregunta en el huso horario?,Wonderful Did you have any other questions in the time zone?,None
METALW-003119-0007,¿Miami está en la misma zona horaria? como Nueva York?,Is Miami in the same time zone? like New York?,None
METALW-003119-0008,"Sí, ambos están en la zona horaria de Eastern Standard","Yes, they're both in the Eastern Standard time zone.",None
METALW-003119-0009,impresionante. Creo que eso es todo.,impressive. I think that's it.,None
METALW-003119-0010,"Bien. Sólo recuerda si necesitas algo, estaré aquí.","Not bad. Just remember if you need anything, I'll be here.",None
METALW-003120-0000,"Hola, ¿en qué puedo ayudarle?","Hi, how can I help you?",None
METALW-003120-0001,¿Qué huso horario en California?,What time zone in California?,None
METALW-003120-0002,"Lo siento, ¿estás preguntando en qué zona horaria está California?","I'm sorry, are you asking what time zone California is in?",None
METALW-003120-0003,Sí,Yes,None
METALW-003120-0004,Hora del Pacífico.,Pacific Time.,None
METALW-003120-0005,¿Qué huso horario en Arizona?,What time zone in Arizona?,None
METALW-003120-0006,Hora de la montaña.,Mountain time.,None
METALW-003120-0007,¿Qué huso horario en Nueva York?,What time zone in New York?,None
METALW-003120-0008,Nueva York está en la zona horaria oriental.,New York is in the eastern time zone.,None
METALW-003120-0009,gracias por su ayuda.,thank you for your help.,None
METALW-003120-0010,De nada.,You are welcome.,None
METALW-003121-0000,"Hola, ¿en qué puedo ayudarle?","Hi, how can I help you?",None
METALW-003121-0001,"Hola, necesito ayuda con las zonas horarias.","Hi, I need help with time zones.",None
METALW-003121-0002,¿Qué ayuda necesitas?,What help do you need?,None
METALW-003121-0003,"Estoy en Nueva York, donde son las 6 pm y necesito saber qué hora es en Islandia.","I'm in New York, where it's 6 p.m. and I need to know what time it is in Iceland.",None
METALW-003121-0004,Serían las 10 de la noche en Islandia en esas circunstancias.,It would be 10 a.m. in Iceland in those circumstances.,None
METALW-003121-0005,Muy bien.,Very well.,None
METALW-003121-0006,¿Necesitas algo más?,Do you need anything else?,None
METALW-003121-0007,Supongo que eso es todo por ahora.,I guess that's it for now.,None
METALW-003121-0008,"Muy bien, bueno, me alegro de poder ayudar.","All right, well, I'm glad I can help.",None
METALW-003121-0009,¡Gracias!,Thank you!,None
METALW-003121-0010,Adiós. Que tengas un buen día.,Good bye. Have a nice day.,None
METALW-003122-0000,"Hola, ¿en qué puedo ayudarle?","Hi, how can I help you?",None
METALW-003122-0001,¿Cuántas horas está Nueva York por delante de Winnipeg?,How many hours is New York ahead of Winnipeg?,None
METALW-003122-0002,Nueva York está una hora por delante de Winnipeg,New York is an hour ahead of Winnipeg,None
METALW-003122-0003,¿Qué hay de Nueva Escocia?,What about Nova Scotia?,None
METALW-003122-0004,Nueva Escocia está una hora por delante de Nueva York.,Nova Scotia is an hour ahead of New York.,None
METALW-003122-0005,¿Qué hora es ahora en Islandia?,What time is it now in Iceland?,None
METALW-003122-0006,Actualmente son las 1:59 PM en Islandia,It's currently 1:59 PM in Iceland,None
METALW-003122-0007,¿Puedes decirme la hora actual en Londres?,Can you tell me the current time in London?,None
METALW-003122-0008,Actualmente son las 259 PM en Londres,It's currently 259 p.m. in London,None
METALW-003122-0009,¡Gracias por toda su ayuda!,Thank you for all your help!,None
METALW-003122-0010,No hay problema,No problem,None
METALW-003123-0000,"Hola, ¿en qué puedo ayudarle?","Hi, how can I help you?",None
METALW-003123-0001,Necesito ayuda con las zonas horarias.,I need help with time zones.,None
METALW-003123-0002,¿Seguro lo que te gustaría saber?,Are you sure what you'd like to know?,None
METALW-003123-0003,"No estoy seguro de cómo funcionan. Cuando viajas al oeste, ¿ganas una hora?","I'm not sure how they work. When you travel west, do you earn an hour?",None
METALW-003123-0004,Lo siento. Sólo puedo calcular las zonas horarias. No propondo información sobre cómo funcionan,I am sorry. I can only calculate time zones. I don't provide information on how they work,None
METALW-003123-0005,"Bueno, ¿sabes si saldré de la zona horaria oriental y vuelo a la zona horaria del Pacífico, gano o pierdo tiempo?","Well, do you know if I'm going to get out of the eastern time zone and fly to the Pacific time zone, win or waste time?",None
METALW-003123-0006,Ni idea. Pero si le das el tiempo en un lugar puedo decirte qué hora es en otro lugar.,"I have no idea. But if you give him the time in one place, I can tell you what time it is somewhere else.",None
METALW-003123-0007,"Si son las 5:00 p.m. en hora del este, ¿qué sería en la hora del Pacífico?","If it's 5:00 p.m in Eastern Time, what would pacific time be?",None
METALW-003123-0008,Serán las 2:00 p.m. hora del Pacífico,It'll be 2:00 p.m. Pacific Time,None
METALW-003123-0009,Así que supongo que pierdo tiempo al ir al oeste. gracias.,So I guess I'm wasted time going west. Thank you.,None
METALW-003123-0010,¡De nada!,You are welcome!,None
METALW-003124-0000,"Hola, ¿en qué puedo ayudarle?","Hi, how can I help you?",None
METALW-003124-0001,Me puedes ayudar,Can you help me,None
METALW-003124-0002,"Sí, puedo darte información sobre las zonas horarias.","Yes, I can give you information about time zones.",None
METALW-003124-0003,acerca de qué hora será en Vancouver,about what time it will be in Vancouver,None
METALW-003124-0004,La hora de Vancouver en este momento es 11:29PM,Vancouver time right now is 11:29PM,None
METALW-003124-0005,"ok, en la medianoche en San Petersburgo ?","ok, at midnight in St. Petersburg?",None
METALW-003124-0006,¿Quieres decir qué hora será en Vancouver si es medianoche en San Petersburgo?,You mean what time it's going to be in Vancouver if it's midnight in St. Petersburg?,None
METALW-003124-0007,Sí,Yes,None
METALW-003124-0008,la hora de Vancouver será a las 10 PM. si es medianoche en San Petersburgo.,Vancouver time will be at 10 p.m. if it's midnight in St. Petersburg.,None
METALW-003124-0009,"Oh, eso es genial. Gracias","Oh, that's great. Thank you",None
METALW-003124-0010,Gracias. ¿Hay algo que pueda ayudar?,Thank you. Is there anything I can help?,None
METALW-003124-0011,"No, gracias",No thanks,None
METALW-003125-0000,"Hola, ¿en qué puedo ayudarle?","Hi, how can I help you?",None
METALW-003125-0001,¡eh! ¿Puede ayudar con las zonas horarias,hey! Can you help with time zones,None
METALW-003125-0002,"Claro, ¿preguntar?","Sure, ask?",None
METALW-003125-0003,¿Cuántas horas por delante de Winnipeg está Nueva York/?,How many hours ahead of Winnipeg is New York/?,None
METALW-003125-0004,Una hora por delante,An hour ahead,None
METALW-003125-0005,¡Oh wow! ¿Qué tan lejos está Londres de Winnipeg?,Oh wow! How far is London from Winnipeg?,None
METALW-003125-0006,Londres está 6 horas por delante,London is 6 hours ahead,None
METALW-003125-0007,¡hombre! ¡No sabía que eran tantos!,man! I didn't know there were so many!,None
METALW-003125-0008,"Sí, está bastante lejos","Yes, it's pretty far away",None
METALW-003125-0009,Gracias por la información!,Thanks for the information!,None
METALW-003125-0010,¡Claro!,Of course!,None
METALW-003126-0000,"Hola, ¿en qué puedo ayudarle?","Hi, how can I help you?",None
METALW-003126-0001,¿Cómo funcionan las diferentes zonas horarias?,How do different time zones work?,None
METALW-003126-0002,"lo siento, no estoy equipado para proporcionar información sobre cómo funciona la zona horaria. Sólo puedo calcular la hora en diferentes zonas horarias.","I'm sorry, I'm not equipped to provide information on how the time zone works. I can only calculate the time in different time zones.",None
METALW-003126-0003,¿Cuál es la diferencia entre el tiempo oriental y el pacífico?,What is the difference between Eastern and Pacific weather?,None
METALW-003126-0004,tres horas.,three hours.,None
METALW-003126-0005,este y centro?,east and center?,None
METALW-003126-0006,una hora.,an hour.,None
METALW-003126-0007,este e Italia?,East and Italy?,None
METALW-003126-0008,12 horas.,12 hours.,None
METALW-003126-0009,¡eres inteligente!,You're smart!,None
METALW-003126-0010,Gracias. que tenga un día maravilloso.,Thank you. have a wonderful day.,None
METALW-003127-0000,"Hola, ¿en qué puedo ayudarle?","Hi, how can I help you?",None
METALW-003127-0001,¿Sabes cómo funcionan las zonas horarias?,Do you know how time zones work?,None
METALW-003127-0002,Puedo decirte en qué hora hay en otra zona horaria,I can tell you what time it is in another time zone,None
METALW-003127-0003,"Si vuelo de Nueva York a California,¿cuántas zonas horarias paso?","If I fly from New York to California, how many time zones do I pass?",None
METALW-003127-0004,Te puedo decir a qué hora está en California,I can tell you what time he's in California.,None
METALW-003127-0005,Quiero saber cuántas zonas horarias pasaré,I want to know how many time zones I'll spend,None
METALW-003127-0006,Son las cuatro de la madrugada en California cuando son las 14:00 horas en Nueva York,It's four o'clock in the morning in California when it's 2 p.m. in New York.,None
METALW-003127-0007,"Ok, ¿pero cuántas zonas horarias hay?","Okay, but how many time zones are there?",None
METALW-003127-0008,hay zonas horarias en todo el mundo,there are time zones around the world,None
METALW-003127-0009,"Bueno, esto no ayuda. Lo intentaré en otro momento. Gracias de todos modos","Well, this doesn't help. I'll try some other time. Thanks anyway",None
METALW-003127-0010,¡Buena suerte!,Good luck!,None
METALW-003128-0000,"Hola, ¿en qué puedo ayudarle?","Hi, how can I help you?",None
METALW-003128-0001,ayúdame con zonas horarias,help me with time zones,None
METALW-003128-0002,"Claro, puedo ayudarte con las zonas horarias ¿Qué te gustaría saber?","Sure, I can help you with time zones What would you like to know?",None
METALW-003128-0003,¿A qué hora es en Islandia si son las 6 pm en Nueva York?,What time is it in Iceland if it's 6pm in New York?,None
METALW-003128-0004,"Bien, buscando una respuesta....","Well, looking for an answer....",None
METALW-003128-0005,Gracias,Thank you,None
METALW-003128-0006,Serían las 22:00 horas en Islandia si son las 18:00 horas en Nueva York,It would be 22:00 a.m. in Iceland if it's 6 p.m. in New York,None
METALW-003128-0007,¿en qué huso horario se encuentra Islandia?,What time is Iceland located?,None
METALW-003128-0008,Islandia está en Greenwich Mean Time,Iceland is in Greenwich Mean Time,None
METALW-003128-0009,ok gracias por esa información,ok thank you for that information,None
METALW-003128-0010,¿Te gustaría saber algo más?,Would you like to know something else?,None
METALW-003128-0011,No,No,None
METALW-003129-0000,"Hola, ¿en qué puedo ayudarle?","Hi, how can I help you?",None
METALW-003129-0001,Voy a Winnipeg pronto y quiero saber la diferencia horaria que es de Nueva York. Si son las 6pm NY ¿a qué hora está en Winnipeg?,"I'm going to Winnipeg soon, and I want to know the time difference he's from New York. What time is it in Winnipeg?",None
