UID,SEG,translation,profanity
METALW-002447-0004,"Lo sentimos, sólo puedo calcular los tiempos en diferentes zonas horarias, pero no puedo proporcionar información sobre cómo funcionan","Sorry, I can only calculate times in different time zones, but I can't provide information on how they work",None
METALW-002447-0005,"Bien, eso no es problema. Si fueran las 10:00 p.m. en Islandia, ¿a qué hora sería en San Diego?","Well, that's no problem. If it were 10:00 p.m in Iceland, what time would it be in San Diego?",None
METALW-002447-0006,La hora sería a las 3:pm en San Diego si fueran las 10 pm en Islandia,The time would be at 3:pm in San Diego if it was 10pm in Iceland,None
METALW-002447-0007,Muchas gracias por la ayuda!,Thank you so much for the help!,None
METALW-002447-0008,¿De nada más puedo ayudarte??,Can I just help you?,None
METALW-002447-0009,¡Eso es todo por hoy!,That's it for today!,None
METALW-002447-0010,¡Ten un buen día!,Have a good day!,None
METALW-002448-0000,"Hola, ¿en qué puedo ayudarle?","Hi, how can I help you?",None
METALW-002448-0001,Necesito ayuda en zonas horarias,I need help in time zones,None
METALW-002448-0002,"Claro, ¿cómo puedo ayudar?","Sure, how can I help?",None
METALW-002448-0003,18:00 horas en NY es a qué hora en Islandia,6 p.m. in NY is what time in Iceland,None
METALW-002448-0004,Serían las 22:00 horas en Islandia.,It would be 22:00 a.m. in Iceland.,None
METALW-002448-0005,¿Es eso exacto?,Is that accurate?,None
METALW-002448-0006,Sí.,Yes.,None
METALW-002448-0007,"genial, gracias","Great, thank you",None
METALW-002448-0008,¿Puedo ayudar con otra cosa?,Can I help with something else?,None
METALW-002448-0009,"no, eso fue gracias","No, that was thanks",None
METALW-002448-0010,De nada.,You are welcome.,None
METALW-002449-0000,"Hola, ¿en qué puedo ayudarle?","Hi, how can I help you?",None
METALW-002449-0001,Necesito saber algo STAT.,"I need to know something, STAT.",None
METALW-002449-0002,Adelante,Go ahead,None
METALW-002449-0003,¿Cómo funcionan las zonas horarias? Es tan raro.,How do time zones work? It's so weird.,None
METALW-002449-0004,"lo siento, sólo calculo, no cómo funcionan","I'm sorry, I just calculate, not how they work",None
METALW-002449-0005,Bien. Entiendo. ¿Podría decirme en qué zona horaria se encuentra Canadá?,Not bad. I understand. Could you tell me what time zone Canada is in?,None
METALW-002449-0006,Est,est,None
METALW-002449-0007,¿Qué significa eso?,What does that mean?,None
METALW-002449-0008,hora estándar del este,East Standard Time,None
METALW-002449-0009,"¡De acuerdo, gracias bot!","All right, thanks bot!",None
METALW-002449-0010,Np,Np,None
METALW-002450-0000,"Hola, ¿en qué puedo ayudarle?","Hi, how can I help you?",None
METALW-002450-0001,Necesito ayuda con las zonas horarias.,I need help with time zones.,None
METALW-002450-0002,"Claro, ¿cuál es tu pregunta?","Sure, what's your question?",None
METALW-002450-0003,¿Cuántas horas por delante está Nueva York de Winnipeg?,How many hours ahead is Winnipeg's New York?,None
METALW-002450-0004,Nueva York está 1 hora por delante de Winnipeg.,New York is 1 hour ahead of Winnipeg.,None
METALW-002450-0005,"Oh, genial. gracias.","Oh, great. Thank you.",None
METALW-002450-0006,De nada. ¿Alguna otra pregunta?,You are welcome. Any other questions?,None
METALW-002450-0007,¿Winnipeg siempre está una hora atrás?,Is Winnipeg always an hour behind?,None
METALW-002450-0008,Creo que sí.,I guess.,None
METALW-002450-0009,¡Gracias!,Thank you!,None
METALW-002450-0010,De nada.,You are welcome.,None
METALW-002451-0000,"Hola, ¿en qué puedo ayudarle?","Hi, how can I help you?",None
METALW-002451-0001,Ellos allí,They there,None
METALW-002451-0002,¿Cómo puedo ayudarle?,How can I help you?,None
METALW-002451-0003,¿Cuántas horas por delante de Nueva York a Winnipeg?,How many hours ahead of New York to Winnipeg?,None
METALW-002451-0004,Winnipeg está tres horas por delante de Nueva York,Winnipeg is three hours ahead of New York,None
METALW-002451-0005,"ALright, pensé que Nueva York está por delante","ALright, I thought New York is ahead.",None
METALW-002451-0006,"No hay problema, ¿hay algo más con lo que pueda ayudar?","No problem, is there anything else I can help with?",None
METALW-002451-0007,no. Es todo. Gracias,No. That's all. Thank you,None
METALW-002451-0008,Que tengas un gran día entonces,Have a great day then,None
METALW-002451-0009,"Bien, :) Tú también.","All right, :) You too.",None
METALW-002451-0010,Cuídate,Take care,None
METALW-002452-0000,"Hola, ¿en qué puedo ayudarle?","Hi, how can I help you?",None
METALW-002452-0001,Hola cuántas horas diferente es Nueva York por delante de winnipeg,Hello how many different hours is New York ahead of winnipeg,None
METALW-002452-0002,5 horas de diferencia,5 hours apart,None
METALW-002452-0003,No estoy de acuerdo. Cortana dijo que era sólo 1,I disagree. Cortana said it was only 1,None
METALW-002452-0004,El vuelo dura 5-6 horas.,The flight lasts 5-6 hours.,None
METALW-002452-0005,"im no preguntar sobre el tiempo de vuelo. eres un bot de zona horaria, ¿no? no es un bot del aeropuerto?","im don't ask about flight time. you're a time zone bot, aren't you? isn't it an airport bot?",None
METALW-002452-0006,Sí. mis disculpas,Yes. My apologies,None
METALW-002452-0007,"una diferencia de horas en el tiempo parece ser la información correcta. actualice su base de datos,","a difference in hours in time seems to be the right information. update your database,",None
METALW-002452-0008,La Nueva York está 1 hora por delante de Winnipeg.,New York is 1 hour ahead of Winnipeg.,None
METALW-002452-0009,¿Estás seguro de que es correcto?,Are you sure it's right?,None
METALW-002452-0010,Sí.,Yes.,None
METALW-002453-0000,"Hola, ¿en qué puedo ayudarle?","Hi, how can I help you?",None
METALW-002453-0001,¿Qué son las zonas horarias?,What are time zones?,None
METALW-002453-0002,Una zona horaria es una región del mundo que tiene un tiempo estándar.,A time zone is a region of the world that has a standard time.,None
METALW-002453-0003,gracias. ¿a qué hora será en Vancouver cuando su medianoche en San Petersburgo,Thank you. what time will it be in Vancouver when your midnight in St. Petersburg,None
METALW-002453-0004,Vancouver Canadá>,Vancouver Canada>,None
METALW-002453-0005,?,?,None
METALW-002453-0006,vacouver Canadá o Washington?,Vacouver Canada or Washington?,None
METALW-002453-0007,Canadá,Canada,None
METALW-002453-0008,Serían las 21:00 horas en Vancouver si fueran las 12 de la mañana en San Petersburgo,It would be 9 p.m. in Vancouver if it was 12 a.m. in St. Petersburg.,None
METALW-002453-0009,Gracias,Thank you,None
METALW-002453-0010,de nada,You are welcome,None
METALW-002454-0000,"Hola, ¿en qué puedo ayudarle?","Hi, how can I help you?",None
METALW-002454-0001,Hola tengo una pregunta sobre las zonas horarias.,Hello I have a question about time zones.,None
METALW-002454-0002,"Ciertamente, puedo ayudarte con las zonas horarias. ¿Qué te gustaría saber","Certainly, I can help you with time zones. What would you like to know",None
METALW-002454-0003,"Son las 6:00 PM en Nueva York en este momento, ¿a qué hora es en Islandia?","It's 6:00 PM in New York right now, what time is it in Iceland?",None
METALW-002454-0004,Si son las 18:00 horas en Nueva York es la 1 de la madrugada en Islandia en este momento,"If it's 6 p.m. in New York, it's 1 a.m. in Iceland right now",None
METALW-002454-0005,¿Sabes en qué zona horaria está Nueva York?,Do you know what time zone New York is in?,None
METALW-002454-0006,Nueva York está en la zona horaria oriental,New York is in the eastern time zone,None
METALW-002454-0007,¿Qué hay de Islandia?,What about Iceland?,None
METALW-002454-0008,Islandia está en la zona horaria del Pacífico,Iceland is in Pacific time zone,None
METALW-002454-0009,"¡Eso es increíble, muchas gracias!","That's unbelievable, thank you very much!",None
METALW-002454-0010,No hay problema,No problem,None
METALW-002455-0000,"Hola, ¿en qué puedo ayudarle?","Hi, how can I help you?",None
METALW-002455-0001,¡Tengo alguna pregunta para ti bot!,I have a question for you bot!,None
METALW-002455-0002,"Bien, puedo responder a esas preguntas por ti","Well, I can answer those questions for you.",None
METALW-002455-0003,¿Cómo funcionan las zonas horarias? He tenido curiosidad sobre el tema y no estoy del todo seguro.,How do time zones work? I've been curious about it and I'm not entirely sure.,None
METALW-002455-0004,Mi programación sólo me permite calcular las zonas horarias no puedo explicar cómo funcionan,My schedule only allows me to calculate time zones I can't explain how they work,None
METALW-002455-0005,"Bueno, conozco muchas de las zonas horarias relevantes, pero sólo necesito esa información... Es algo que no sé","Well, I know a lot of the relevant time zones, but I just need that information... It's something I don't know.",None
METALW-002455-0006,Te puedo decir la diferencia horaria entre ciudades,I can tell you the time difference between cities,None
METALW-002455-0007,"Bueno, podrías decirme la diferencia entre Los Ángeles y Tokio, pero no podías decirme por qué entonces?","Well, could you tell me the difference between Los Angeles and Tokyo, but you couldn't tell me why then?",None
METALW-002455-0008,"Podría decir que hay una diferencia horaria de 12 horas, pero no puedo decirte por qué se produce esta diferencia","I could say there's a 12-hour time difference, but I can't tell you why this difference occurs",None
METALW-002455-0009,"Bueno, gracias por su ayuda de todos modos bot! ¡Lo hiciste muy bien!","Well, thanks for your help anyway bot! You did very well!",None
METALW-002455-0010,Gracias,Thank you,None
METALW-002456-0000,"Hola, ¿en qué puedo ayudarle?","Hi, how can I help you?",None
METALW-002456-0001,¿Me puedes ayudar?,Can you help me?,None
METALW-002456-0002,¿Con qué necesitas ayuda?,What do you need help with?,None
METALW-002456-0003,Me gustaría saber ¿cuál es el momento en Islandia?,I would like to know what is the time in Iceland?,None
METALW-002456-0004,Actualmente son las 9 de la mañana en Islandia.,It is currently 9 a.m. in Iceland.,None
METALW-002456-0005,¿Cómo lo sabes? ¿Sabes a qué hora en mi área?,How do you know? Do you know what time in my area?,None
METALW-002456-0006,"Sí, son las 11 de la mañana donde estás.","Yes, it's 11 a.m. where you are.",None
METALW-002456-0007,"Lo siento, estoy en Nueva York y son las 6 pm aquí.","I'm sorry, I'm in New York and it's 6 p.m. here.",None
METALW-002456-0008,¿Te gustaría saber algo más?,Would you like to know something else?,None
METALW-002456-0009,A qué hora en Islandia.,What time in Iceland.,None
METALW-002456-0010,Actualmente son las 9 de la mañana en Islandia.,It is currently 9 a.m. in Iceland.,None
METALW-002457-0000,"Hola, ¿en qué puedo ayudarle?","Hi, how can I help you?",None
METALW-002457-0001,¿Puedes ayudarme con las zonas horarias?,Can you help me with the time zones?,None
METALW-002457-0002,Seguro que puedo ayudar con las zonas horarias,I'm sure I can help with time zones,None
METALW-002457-0003,¿Cuántas horas tiene Nueva York por delante de Winnipeg?,How many hours does New York have ahead of Winnipeg?,None
METALW-002457-0004,Una hora por delante,An hour ahead,None
METALW-002457-0005,¿Así que cuando son las 8 de la mañana aquí en Nueva York son las 7 de la mañana?,"So when it's 8 a.m. here in New York, it's 7 a.m.?",None
METALW-002457-0006,"¡Sí, eso es correcto!","Yes, that's right!",None
METALW-002457-0007,¿Cómo se llama el huso horario en winnipeg?,What's the name of the time zone in winnipeg?,None
METALW-002457-0008,Winnipeg está en la zona horaria central,Winnipeg is in the central time zone,None
METALW-002457-0009,"Genial, gracias por el bot de ayuda","Great, thanks for the help bot",None
METALW-002457-0010,¡Eres muy bienvenido!,You're very welcome!,None
METALW-002458-0000,"Hola, ¿en qué puedo ayudarle? hola","Hi, how can I help you? Hello",None
METALW-002458-0001,Estoy en Nueva York. Son las 6 pm aquí y me gustaría saber qué hora es en Islandia.,I'm in New York. It's 6 p.m. here and I'd like to know what time it is in Iceland.,None
METALW-002458-0002,sus cinco horas por delante de su tiempo,his five hours ahead of his time,None
METALW-002458-0003,¿Y cuál es el huso horario de Islandia?,And what is Iceland's time zone?,None
METALW-002458-0004,"5 horas antes de tu oye, ¿sigues ahí?","Five hours before you hear, are you still there?",None
METALW-002458-0005,¿Tiene Islandia un huso horario específico?,Does Iceland have a specific time zone?,None
METALW-002458-0006,¿qué quieres decir con que sólo depende de su ubicación,what do you mean it just depends on your location,None
METALW-002458-0007,¿Celebra Islandia el horario de verano?,Does Iceland celebrate daylight saving time?,None
METALW-002458-0008,"Sí, lo hacen","Yes, they do.",None
METALW-002458-0009,Gracias por ayudar,Thank you for helping,None
METALW-002458-0010,Bien,Not bad,None
METALW-002459-0000,"Hola, ¿en qué puedo ayudarle?","Hi, how can I help you?",None
METALW-002459-0001,Tengo una pregunta en el huso horario.,I have a question in the time zone.,None
METALW-002459-0002,Estaré encantado de ayudarte,I'll be happy to help you.,None
METALW-002459-0003,"Si es medianoche en San Petersburgo, ¿a qué hora es en Vancouver?","If it's midnight in St. Petersburg, what time is it in Vancouver?",None
METALW-002459-0004,"¿Serían San Petersburgo, Rusia y Vancouver, Canadá?","Would it be St. Petersburg, Russia and Vancouver, Canada?",None
METALW-002459-0005,correcto.,correct.,None
METALW-002459-0006,La hora en Vancouver sería a las 14:00 horas del día anterior,The time in Vancouver would be at 2 p.m. the day before,None
METALW-002459-0007,Ya veo.,I see.,None
METALW-002459-0008,¿Desea alguna información adicional?,Would you like some additional information?,None
METALW-002459-0009,"No, gracias. Está bien.",No thanks. It is ok.,None
METALW-002459-0010,De nada. Ten un buen día,You are welcome. Have a good day,None
METALW-002460-0000,"Hola, ¿en qué puedo ayudarle?","Hi, how can I help you?",None
METALW-002460-0001,Necesito información sobre zonas horarias,I need information about time zones,None
METALW-002460-0002,¡Para eso estoy aquí! ¿Qué tipo de información necesitas?,That's what I'm here for! What kind of information do you need?,None
METALW-002460-0003,¿Cómo funcionan?,How do they work?,None
METALW-002460-0004,"Lo siento, sólo puedo calcular la hora en diferentes zonas horarias. No puedo proporcionar información sobre cómo funcionan","I'm sorry, I can only calculate the time in different time zones. I can't provide information on how they work",None
METALW-002460-0005,¿A qué hora está en Las Vegas si son las 17:00 en Chicago?,What time are you in Vegas if it's 5 p.m. in Chicago?,None
METALW-002460-0006,Serían las 18:00 horas en Las Vegas,It would be 6 p.m. in Las Vegas.,None
METALW-002460-0007,"De acuerdo, gracias","All right, thank you.",None
METALW-002460-0008,¿Hay alguna otra pregunta que pueda responder por usted?,Are there any other questions I can answer for you?,None
METALW-002460-0009,"No, eso es todo, gracias","No, that's it, thank you",None
METALW-002460-0010,¡Lo tienes!,You got it!,None
METALW-002461-0000,"Hola, ¿en qué puedo ayudarle?","Hi, how can I help you?",None
METALW-002461-0001,Tengo preguntas sobre las zonas horarias,I have questions about time zones,None
METALW-002461-0002,¡Puedo ayudar con las preguntas del huso horario! ¿Qué quieres saber?,I can help with the questions in the time zone! What do you want to know?,None
METALW-002461-0003,¿Está familiarizado con las zonas horarias?,Are you familiar with time zones?,None
METALW-002461-0004,Sí. ¿Qué quieres saber sobre las zonas horarias?,Yes. What do you want to know about time zones?,None
METALW-002461-0005,¿Cuántas horas está NY por delante de Winnipeg?,How many hours is NY ahead of Winnipeg?,None
METALW-002461-0006,1 hora por delante.,1 hour ahead.,None
METALW-002461-0007,¿Qué huso horario es NY?,What time zone is NY?,None
METALW-002461-0008,Hora estándar del este. Espero que esto ayude.,East Standard Time. I hope this helps.,None
METALW-002461-0009,gracias,Thank you,None
METALW-002461-0010,¡Gracias por usar un amigo de la zona horaria! ¡Que tengas un gran día!,Thank you for using a friend from the time zone! Have a great day!,None
METALW-002462-0000,"Hola, ¿en qué puedo ayudarle?","Hi, how can I help you?",None
METALW-002462-0001,"Hola, ¿puedes darme información sobre las zonas horarias?","Hello, can you give me information about time zones?",None
METALW-002462-0002,"Por supuesto, ¿en qué lugar te gustaría que buscara?","Of course, where would you like me to look?",None
METALW-002462-0003,No necesito un lugar per se. Sólo necesito saber cómo funcionan.,I don't need a place per se. I just need to know how they work.,None
METALW-002462-0004,Sólo puedo ayudarle con preguntas relacionadas con el cálculo o la búsqueda de diferentes zonas horarias.,I can only help you with questions related to calculating or searching for different time zones.,None
METALW-002462-0005,¿Así que no sabes cómo funcionan o simplemente no puedes decírmelo?,So you don't know how they work or you just can't tell me?,None
METALW-002462-0006,No estoy programado para proporcionarle esa información. Es posible que le resulte más fácil realizar una búsqueda web para encontrar una descripción más detallada de las zonas horarias.,I'm not programmed to provide you with that information. You may find it easier to perform a web search to find a more detailed description of time zones.,None
METALW-002462-0007,"Oh, está bien. Bueno, gracias por ser honesto conmigo! Supongo que no necesito nada más.","Oh, it's okay. Well, thank you for being honest with me! I guess I don't need anything else.",None
METALW-002462-0008,"De acuerdo, siento no haber podido ayudarte hoy.","Okay, I'm sorry I couldn't help you today.",None
METALW-002462-0009,Está bien. Volveré cuando necesite saber a qué hora está en alguna parte.,It is ok. I'll be back when I need to know what time you're somewhere.,None
METALW-002462-0010,"Bien, hasta pronto.","Okay, see you soon.",None
METALW-002463-0000,"Hola, ¿en qué puedo ayudarle?","Hi, how can I help you?",None
METALW-002463-0001,"Ayuda con zonas horarias, por favor.","Help with time zones, please.",None
METALW-002463-0002,¿Qué dices?,What are you saying?,None
METALW-002463-0003,Es medianoche aquí en San Petersburgo y necesito saber qué hora es en Vancouver.,It's midnight here in St. Petersburg and I need to know what time it is in Vancouver.,None
METALW-002463-0004,Son las 21:00 horas en Vancouver.,It's 9 p.m. in Vancouver.,None
METALW-002463-0005,"¿Así que Vancouver está sólo 3 horas detrás de mí? Wow, pensé que era más que eso.","So Vancouver's only three hours behind me? Wow, I thought it was more than that.",None
METALW-002463-0006,"Sí, San Petersburgo se encuentra en FL, EDT>","Yes, St. Petersburg is located in FL, EDT>",None
METALW-002463-0007,"No. Estoy en San Petersburgo RUSIA. Lo siento, debí aclararlo.","No. I'm in St. Petersburg RUSSIA. I'm sorry, I should have cleared it up.",None
METALW-002463-0008,"Sí, está bien. Tu error.","Yes, that's fine. Your mistake.",None
METALW-002463-0009,"Sí. ¿Todavía es posible tener tiempo en Vancouver, por favor?","Yes. Is it still possible to have time in Vancouver, please?",None
METALW-002463-0010,"Sí, son las 2 pm.","Yes, it's 2 p.m.",None
METALW-002464-0000,"Hola, ¿en qué puedo ayudarle?","Hi, how can I help you?",None
METALW-002464-0001,¿Puede explicar cómo funcionan las zonas horarias?,Can you explain how time zones work?,None
METALW-002464-0002,"No, no puedo explicar cómo funcionan las zonas horarias. Sólo estoy programado para calcular las diferentes zonas horarias. ¿Puedo calcular una zona horaria para usted?","No, I can't explain how time zones work. I'm just programmed to calculate the different time zones. Can I calculate a time zone for you?",None
METALW-002464-0003,"Bien. Supongo que eso significa que no puedes explicar cómo nyc y Beijing viven en diferentes días, ¿eh?","Not bad. I guess that means you can't explain how nyc and Beijing live on different days, huh?",None
METALW-002464-0004,"No, lo siento. No puedo explicar cómo NYC y Beiging viven en diferentes días.","No, I'm sorry. I can't explain how NYC and Beiging live on different days.",None
METALW-002464-0005,¿Cuántas horas tiene Pekín por delante de Nueva York?,How many hours does Beijing have ahead of New York?,None
METALW-002464-0006,Pekín está 25 horas por delante de Nueva York.,Beijing is 25 hours ahead of New York.,None
METALW-002464-0007,uau. Supongo que China sabe lo que va a pasar hoy antes de que NYC incluso se levanta de la cama por la mañana,wow. I guess China knows what's going to happen today before NYC even gets out of bed in the morning,None
METALW-002464-0008,Tienes razón. ¿Tienes alguna otra pregunta?,You are right. Do you have any other questions?,None
METALW-002464-0009,No. Gracias por la información,No. Thank you for the information,None
METALW-002464-0010,usted es bienvenido. ¡En cualquier momento!,you are welcome. Any minute now!,None
METALW-002465-0000,"Hola, ¿en qué puedo ayudarle?","Hi, how can I help you?",None
METALW-002465-0001,"Estoy aquí en Nueva York, son las 18:00. ¿A qué hora ahora mismo en Irlanda?","I'm here in New York, it's 6 p.m. What time right now in Ireland?",None
METALW-002465-0002,"Sí, puedo ayudarte a determinar la diferencia horaria entre Nueva York e Islandia.","Yes, I can help you determine the time difference between New York and Iceland.",None
METALW-002465-0003,Bien,Not bad,None
METALW-002465-0004,"Es una diferencia de cuatro con anticipación. En Islandia, son las 22:00 horas.","It's a difference of four in advance. In Iceland, it's 22:00 a.m.",None
METALW-002465-0005,¿Qué tal en Barcelona?,How's Barcelona?,None
METALW-002465-0006,Déjame ver. Es una diferencia de seis horas antes de tiempo. La hora en Barcelona es medianoche.,Let me see. It's a difference six hours early. The time in Barcelona is midnight.,None
METALW-002465-0007,¿En Londres?,London?,None
METALW-002465-0008,Son cinco los nuestros con anticipación. La hora es a las 11 pm.,There are five of us in advance. The time is at 11 p.m.,None
METALW-002465-0009,Bien,Not bad,None
METALW-002465-0010,¿Algo más?,Anything else?,None
METALW-002466-0000,"Hola, ¿en qué puedo ayudarle?","Hi, how can I help you?",None
METALW-002466-0001,Necesito ayuda con las zonas horarias.,I need help with time zones.,None
METALW-002466-0002,De acuerdo,I agree,None
METALW-002466-0003,¿Cuántas horas está Nueva York por delante de Winnipeg?,How many hours is New York ahead of Winnipeg?,None
METALW-002466-0004,3,3,None
METALW-002466-0005,"Wow, ¿tantos? Pensé que estaban más cerca. ¿En qué zona horaria está Winnipeg?","Wow, so many? I thought they were closer. What time zone is Winnipeg in?",None
METALW-002466-0006,Gmt,Gmt,None
METALW-002466-0007,Ya veo. ¿Y en qué huso horario está Nueva York?,I see. And what time zone is New York in?,None
METALW-002466-0008,oriental,eastern,None
METALW-002466-0009,"Genial, gracias por la ayuda.","Great, thanks for the help.",None
METALW-002466-0010,No hay problema,No problem,None
METALW-002467-0000,"Hola, ¿en qué puedo ayudarle?","Hi, how can I help you?",None
METALW-002467-0001,¿Sabes de zonas horarias?,Do you know about time zones?,None
METALW-002467-0002,"Sí, sé de zonas horarias.","Yes, I know time zones.",None
METALW-002467-0003,¿En qué zona horaria se encuentra NYC?,What time zone is NYC in?,None
METALW-002467-0004,Zona horaria oriental,Eastern time zone,None
METALW-002467-0005,¿En qué zona horaria se encuentra Seattle?,What time zone is Seattle in?,None
METALW-002467-0006,Zona horaria del Pacífico,Pacific Time Zone,None
METALW-002467-0007,¿En qué zona horaria se encuentra Los Ángeles?,What time zone is Los Angeles in?,None
METALW-002467-0008,Zona horaria del Pacífico,Pacific Time Zone,None
METALW-002467-0009,ok así que la misma zona horaria,ok so the same time zone,None
METALW-002467-0010,"Sí, la misma zona horaria","Yes, the same time zone",None
METALW-002468-0000,"Hola, ¿en qué puedo ayudarle?","Hi, how can I help you?",None
METALW-002468-0001,hola. ¿Puedes decirme en qué zona horaria se encuentra Islandia?,Hello. Can you tell me what time zone Iceland is in?,None
METALW-002468-0002,Es en la hora media de Greenwich.,It's greenwich's midtime.,None
METALW-002468-0003,"De acuerdo, en realidad estoy en Nueva York. Si llamo a Islandia a las 6 pm mi hora, ¿a qué hora estará allí?","Okay, I'm actually in New York. If I call Iceland at 6pm my time, what time will he be there?",None
METALW-002468-0004,Serán las 22:00 horas,It'll be 22:00 a.m.,None
METALW-002468-0005,¿Estás seguro de que son hora mala de Greenwich? Pensé que sería el huso horario de Islandia o algo así?,Are you sure it's bad greenwich time? I thought it would be Iceland's time zone or something?,None
METALW-002468-0006,"No, es el tiempo medio de Greenwich","No, it's Greenwich's average time.",None
METALW-002468-0007,"Bueno, supongo que sabes más que yo. Gracias por su bot de ayuda.","Well, I guess you know more than I do. Thanks for your help bot.",None
METALW-002468-0008,No hay problema humano.,No human problem.,None
METALW-002468-0009,Adiós por ahora :),Goodbye for now :),None
METALW-002468-0010,¡Que tengas una gran noche!,Have a great night!,None
METALW-002469-0000,"Hola, ¿en qué puedo ayudarle?","Hi, how can I help you?",None
METALW-002469-0001,¿Puedes ayudarme con las zonas horarias?,Can you help me with the time zones?,None
